url,title,post_date,검색어,브랜드 명,content,content_cnt,content_line,quote,quote_cnt,first_img,last_img,img_cnt,솔직 빈도 수,비교 빈도 수,ㅋ 빈도 수,ㅋㅋ 빈도 수,ㅋㅋㅋ 빈도 수,ㅋㅋㅋㅋ 빈도 수,... 빈도 수,.... 빈도 수,ㅜ 빈도 수,ㅜㅜ 빈도 수,ㅜㅜㅜ 빈도 수,ㅜㅜㅜㅜ 빈도 수,ㅠ 빈도 수,ㅠㅠ 빈도 수,ㅠㅠㅠ 빈도 수,ㅠㅠㅠㅠ 빈도 수,장점 빈도 수,단점 빈도 수,비속어 빈도 수,허락 키워드,내돈내산 키워드,리얼후기 키워드,협찬 키워드,체험단 키워드,coupa.ng 키워드,< 키워드,> 키워드,♡ 키워드,♥ 키워드,구매후기 키워드,한달 키워드,두달 키워드,세달 키워드,광고 분류1,광고 분류2
https://blog.naver.com/PostView.naver?blogId=a10000du&logNo=222534046427,인스탁스 미니11 폴라로이드카메라 후기,20211011,미니11 리뷰,인스탁스 ,"안녕하세요~ 카메라쟁이 안만두입니다:-) 저는 대학 새내기시절 수동필카 수업을 들은 뒤로 아날로그의 매력을 제대로 알아버렸어요ㅎㅎ 안그래도 어린시절부터 만두맘께서 늘 필름을 구입해 즉석카메라로 매 순간 자라는 모습을 담아주셔서 친정에가면 제 사진만 천장이 넘어 갈 정도로 인화된 옛사진이 정말 많은데요. 요즘은 디카와 스마트폰의 발달로 인해 사진관에 들러 인화하지 않아도 디지털화 되어 파일로 저장하다보니 실물 사진을 만질 수 있는 기회가 적은 것 같더라고요... 물론 디지털화 되어 저장된 사진파일은 부피가 적다는 장점이 있지만 저장해둔 컴퓨터나 외장하드가 망가져버리거나 분실되면 그 추억을 영영 찾을 수 없단 단점 있는데다가 파워관종 안만두는ㅋㅋ 기념일이나 캠핑장에서의 기록을 조금 더 특별하게 남기고 싶어 폴라로이드카메라로 종종 사진을 남기곤 해요~ 그 중에서도 저는 후지미니 즉석카메라가 예쁘고 컴팩트한 사이즈이였기에 이십대시절부터 핑크색의 7시리즈를 구입해 갖고 있었는데요, 이사하면서 저의 오래된 미니7을 잃어버리게 되어 이번에 새롭게 연보랏빛의 사랑스러운 인스탁스 미니11을 사용해보게 되었습니다. 폴라로이드카메라와 폴꾸키트를 함께 세트로 만날 수 있었어요. 먼저 오늘의 주인공 라일락 퍼플 컬러가 너무나도 사랑스러운 인스탁스 미니 11 입니다:) 제가 기존에 소장하고있던 미니7시리즈는 회색에 핑크포인트를 갖고 있어 시간이 지나 때가 많이 탄 것 처럼보여 케이스를 씌워 사용했고 워낙 옛날에 출시된 모델이라 셀카도 안되었지만 대학시절 용돈 모아 구입했었고 그 아이로도 좋은 추억을 많이 담았었기 때문에 쉽게 바꾸지 못하고 있었는데 이렇게 이사하며 분실 돼 새 즉석 폴라로이드를 들이게 되었네요ㅎㅎ 어딘가에서 mini7이 잘 살아있길 바라며 새로운 카메라를 본격적으로 소개해드리도록 하겠습니다. 먼저 구성품으로 설명서와 사용되는 AA건전기 2알 그리고 스트립과 악세사리가 함께 들어 있었어요 앞서 말씀드렸든 예전에 나왔던 모델들은 셀피모드가 안되어 셀카를 남겼을 때 초점이 흐리고 렌즈 옆에 셀프 미러가 없었기에 구도 잡기가 어려웠었는데요~ 아날로그 감성을 지닌 폴라로이드카메라 이지만 편의성을 고려해 셀피를 찍을 때 렌즈 옆 작은 볼록거울을 보며 사진을 찍으면 되어 실패 확률도 낮고 심지어 셀피모드로 가까운 곳에서 클로우즈업샷을 담아도 오케이~ 더라고요. 이렇게만 변했어도 저는 엄청 좋아졌다~ 이전에 사용하며 느낀 부족한 점들을 섬세하게도 개선해줬네~ 싶었거든요? 근데 요기에 자동노출기능까지 들어 있어 맑은날 흐린날 모드 선택하지 않고 가볍게 셔터만 누름 되니 카알못들이 사용하기에도 넘나 좋아졌더라고요ㅎㅎ 인스탁스 미니11 작동방법은 기본으로 동봉되어 있는 건전지를 측면 커버를 열고 안내에 맞추어 넣어 주고 뒤로 돌려 instax라고 적힌 뒷커버의 윗부분을 열어 전용 즉석필름을 넣은 뒤 딸칵하는 소리가 나도록 눌러 닫아줍니다. 그 뒤 렌즈를 잡고 당긴 뒤 찍으면 돼요~ 렌즈를 당겨 셀피 모드가 켜졌을 땐 렌즈 상단 부분에 붉은 빛이 들어와서 전원의 on/off도 한눈에 쉽게 알아 볼 수 있어 좋았답니다. 렌즈 옆 미러를 통해 표정이나 얼굴의 위치 등을 확인하고 찍을 수 있어 좋았는데 더욱 이 아이가 마음에 들었던건 293그램으로 스마트폰과 비슷한 무게이기에 한손으로 들고 사진을 찍기에도 전혀 무겁게 느껴지지 않았던 거에요. 함께 온 꾸미기세트 안에는 밋밋해 보이는 필름의 테두리를 예쁘게 꾸밀 수 있는 각종 재료들이 들어 있었는데요, 종이액자와 귀여운 테이프 그리고 다양한 디자인의 스티커가 들어 있어 하나 밖에 없는 즉석사진을 더욱 소중하고 예쁘게 추억 할 수 있겠더라고요:) 캠핑은 다음주에 가기 때문에 집에서 셀피 모드로 저를 담아봤어요! 넘 오랜만에 폴라로이들 찍는거라 이게 맞나~ 하며 감을 살짝 잃었는데 렌즈 옆 거울을 보며 찍으면 되니 좋더라고용ㅎㅎ 셔터를 누르면 찌이잉- 하는 소리와 함께 즉석사진이 본체 윗 쪽으로 올라오는데 예전 버전보다 훨씬 힘 있게 잘 올라고 별다른 조명 없이 형광등 하나만 켜진 어둑한 실내에서 사진을 찍어도 내장된 자동노출기능이 잘 작동되어 밝고 선명하게 인화 돼 잊고 있던 아날로그의 재미를 다시금 깨워주었답니다. 시간이 조금 지나고나면 선명하게 사진이 완성 되는데요, 수 많은 즉석카메라들이 있지만 안만두가 20대시절부터 15년넘게 쭉 instax 폴라로이드카메라를 고집하는 이유는 특유의 색감 때문이에요~ 다른 폴카들은 대부분 카트리지인쇄를 적용해 인화를 시키는 반면 요 아이는 은염방식 즉 필름 아랫부분에 있는 잉크를 롤러로 밀어주며 상을 필름에 맺히게 만들기 때문에 특유의 레트로하고 아날로그적인 색감을 구현 할 수 있어요~ 시간이 오래오래 지나고 봐도 색이 흐려지지 않고 유지되며 특유의 색감은 추억을 더욱 감각적이게 담아주기 때문에 FUJI instax mini 필름의 가격이 조금 있는 편이지만 꼭 정품을 사서 쓰게 되는 거 같아요! 쨍한 퍼플에 우유를 톡 떨트린 듯, 달콤한 마카롱의 색을 섞어 놓은 듯! 넘 사랑스러운 컬러의 인스탁스 미니11과 함께 이 순간이 지나면 사라지는 소중한 순간들을 즉석에서 바로바로 인화해 소장해보시길 추천드리고 싶어요! 아날로그 즉석 카메라들이 많지만 실용성면에서는 단연 mini11이 제일 괜찮기에 제가 오늘 소개드린 폴라로이드카메라를 선택해보시길 바랄게요🎈",2621,16,['instax mini 11'],1,https://postfiles.pstatic.net/MjAyMTEwMTJfMjkw/MDAxNjMzOTY0NzI0MTg3.1_-Gp2Zhh-4yZRqanzGbfkY5knwgaCx4NwYiBnr59rUg.5rP9KqKqWTjZLuq6X-0X65UEls3NupWaWt-Mw3pY4x8g.JPEG.a10000du/SE-82d30e26-9837-4c77-9939-8c39c1df3230.jpg?type=w80_blur,https://www.revu.net/campaign/img.php?p=343c533fa81db4d1878039dcab103dec5902e031687b52017cff2d58d09a6131&v=4,22,0,0,1,1,0,0,1,0,0,0,0,0,0,0,0,0,1,1,0,0,0,0,0,0,0,0,0,0,0,0,0,0,0,9,9
https://blog.naver.com/PostView.naver?blogId=bigek0901&logNo=222650044263,"인스탁스 미니11 라일락퍼플 내돈내산 후기, 갬성사진찍기좋네",20220218,미니11 리뷰,인스탁스 ,"안녕하세요 예라엘입니다❤️ 오늘은 12월달에 구매했지만 이제서야 쓰는 폴라로이드 후기를 들고왔습니다!  때는 막내동생의 친구가 폴라로이드가 있는데 빌려와서 찍는 사진들 볼때마다 너무 예쁘더라구요 연말에 결국 뽐뿌가 와서  고민하고 또 고민하다가 결국은 구매한 인스탁스 미니 11 물론, 지금 너무너무 만족하며 잘 쓰고 있답니다!! 그럼 후기 시작할꼐욤! 저는 쿠팡에서 구매를 했구요! 작년 당시에는 크리스마스 인꾸키트와  필름80장까지 해서 177,000원에 구매했는데 지금은 가격은 얼만지는 모르겠네요ㅠㅠ 구매내역 ▼ 상품정보 ▼ 띵똥띵동👉 택배가 도착했습니담! 처음에는 일본어가 적혀있어서 당황스러웠지만  아 후지필름이네라고 하고 이거는 폴라로이드다!!!! 하면서 우다다다 꺼냈었다는..! 01 ETC 폴라로이드 앨범 + 인꾸키트 + 2단 앨범 개봉하면 딱 이렇게 담겨져 있었는데요! 저는 필름이랑 넉넉하게 주문을 해서 한가득 온거 같아요! 이거는 폴라로이드 앨범 사진찍고 넣어서 보관하면 된답니다!! 인스탁스 인꾸키트인데 저는 개인적으로 스티커 붙이면 지버분한 느낌이 들어서 붙이지는 않았어욥! 사진을 매달아 둘 끈과 컬러집게! 비즈모양의 꾸미는 스티커 ! 요거는 보통 어디에 붙이는지 넘 궁금하네요 :D 요고의 용도는 사실 잘 모르겠어요😅 아시는 분 댓글 남겨쥬세여...ㅠㅠ 곰모양의 귀여운 스티커인데요 폴라로이드에 맞춰있네요! 졸귀탱이네요💛 크리스마스 인꾸키트구요! 인꾸키트에는 투명 앨범도 포함되어있답니다! 사진 끼워서 엽서도 쓸수도 있구요! 크리스마스 기념 마스킹테이프도 들어있구요! 다이어리 쓰는 분들에게는 너무너무 좋을거같은데요? 데코 스티커도 넘넘 귀여워ㅠㅠㅠ 요즘 요런 그림체 왜이리 좋은지 몰라요!!💘 02 인스탁스 미니 필름 이거는 인스탁스 미니 필름인데 한박스에 10개씩 2묶음이 들어있어요 뒷면에는 주의사항들이 적혀있어요 절대 햇빛이나 빛에 노출되면 안된다구 무슨말인지 잘 몰랐는데 날짜가 생각보다 넉넉했구요 이것도 유통기한이 있는거는 처음 알았네요☺️ 카메라마다 필름크기가 다르니 구매할때 꼭꼭 확인해주세요~~!! 02 CASE 폴라로이드 케이스와 폴라로이드 가방 케이스를 오픈해보려규 하는데요 처음에는 뭔가 싶다가도 아 가죽케이스!!라고 생각나서 호로로록 뜯었답니다! 가죽 가방 컬러도 생각보다 예뻐요 제가 좋아하는 컬러가 분명합니다😄 연보라 넘 예쁘다✨ 이제 본격적으로 폴라로이드를  오-픈 해보려고 하는데요 뽁뽁이부터 어떻게 치워주구요! 박스를 위 아래 옆 다 살펴봅니다 박스를 영어보니 설명서가 먼저 보이구요! 하나씩 열어볼께요 😍 카메라에 달아놓는 끈인데 떨구면 큰일나니까 카메라에 끈으로 단디 고정시켜서  손목에 넣고 들고 다녀야겠어요!! 카메라 작동할수 있게 건전지도 같이 동봉되어있답니다 건전지 다되면 그때 새로 건전지 사야딩! 요거는 셔터 누르는데 붙이는 악세사리더라구요! 그렇지만 저는 붙이지 않았다는..! 폴라로이드를 뽁뽁이에 감싸져 있는데 영롱한 연보라빛 파스텔 톤이라서 더 좋은거 같아요! 뒤에 몇개의 필름이 남았는지 볼수 있는데요! S는 검정색 앞장 필름이랍니다 ! 케이스에 폴라로이드를 넣어주고요! 컬러와 너무 찰떡처럼 예쁘네요! 끈도 연결해주면 완료!! 케이스에 인스탁스 미니11을 넣으니 너무 찰떡같이 너무 예뻐요ㅠㅠ 03 SETTING 사용을 위한 세팅 우선 동봉되어있던 건전지를 뜯어서... 잘 뜯어지지 않아여...또르륵ㅠㅠㅠ 손으로 말고 가위나 칼로 뜯으시길! 카메라에 플러스와 마이너스를 잘 확인하고 건전지를 끼워넣어줍니다! 그 다음 필름을 넣기 위해 카메라 뚜껑을 열고 필름을 박스를 준비합니다! 박스에는 2개가 동봉되어있는데요!  하나를 꺼내서 봉지를 뜯어줍니다 그다음 필름을 넣어주는데요 손으로 누르지 말라는 부분은 누르시면 안됩니다!! 필름이 빛을 보면 안된다고해서ㅠㅠ 필름 넣을때는 요로콤 넣으셔야합니다!! 그러면 기본 사용을 위한 셋팅을 끝! 04 HOW TO USE 사용법 사용을 위해 렌즈 옆에 버튼을 눌러주면 렌즈가 볼록 나온답니다!  근데 왜 제꺼는 렌즈가 안열리죠...? ㅎㅎㅎ;; ON/ OFF는 불빛으로 확인하실수 있습니다! 집어넣을때는 손으로 렌즈를 눌러주시면 됩니다 :D 셀카모드로 하고 싶으시면  앞에 렌즈를 한번 빼주면 셀카모드도 가능!! 플래시는 촬영할때마다 자동으로 켜져요!! 셋팅하자마자 바로 한두장 찍었는데요! 갬성 넘치는 사진!! 넘흐 좋아요!! 시간이 지날수록 유지도되니  보관만 잘 해놓으면 나중에도 너무 좋을거같네요! 폴라로이드 진짜 넘 좋아여!! 친구들하고 만났을때도 요걸로 사진찍고 회사에서도 회사사람들이랑 찍었는데 갬성넘치게 잘 나왔더라구요 ㅠㅠㅠ 남자친구랑도 찍었는데 아쥬 만족합니다😆 단지, 저는 홑꺼풀이고 남자친구는 쌍커풀이 있어서 제가 살짝 흐리멍텅하게 보이지만..ㅎ 무튼 폴라로이드 생겨서 추억 남기고 싶을때마다 찍고 있어요 !! 셀카모드는 좀 연습을 해야겠더라구요 ㅎㅎ 인스탁스미니11 대만족🧡 마지막 마무리는 친구들과 열심히 찍은 사진들로 후기를 마무리해봅니다! 본 포스팅은 직접 제가 돈 주고 산 제품입니다. 포스팅 된 사진의 무단 사용을 금합니다!",2508,47,"['상품명 : 인스탁스 mini 11 폴라로이드가격 : 세트구매시 177,000원컬러 : 라일락 퍼플\u200b', '<개인적인 총평>\u200b✔️카메라가 없어서 그런지 추억남기기 좋음✔️추가로 필름을 구매해야한다는 단점이 있지만✔️인쇄되어 사진이 출력되는 장점이 있음✔️들고다니기에도 나쁘지 않음']",2,https://postfiles.pstatic.net/MjAyMjAyMTdfMzYg/MDAxNjQ1MDY1NTAyMzAx.c-rWNgf0T7e0WDPpn8ZwFmFxZAXS-ucZ_VhHjfhEAFEg.nvUD4n3C9feJCRESA3dX77AFwSyucKrUi5yatizzXWcg.JPEG.bigek0901/KakaoTalk_20211213_111705249.jpg?type=w966,https://postfiles.pstatic.net/MjAyMjAyMTdfMjQ0/MDAxNjQ1MDY1MzI4ODM4.cndTVKty7eth-3x5bAq36WZ4-wSFPNs4QRrihB-Ac-Yg.KAPfAXRRzTF8TCc8MP_5Yrg79n0AbUNy_g_obwidYe0g.JPEG.bigek0901/SE-f3d7128f-c280-4d63-87c8-ea3db0e63946.jpg?type=w966,53,0,0,0,0,0,0,4,0,0,0,0,0,7,7,3,0,0,0,0,0,0,0,0,0,0,0,0,0,0,0,0,0,0,9,9
https://blog.naver.com/PostView.naver?blogId=dear_010&logNo=222348087305,인스탁스 미니 리플레이11 다크그레이 한달후기 (폴라로이드... ,20210512,미니11 리뷰,인스탁스 ,"오늘은 제가 가지고 있는 #내돈내산 미니 리플레이11 다크그레이  한 달 후기를 써보려고 합니다! 이 포스팅은 기계에 대한 자세한 정보보다는 색감과 장점 단점을 위주로 설명하려 해요!  저는 인스탁스 폴라로이드가 이미 있는 상태였으나 너무 오래전 구입한 상품이라 폴라로이드를 새로 장만하려 제품을 찾아보던 와중 #인스탁스미니90 제품과 #인스탁스미니리플레이11 을 고민하게 되었어요. 인스탁스미니90은  (1) 예쁜 디자인 (2) 아날로그 감성 뿜뿜한 색감 의 장점이 있지만 소장하고 있는 사진을 뽑을 수 있다는 미니 리플레이11의 장점이 더 크게 느껴져 미니 리플레이 11를 구입하게 되었습니다!  그리고 한 달 사용한 결과.. 저는 제 선택에 굉장히 만족하고 있어요. 디카처럼 촬영한 후 출력할 수 있도록 만들어져 있기 때문에  날리는 필름이 없다는 게 정말 큰 장점이더라고요 더 자세한 내용은 밑에 담아볼게요!  저는 인스탁스몰에서 메모리카드+전용케이스+액정필름+본품 구성으로 21만원에 구입하였어요. 전용케이스는 검정으로 구매했는데  정말 정말 탁월한 선택이었어요 ㅋㅋㅋ 이 케이스가 가방처럼 생겨 패션 아이템처럼 도 활용이 가능하더라고요!  케이스는 위 커버를 오픈해서  사용하는 형식으로 되어있어요.  케이스를 오픈한 모습입니다! 굉장히 귀엽지 않나요? 스톤 화이트를 사고 싶었는데  제가 산 시점에서 배송이 한 달 걸린대서 포기하고 다크 그레이를 산 건데 굉장히 만족스러워요 ㅇ.ㅇ 사실 폴라로이드는 케이스를 낀 상태에서 사용하는 경우가 대부분이라 케이스를 낀 후의 모습을 중요시하게 생각했거든요. 스톤 화이트도 투명 케이스 낀 모습이 훨씬 예쁘길래 다크 그레이도 케이스 꼈을 때  모습이 예쁘다면 괜찮을 거라 생각하고 구입했던 건데 정말 만족스러웠어요!  인스탁스 미니리플레이11  다크그레이 외관은 이런 모습인데요 그레이 본체에 세로줄이 그어져있어요.  (대체왜이렇게만들었는지..^^;)  촬영 버튼은 왼쪽 상단에 있는 정사각형 모양입니다! 저는 한 손으로도 충분히 사용할 수 있었어요~!  짧은 음성을 녹음할 수 있는 기능 프레임 기능 등 많지만 간단하게 주로 사용하는 기능 위주로 설명해볼게요! 저는 개인적으로 이 출력되는 부분이  너무너무너무 마음에 들었어요! 효과가 정말 귀엽지 않나요 ~~~!!  인스타스토리에 올리기 제격이죠 ^-^  영상 꼭 봐주세요..!!!!!  사진을 지우는 방법도 굉장히 간단한데요 갤러리에 들어가 메뉴 버튼을 누른 후 erase를 찾아 눌러주시면 됩니다!  또한 찍으면서 밝기 조절이 가능하답니다 :)  다음은 가장 중요한 #미니리플레이11색감 ...! 출력했을 때의 느낌을 보여드리려 해요. 우선 미니리플레이11은 ""푸른빛""이 돌게끔 출력이 됩니다. 이건 확실히 알고 계셔야 할 것 같아요. 저도 이것 때문에 구입 전 굉장히 고민했었거든요. *리플레이11 촬영을 통한 인쇄 *이렇게 흰 여백이 많으면 사진이 예쁘지 않게 나오는 것 같아요.  (실제색감과 가장 비슷한 느낌입니다!) *어플을 통한 직접인쇄  더보이즈 주연과 아이즈원 원영이를 뽑아봤어요💞 직접인쇄로 사진을 뽑았을 때 느낌입니다! 확실히 원본보다 푸른끼가 돌죠?  저는 개인적으로 크게 신경쓰지않는 부분들이라 잘 사용하고 있지만 이런 부분이 싫으신 분들은  구매를 고려하셔야 될 것 같아요 ㅠ.ㅠ !!!!!!!  *직접인쇄시 어플에서 사진 구도 수정이 가능합니다:)  ✔️또 제가 느낀 화질은 사진이 디카나 dslr처럼 선명하진 않다는 것! 장점) 1. 촬영->사진셀렉-> 출력하는 형식이라  날리는 필름이 없다. (실제로 찍은 후 삭제하는 사진의 비중이 높았음..^^) 2. 갤러리 사진을 출력할 수 있다. (포토프린트) 3. 케이스를 끼웠을 때 모습이 예쁘다. 4. 디카처럼 큰 화면을 보며 촬영할 수 있다.  5. 가볍다 6. 사진찍으며 녹음이 가능하다 (10초간 녹음이 가능하다 해요~!) 7. 연예인 #폴꾸 활용가능!  - 사진 보정 후 출력이 가능하여 예쁜셀카를 폴라로 뽑을 수 있단 것과  (마치 원본이 잘 나온 것 처럼,,^^)  -연예인 폴라 사진을 뽑을 수 있다는 점이 좋았어요^^ (마치 내가 찍어준 것 처럼,, 마치 당첨된 폴라처럼,,) 단점) 1. 필름이 비싸다 😡😡 2. 푸르딩딩한 색감 3. 사악한 본체 가격 😱😱 추천 - 포토 프린트 기능을 사용하실 분 - 필름 낭비하기 싫으신 분  - 촬영할 때 넓은 화면으로 편리하게 하고 싶으신 분 비추천 - 예쁜 색감의 폴라로이드 사진을 원하시는 분 - 완벽한 아날로그 감성의 폴라로이드 사진을 원하시는 분 총평 저는 포토프린트 기능과 직접 찍어서 출력하는 기능  둘 다 사용하고 있기 때문에 푸르딩딩한 색감에 대한 아쉬움은 상쇄되는 것 같아요. 또 리플레이를 완벽한 폴라로이드로  사용한다기 보다는  마음에 드는 제 사진을 폴라로이드로 소장한다는데에 의미를 두는 것 같아요. (그렇다고 프린팅 기계로만 사용하지는 않고, 촬영 후 인쇄와 어플인쇄 기능을  반반 사용하고 있어요!) 저는 프린팅도 되면서 폴라카메라 기능을 하는 카메라이기 때문에 만족스러운건데,  저와는 다르게 완벽한 아날로그 감성을 원하시고 포토프린팅 기능을 사용하지 않으실거면 구입 비추천드려요!!  제가 한 달 사용한 바로는  이정도 느꼈던 것 같아요!ㅎㅎ 가격이 사악하다는 것 빼곤 만족스러운 소비였습니다. 궁금한거 있으시면 댓글로 남겨주세요! ^-^  그럼이만~  #인스탁스 #인스탁스리플레이 #인스탁스미니리플레이 #인스탁스리플레이후기  #폴라로이드 #폴라로이드추천 #포토프린트 #내돈내산 #소비일기 #인스탁스미니 #인스탁스폴라로이드",2739,22,"['구입계기', '제품샷', '사용법', '촬영법촬영 방법은 일반 폴라로이드와 같이 기계의 촬영버튼을 누르면 됩니다.그러면 갤러리로 넘어가게 되는데이 때 메뉴버튼을 누른 후 print 버튼을 누르면 출력이 됩니다.\u200b', '색감', '장점 및 단점', '총평 ']",7,https://postfiles.pstatic.net/MjAyMTA1MTJfMjQ0/MDAxNjIwODAzNTQ5NDQ3.kx6EiVSFEfF5qibOJWn6x68NcD56ISSIvDBzesyi2r4g.eAeNnZNO8sR2G2V7QvUU4vy99yuFfcmmC2Ne_H-Oq54g.JPEG.dear_010/SE-ad6ca5fb-ceeb-4414-b9c2-ddfdff49af09.jpg?type=w773,https://postfiles.pstatic.net/MjAyMTA1MTJfNCAg/MDAxNjIwODExNzg2MjQ1.zsWM1XjMTi_i-HM4m5dPzhTql_V5jz12lePR8W-gwYsg.etwAM2qO71rHLUJGNCcQaqp6t4uNWZanj8-lDfH99q8g.JPEG.dear_010/IMG_3136.jpg?type=w773,29,0,0,1,1,1,0,1,0,0,0,0,0,1,0,0,0,5,2,0,0,1,0,0,0,0,0,1,0,0,0,1,0,0,0,0
