url,title,post_date,검색어,브랜드 명,content,content_cnt,content_line,quote,quote_cnt,first_img,last_img,img_cnt,솔직 빈도 수,비교 빈도 수,ㅋ 빈도 수,ㅋㅋ 빈도 수,ㅋㅋㅋ 빈도 수,ㅋㅋㅋㅋ 빈도 수,... 빈도 수,.... 빈도 수,ㅜ 빈도 수,ㅜㅜ 빈도 수,ㅜㅜㅜ 빈도 수,ㅜㅜㅜㅜ 빈도 수,ㅠ 빈도 수,ㅠㅠ 빈도 수,ㅠㅠㅠ 빈도 수,ㅠㅠㅠㅠ 빈도 수,장점 빈도 수,단점 빈도 수,비속어 빈도 수,허락 키워드,내돈내산 키워드,리얼후기 키워드,협찬 키워드,체험단 키워드,coupa.ng 키워드,< 키워드,> 키워드,♡ 키워드,♥ 키워드,구매후기 키워드,한달 키워드,두달 키워드,세달 키워드,광고 분류1,광고 분류2
https://blog.naver.com/PostView.naver?blogId=y_maeng&logNo=222322389835,폴라로이드카메라  인스탁스 미니 11 라벤더 후기,20210425,미니11 리뷰,인스탁스 ,"#폴라로이드 #폴라로이드미니11 #폴라로이드카메라 #인스탁스 ::폴라로이드 미니 11 (라벤더 색상) 작년 여름휴가 전에 구입했던 폴라로이드 미니 11. 예전부터 갖고 싶었던 제품이긴 했으나, 자동 설정이 없어 누군가 찍어주지 않으면 찍을 수 없다는 점, 핸드폰 앱 카메라로는 자동 보정이 되지만, 폴라로이드는 그렇지 않다는 점 때문에 고민을 하다가 구입을 했습니다. 요새는 폴라로이드에서도 타이머를 설정하여 사진촬영이 가능하고, 또 사진촬영 기능뿐만 아니라 핸드폰에 있는 사진을 뽑을 수 있는 기능도 있어서 참 좋아졌다는 생각을 많이 해요. 물론 가격이 조금 나가지만 ^^;;  작년 여름쯤에 여행에 미치다와 콜라보 진행으로 조금 더 할인된 가격으로 구입을 할 수 있었어요. 그때 필름도 이벤트로 진행중이어서 구입했는데 할인 할 때 조금 많더라도 구입해 놓은 게 가격 면에서도 덜 부담스럽고 좋은 거 같아요. 아무래도 요새는 핸드폰 카메라가 좋기 때문에 많은 사진을 폴라로이드로 담지는 않지만, 여행 시에 꼭 챙겨서 기념으로 4~5장 남기고 오는 것 같아요. 폴라로이드 인스탁스 미니 11 라벤더 정면 사진입니다. 정면에 보시면, 조그맣게 내 얼굴로 볼 수 있는 거울이 하나 있는데요. 이 부분을 통해 셀피가 가능해집니다. 근데 정말 못생기게 나와요 ㅋㅋ 정말 멀리서 찍어야 호빵처럼 안 나오는데 말이죠. 인스탁스로 셀피가 이쁘게 나오기는 참 힘든 부분인 것 같아요. 필름은 물론 별도 구매이고요. 인스탁스 폴라로이드 미니 11 라벤더를 구입하면 줄과 건전지, 셔터 부분에 데코용 아이템이 와요. 데코용 아이템은 사실, 이쁘긴 한데 촬영 시 누르는 부분에 있어서 불편할 것 같아서 저는 붙이지는 않았는데요. 또 추후에 붙였다가 떼면 더러워질까봐. 근데, 원래 인스탁스 폴라로이드에 좋아하는 스티커 등등 여러 가지를 많이 붙여서 사용하는 부분이라 취향껏 데코 해주시면 될 것 같아요. 폴라로이드 미니 11 라벤더 필름 넣는 방법은 정말 간단합니다. 필름을 개봉하면 노란색 부분이 앞으로 가게 넣어주시면 돼요. 자세히 보시면 인스탁스 필름 넣는 부분에 노랗게 넣으라고 우측 상단에 색이 표시되어 있습니다. 방향과 앞면/뒷면 여부 잘 확인하시어 넣으면 끝! 첫 장은 그냥 버려지는 부분이기 때문에 찍기 전에 한 번 눌러서 첫 필름 종이는 버려주세요.  여러 가지 색상이 있었는데 고민하다가 구입한 색상 라벤더. 질리지 않게 무난한 색상 같아요. 파스텔 보라 색상이 참으로 이쁘고, 여자 한 손 크기만 한 사이즈가 참으로 귀엽습니다. 작년 여름휴가 때 처음으로 들고 가서 사진을 남겼는데, 많은 여행자들이 폴라로이드를 들고 다녀서 살짝 놀란 부분도 있었어요. 그만큼 아날로그 감성과 추억을 남기기에 더할나위 없는 제품이지 않나 생각이 듭니다. 솔직히 핸드폰 카메라가 너무 좋아서 또 정말 필요한 제품이 아니기 때문에 살까 말까 고민했는데, 사서 잘 활용만 한다면야 ^^ ⓒ 2021. 올원 all rights reserved. 본 게시물의 모든 이미지와 글의 저작권은 올원(ID:y_maeng)에게 있습니다. 따라서 무단 도용, 업로드, 재포스팅을 금지하며, 저작권법 위반시 처벌받을 수 있습니다.",1563,6,"['폴라로이드 미니 11 라벤더언박싱', '거울로 셀피도 가능', '폴라로이드 미니 11 라벤더구성품', '폴라로이드 미니 11 라벤더필름 넣는 방법', '폴라로이드 미니 11 라벤더', '첫 폴라로이드 사진']",6,https://postfiles.pstatic.net/MjAyMDA3MzFfODAg/MDAxNTk2MjAxMzIxNzQ3.TVno4vL-iveWwy-rgexqNqBMqosC1xlBk5tN24RF6dUg.kv_KnhDLGgs23g6NrHy2q7NtDM9uERTtE2WvpHd9QRQg.JPEG.y_maeng/output_2399854995.jpg?type=w966,https://postfiles.pstatic.net/MjAyMDA4MTdfMzAg/MDAxNTk3NjU0MDU3MDA0.W0nPCc-jPV3jDSknGB9NSxChTQLwJb8_dl8iqUuYpZYg.lHe82frN3UznV8woFAic2fXi7V4ououmg-M2JMLlYxog.JPEG.y_maeng/SE-4a59b4fa-f678-4ce9-b7c0-0dcd97235ac8.jpg?type=w966,18,1,0,1,1,0,0,0,0,0,0,0,0,0,0,0,0,0,0,0,0,0,0,0,0,0,0,0,0,0,0,0,0,0,0,0
https://blog.naver.com/PostView.naver?blogId=wlals4321&logNo=222603267213,인스탁스 미니 11ⅩBTS(BUTTER ver.) 후기♥,20211224,미니11 리뷰,인스탁스 ,"아미가 쓰는 BTS콜라보 후기~~!!! 평소에 폴라로이드가 사고는 싶었지만 자주 쓰지도 않을거같고 필름값도 비싸서 생각만 하던 손아미를 보자마자 사게 한 디자인!! 옷이든 전자제품이든 기능보단 디자인을 우선시 하는 나로써 안살수가 없었다ㅠㅠㅠ  게다가 곧 크리스마스잖아 ㅎㅅㅎ 일요일에 주문해서 장장 4일만에 도착ㅠㅠ 기다리다 목빠져서 거북이되는줄ㅠㅠㅜㅜ 구성품은 쏘 심플^^ 폴라로이드 버터필름 10매 버터콜라보 스트랩 건전지 2개 셔터버튼 악세사리 2개 사용설명서 그리구 이벤트로 받은 필름앨범,,,,뭐냐구,,저그림,,, 처음에 개봉했을때 저 뽁뽁이에만 포장되어 와서 당황!! 혹시 고장나진 않았을까,,, 걱정했는데 멀쩡하다 한손안에 다 들어온다 ㅎ 크기는 107.6*121.2*67.3(mm)이고  평범한 여자 손 크기로 실제로 보고 정말 작다고 생각했다. 정면 너무 이뿨ㅠㅠㅠ옆면에 렌즈 튀어 나오는것도 이뿨ㅠㅠㅠ 카메라 렌즈에 방탄 로고 뭐야ㅜㅜㅜㅠㅠ 미쳤어ㅠㅠ 약간 파스텔톤의 노랑색이다! 파스텔 노랑도 이뿨ㅠㅠㅠ 사기전에 후기들을 볼때  저 버튼이랑 스트랩 컬러가 너무 쨍하다고 호불호가 강했었다.  그치만 난 오히려 모든게 파스텔톤으로 맞추기보단 포인트되는 아이템들은 쨍한 노란색이여서 더 마음에 들었다! 버튼이 하나는 크리스탈모양이고 하나는 하트 무늬였는데 난 아미! 하트로 하게쒀! 버튼에는 깨알같이 BUTTER에 하트가 그려져있다! BTS 짱짱!! 특히 저 스트랩은 양면으로 목에 걸수 있어서 아미기분 뿜뿜이다!! 나 아미예요~~~!! 사용법은 뻔하게 쉬울거라고 생각해 설명서를 안봤는데  어떻게 전원을 키는지 몰랐다ㅋ 게다가 셀카버전은 또 어떻게 키는거고,,, 이럴때 찾아보는 유튜브!! 읽는것보단 보는것 ^^ 설명서 너무 시러ㅡ3ㅡ 인스탁스 미니 11 튜토리얼 1분 30초 정도로 간단해서 너무 좋았다 저 동영상만 보면 인스탁스 미니 11 사용법 완전 정복!!ㅋㅋㅋㅋㅋ BTS콜라보제품 인스탁스 미니 11은 공식홈페이지인 후지필름몰과 카카오톡선물하기 두군데서 구입할 수 있는데 난 공홈에서 사는게 더 저렴해서 공홈에서 세트로 샀다! 단품만 사면 133,000원 필름과 세트로 사면 140,000원 근데 카톡에서는 세트로 살때 7000원이나 비싸다ㅜ 꿀팁~~~!!! 그리고 카카오톡에서 예약판매로 1000개 한정으로 단품가격에 세트를 팔았었는데 공홈에서 신규가입하면 주는 1만원 쿠폰을 쓰면 예약판매때보다도 싸게 구매할 수 있었다~~~ 예에~~ 일반 인스탁스 미니11보다 가격도 비싸고 할인도 안하는데 한정판 콜라보라는데 의미가 있으니 조금 비싼정도야 모른척 할 수있다! 모두가 이글을 보고 조금이라도 저렴하게 살 수 있는 행복을 느끼길 바라며 오늘도 이만,,,,, 총총총 ",1341,8,[],0,https://postfiles.pstatic.net/MjAyMTEyMjRfMzgg/MDAxNjQwMjc0NDA5MTA3.zS3F0sNb2pmwBwmvHOrxYFtREXYtgnenF_jovnd6E88g.RVap1DYVSjUenzvjqpZ-OFBSlPbVX5gxjYjHk411R6Yg.JPEG.wlals4321/SE-55dfa13c-05de-42f2-9f72-3450f6b72f5d.jpg?type=w773,https://postfiles.pstatic.net/MjAyMTEyMjRfMjQy/MDAxNjQwMjc3NzAwNzMy.lKJcl73GqE3DZ5wZL0j8sawmc6hhQaMvVwQ3anuVTZkg.16mmMHAR8eAyBSSj7wpD0KtVLkC40UOUerROjAxsoacg.JPEG.wlals4321/SE-4bbbb063-8ae6-430d-8a90-d6a443b8dfd4.jpg?type=w773,9,0,0,2,1,1,1,0,0,3,2,1,0,8,8,4,0,0,0,0,0,0,0,0,0,0,0,0,0,0,0,0,0,0,9,9
https://blog.naver.com/PostView.naver?blogId=cow_501&logNo=222327186342,바세린 이벤트 당첨 후기 1탄_ 인스탁스 미니 11,20210429,미니11 리뷰,인스탁스 ,"좋은 일, 감사합니다 :) 바세린 이벤트 1등 당첨 후기 _ 인스탁스 미니 11    바세린에서 최근 이벤트를 했습니다 :)  바세린 핸드크림에 대한 정보를 찾다가, 바세린 홈페이지에 우연히 들어가게 됐는데요. 이벤트가 한창이었죠!  최근 바세린은 김연경 선수를 모델로 발탁했습니다!  정말 순수하고 예뻐보이는 김연경 선수. 나혼자산다에서 그녀가 당당하고 멋지게 사는 모습을 보고 그때부터 반해서 지켜보고 있던 중 좋은 소식이었죠 :)    짠~! 이런 이벤트를 하고 있었습니다~!  그당시 핸드크림 리뷰를 쓰고 있었어요! 간호사들이 쓰기 좋은 핸드크림 여러가지! 그 중, 대용량 핸드크림으로 바세린 핸드크림을 리뷰했었는데요. 실제 저희 병원 몇몇 부서에서도 많이 비치하고 쓰고 있어요 :)  바세린 핸드크림을 포함한 핸드크림 리뷰 링크는 맨 아래에!  타 부서에 비치된 거 발라보고는 '오 이거 물건인데?' 싶어서 제가 사려고 찍어뒀던 사진ㅎㅎ  타 부서에 비치된 거 발라보고는 '오 이거 물건인데?' 싶어서 제가 사려고 찍어뒀던 사진ㅎㅎ  여튼 이런 대용량 바세린 핸드크림이 400ml에 14900원, 만 사천 구백원!이었다. 내 자리가 있다면 나도 이렇게 비치하고 쓰고 싶어..  바세린 이벤트 경품은요~!  바세린 이벤트 경품은 이렇습니다  인스탁스 미니11 + 필름 + 바세린 전제품!!  오마갓! 인스탁스 미니 11만 줘도 감사한데 바세린 전제품까지요?  처음에는 신청하고 잊고 있었는 데, 바세린에서 갑자기 연락이 왔어요! 그리고 실제로 인스탁스가 도착해버렸어요~!! 심지어 공홈에서 바로 택배 부치시는 바세린 팀ㅎㅎㅎ  이건 뭐 인스탁스 미니 11 풀 셋트 아니냐구요~!   카메라에 필름 20장, 카메라 가방에 앨범에 데코까지 바세린 혜자다.. 난 이제 립밤도 핸드크림도 쓸 수 있는 거 모두 바세린만 쓸 것이다..   카메라 너무 소중해서 아직 열어보지도 못했어요ㅠㅠ 게다가 색상도 보세요 너무너무 봄과 어울리는 예쁜 하늘색 스카이블루 오예~~  감사합니다 바세린.. 열심히 쓸게요..  전제품도 얼른 보내주세요 열심히 리뷰하겠습니다 제가 마켓팅 왕이 되겠습니다!!!  (참고) 바세린 전제품은 별도 배송될 예정이라고 합니다~!!! 두근두근두근 바세린 제품을 살 수 있는 온라인 공식 대리점 (이라고 뜨네요) 바세린 핸드로션을 포함한 핸드크림 리뷰 https://ane-rn.tistory.com/27",1186,8,[],0,https://k.kakaocdn.net/dn/kFn2H/btq3mORoXun/3XFXJmMm7jHe3zQ6ZbSEp0/img.png,https://k.kakaocdn.net/dn/dEd4h9/btq3r2tHd0h/OUT52eJskfDRBjwaQpACk1/img.png,5,0,0,0,0,0,0,0,0,0,0,0,0,1,1,0,0,0,0,0,0,0,0,0,0,0,0,0,0,0,0,0,0,0,9,9
https://blog.naver.com/PostView.naver?blogId=jwyu10010&logNo=222490769151,인스탁스 미니11 (셀카/가격/사용법/필름/후기),20210831,미니11 리뷰,인스탁스 ,화살표 누른상태로 하단방항으로 밀면 건전지 넣는 부분이있어요 AA 건전지 2개 사용합니다 고리를 달 수 있는 홈이 있어요 카메라 양쪽면 각각 고리를 달 수 있는 홈이 있어요 “킬때” 옆쪽에 길다란 버튼을 꾹- 누르면 카메라가 튀어나와요 원래는 정상적으로 카메라랑 렌즈가 한번에 튀어나왔어요 근데 어느순간부터 손으로 한번 잡아 당겨줘야 카메라가 눈을 뜨더라고요 ꃋ ꃋ “끌때” 동그란 면적 아무곳을 꾹- 눌러줍니다 “촬영버튼”을 한번 누르면 후레시가 터지면서 사진촬영이 되요 1초뒤에 필름이 카메라 위로 출력되어요 실제 출력속도는 위 속도보다 좀 더 느려요 “필름 10장 중 7번째 사진을 찍을 수 있다”라는 의미입니다. 필름이 들어있는상태에요 필름을 새로 넣을때 노란색 네모 위치를 맞춰서 넣어주면 되요 렌즈 좌측에 있는 미니거울에 비친 모습을 보고 찍습니다 미니거울 사각형 안에 보이는 구성에서 95%는 정확히 찍힙니다 팔을 최대한 쭉 뻤고 찍었을때 저 포함 4인까지 찍혔어요 :) 엄마 아빠 할아버지와 함께 촬영한 사진이에요 사진찍기에 4명은 충분합니다 :) [SELFIE MODE] 쪽의 앞렌즈 쪽을 잡고 살짝 힘을 주고 잡아당기면 [SELFIE ON] 렌즈가 한번 더 나와요 가까운거리의 대상을 좀 더 뚜렷하게 찍을 수 있습니다  카메라 패키지안에 들어있는 구성품이에요 스트랩입니다 카메라버튼 스티커 2개도 들어있었는데 사라졌어요.. 1개는 카메라개봉 첫날에 붙였는데 가방에 들고다닌 후 어느날 보니까 사라져있었어요 (잘 떼어지는거같아요) 나머지 1개는 지구에서 사라진거같아요,774,15,"['• 구입장소 : 영등포 타임스퀘어 일렉트로마트(B1층)• 상품 : 인스탁스미니11 IceWhite• 가격 : 카메라+필름20개 합쳐서 12만원대', '카메라 키는 방법 / 끄는 방법', '촬영 방법', '뒷면을 뜯어봅시다', '기타 이미지', '셀카']",6,https://postfiles.pstatic.net/MjAyMTA5MTJfMTAw/MDAxNjMxNDE4NjEwODYy.cgr7D_xzmlMgfkkv_AW8TWbtHSlz2QnSYiYWEklxVNwg.hinRuU37XDIgH0ZerVrKT6hn41RssSxxX9pl09_CI50g.JPEG.jwyu10010/output_827499984.jpg?type=w966,https://postfiles.pstatic.net/MjAyMTA5MTJfMTk1/MDAxNjMxNDE4ODIwOTAy.qaIiPV7Z8Kf-qP6ANpWw8nwwBGur9rZQ8KHliAZTKpEg.CvWWQ5Scsd_4QdzParre_r7aMS_HHYuSIgpIbiqRlkkg.JPEG.jwyu10010/output_1256221730.jpg?type=w966,22,0,0,0,0,0,0,0,0,0,0,0,0,0,0,0,0,0,0,0,0,0,0,0,0,0,0,0,0,0,0,0,0,0,9,9
https://blog.naver.com/PostView.naver?blogId=hmhs31&logNo=222315969059,"[폴라로이드 카메라/후기/리뷰] 인스탁스 미니 11, 블러쉬... ",20210419,미니11 리뷰,인스탁스 ,"저는 네이버에서 #인스탁스미니11 검색하여 초이스 했어요! 투명 케이스 필수로다가 자취하고나서 2주전에 첫 손님, 친구를 맞이하고 앞으로 올 손님들을 위해 방명록 개념으로다가 여행 때는 추억 저장용으로다가 하나 있음 좋을 것 같아서 #폴라로이드카메라 를 사기로 마음 먹었쮸! #포토포켓 도 있지만 확실히 감성은 다르더라구요! 택배가 왔숩네다 왔오요~ 정품 스티커가 붙어있구요! 안에는 안내설명서가 있어요! 근데 기계치가 아닌 이상 어느정도 만지시다보면 숙달하실거랍니다ㅎㅎㅎ 저는 기계를 좀 다루는 편이다~에 속해서 따로 안내 설명서 잘 안 읽어보거든요 뽁뽁이에 잘 싸져 왔어요! #인스탁스미니11 에는 AA건전지 2개가 들어간답니다 스트랩 줄도 있구요 버튼에 붙이는 스티커도 2종 들어가있어요! 왼쪽 사진이 밑으로 쭉~ 내리시면 건전지를 넣을 수 있어요! 그러고 오른쪽 사진이 #폴라로이드 필름 넣는 곳! 인스탁스 사는 사이트에서는 필름이 좀 더 비싸더라구요~ 그래서 저는 최저가를 서치해서 40매 샀답니다! 필름이 비싼건 포토포켓이나 매한가지,, 요렇게 필름을 넣어주시면 된답니당 위에 손으로 만지지마세요! 표시 보이시죠? * 절대 건드리면 안된답니다 * 요 부분이 필름 남은 갯수를 알려주는거랍니다! 아직 넣고 하나도 안 찍어서 S 표시! 요렇게 전원을 켜면 쭈~욱 나온답니다 왼쪽 사진에서 보시다시피 셀피용으로는 더 뽑으시면 된답니다! 렌즈 왼쪽에 셀피용 거울이 있어요! 필름을 넣고 셔터를 누르시면, 플라스틱 필름이 한장 먼저 나온답니다! 그러고 사진을 찰~ 칵 찍으시면 필름 나오시는거 보이시죠? >_< 10장이었는데, 한장 찍으니 9장으로 바뀌었답니다 같이 동봉 되었던 스트랩 줄도 걸어보았어요 아무래도 그냥 들고 있는 것보다는 안정감이 필요하니깐! 필름을 넣으시고나시면 필름 넣는 부분을 절! 대 ! 열면 안되세요 이미 넣은 후에 다시 여시게 되면, 안에 있는 필름 10장을 다 날리신답니다^_^,,, 완전히 10장의 필름을 다 사용하신 후에 교체할 때만 여셔야해요! 저는 요 투명 케이스가 너무 맘에 들어요! 실수로 필름 여는 부분이 열릴 틈도 없고, 혹여나 떨어뜨려도 카메라에 스크래치가 덜 가니깐요 애초에 떨어뜨리면 안되겠지만ㅎㅎㅎㅎㅎㅎㅎㅎㅎㅎㅎㅎ 제 침대 맡의 포토존! 스티커 사진도 있지만 앞으로는 폴라로이드로 채울 예정이에요 0_<",1150,16,"['인스탁스 미니11, 블러쉬 핑크']",1,https://postfiles.pstatic.net/MjAyMTA0MTlfMjk3/MDAxNjE4ODM2NjY0MTg0.FlA9mfY4_7lcybgAkF6wjsY5JTJnIeDa-0rojU2jhLUg.PIcTUgSGIZ_L_AIk2FdMN7CpOB0GgqPKVGT6csYC6kkg.JPEG.hmhs31/111.jpg?type=w966,https://postfiles.pstatic.net/MjAyMTA0MTlfNjQg/MDAxNjE4ODM4NTAyODAw.phcjx7IBxfPWudP_N9nwXlKOdFLs_tvpkRgkTdtQuQwg.eyf0ETIH5yneNqzg0LU9a-v91uVvf7w7pgdPxeRbOpMg.JPEG.hmhs31/SE-fcdcd01b-5b1a-460c-a65e-5044050175db.jpg?type=w966,30,0,0,0,0,0,0,0,0,0,0,0,0,0,0,0,0,0,0,0,0,0,0,0,0,0,1,1,0,0,0,0,0,0,9,9
https://blog.naver.com/PostView.naver?blogId=kjin_098&logNo=222202970300,"[review]인스탁스 미니 11 내돈내산 후기, 본격 언박싱 part 2",20210110,미니11 리뷰,인스탁스 ,"안녕하세요! 어제 드디어 기다리고 기다리던  인스탁스 미니 11이 도착했어요 >_< 따끈한 언박싱 후기 가겠습니다! 구매 전 정보는 따로 포스팅 했으니 밑에 링크 참고해 주세요! https://blog.naver.com/kjin_098/222199702568 집에 박스 쌓아두기 싫어하는 사람이지만,, 모두 함께 언박싱 하고 싶어서 견뎠습니다. 왜 박스가 세개나 되냐 하면, 미니 11 본체, 필름, 투명 케이스를 모두 따로 주문 했기 때문입니다ㅎㅎㅎ 박스를 뜯기 전에 조금 놀란 부분은 박스가 생각보다 너무 작고 가벼워서 였습니다. 그래서 살짝 잉 뭐지 잘 못 온거 아닌가? 생각을 했져 옛날에 폴라로이드 카메라가 있었는데 제 기억에 꽤 무거웠던 걸로 기억했거든요 다행히? 잘 못 오진 않고 뽁뽁이로 아주 잘 도착했습니다 :^) 사은품은 생각도 못 했는데 사진 담을 수 있는 틴케이스가 함께 왔어요! 박스 안 구성품입니다.  설명서 외에 스트랩끈, 건전지, 촬영 버튼에 누르는 스티커가 들어 있었어요 그리고 하얗고 깨끗한 내 카메라,, 건전지는 안 오는 줄 알았는데 박스 안에 들어있으니 따로 구매 안 하셔도 됩니다 그리고 건전지 넣는 곳에 음각으로 +,-가 적혀 있으니 살펴 보시고 건전지 넣으시면 돼용! (몰라서 욱여넣고 나중에 살펴 봤네여..ㅎ) 휴 너무 예뻐요 진짜..ㅠㅠ 요즘 인스탁스가 디자인을 정말 잘 뽑는 것 같아요... 제 예상보다도 너무 작고 가볍고 소중합니다.. 색상은 아이스 화이트라더니 정말 이름 그대로 차가운 느낌의 화이트 색상이더라구요 개인적으로는 sq1 모델 처럼 따듯한 느낌의 화이트가 더 좋아서 이부분은 살짝 아쉬웠어요 그리고 화이트라 먼지 붙는게 너무 잘 보여서 좀 거슬리는 부분이 있어요 그래도 뭐 예쁘니 장땡이죠  제 손은 딱 성인 평균 여자 크기에요 참고해주세요  무겁다는 후기도 있던데 아이폰 xs를 사용하다 보니(예쁜 벽돌;) 저한테는 굉장히 가볍다 느껴졌어요 크기도 옛날 모델에 비하면 작아서 들고 다니기도 편할 것 같아요 바로 사진 찍어서 인스타에 자랑했습니다..소중한 내꾸... 필름을 호다닥 넣고 바로 촬영 버튼 눌러 봤어요 필름 첫장은 저렇게 까만 필름이 나옵니다! 그리고 바로 첫 장 찍어보았습니다. 첫 사진 모델은 제 사랑 저희 집 강아지예요♥♡♥ (자랑 맞아요 너무 예쁘고 망충해보이죠 너무 귀엽죠) 아직까진 어떻게 찍어야 예쁘게 찍히는 지는 모르겠어요  그래도 폴라로이드 감성 너무 좋지 않나요? 예상보다 뿌옇고 하얗게 나오는 것 같은데 제가 뭘 잘 못 찍은 걸까요..흠 좀 더 연습을 해봐야 할 것 같아요 두번째 사진도 저희집 멍뭉이에요 누워있는게 너무 귀여워서 안 찍을 수 없었어요 근데 사진 하나 찍을 때마다 필름값이 생각나서 좀 눈물 날 것 같아요 취미에는 역시 돈을 안 아까워 해야겠죠? 따흑 그래서 이번에 필름을 중고로 구매했습니다! 40장에 택배비 포함 2만원에 구매해서 개인적으로는 잘 샀다 생각하고 있어요 카메라도 그렇고 필름도 중고로 자주 나와서 잘 살펴보다 구매하시는 거 추천드립니다. 그리고 투명 케이스도 끼워봤어요 투명 케이스 낀게 더 귀엽고 뭔가 힙한 느낌이 들어요  투명케이스랑 케이스에 끼우는 스트랩도 같이 왔는데 그건 너무 저렴한 느낌들어서 안 끼웠어요 나중에는 케이스 안쪽에 스티커 같은 거 붙여서 카메라 꾸며 보려구요! 그런데 투명 케이스 끼우니까 갑자기 좀 확 무거워진 느낌도 들고 케이스랑 카메라 사이에 먼지도 끼고... 필름 넣을 때 너무 불편해 버리고... 솔직헌 심정으론 나는  무조건 카메라를 떨어트릴 것 같다! 하시는 분 아니면  그냥 구매 안 하시는 것 추천드립니다 (근데 끼우면 예쁘긴 해요.) 여기까지 소소한 후기였습니다! :^) 소비해서 행복하긴 한데 통장 잔고때문에 눈물 나긴 해요 깔꼬롬한 0원 보이세요? 장난 아닙니다 그래도 행복하면..된 거.. 맞겠죠 ㅎㅎㅎ... 눈물 흘리며 필름값 벌러가유 아무튼! 여러분도 미니 11 사시고 함께 행복한 텅장러가 됩시다! 궁금하신 점 있으시면 댓글 남겨주세영 남는게 시간이라 투머치 토커마인드로 대답해 드릴게요 그럼 다음에 또 만나유!",2012,17,['인스탁스 미니11 언박싱'],1,https://postfiles.pstatic.net/MjAyMTAxMTBfMjQw/MDAxNjEwMjcxNDI2MTcw.CJx0o3P49_RE6Eim_2801R8Sk1sBR3M3GKt9CI9KlvUg.KmLARqFj_r6XddzdvTuGOWd2z5_fnBZR4QmY4i5MXrIg.JPEG.kjin_098/SE-83aeb798-c10f-4930-af3e-35feae7ddde6.jpg?type=w773,https://postfiles.pstatic.net/MjAyMTAxMTBfMTIx/MDAxNjEwMjczMjc1NTUx.r9WLZr6XGBrkbJTLezSOMSyiS5hZTvuyDvtP13ViTDUg.fVVE6-iJ0KCzdlifhfcTR1rrv2QyaNEGs_vCUa89H9Ug.JPEG.kjin_098/SE-cbcb14c3-6eb7-43be-8421-c1aa531ab14a.jpg?type=w773,11,1,0,0,0,0,0,5,0,0,0,0,0,1,1,0,0,0,0,0,0,0,0,0,0,0,1,1,1,1,0,0,0,0,0,0
