url,title,post_date,검색어,브랜드 명,content,content_cnt,content_line,quote,quote_cnt,first_img,last_img,img_cnt,솔직 빈도 수,비교 빈도 수,ㅋ 빈도 수,ㅋㅋ 빈도 수,ㅋㅋㅋ 빈도 수,ㅋㅋㅋㅋ 빈도 수,... 빈도 수,.... 빈도 수,ㅜ 빈도 수,ㅜㅜ 빈도 수,ㅜㅜㅜ 빈도 수,ㅜㅜㅜㅜ 빈도 수,ㅠ 빈도 수,ㅠㅠ 빈도 수,ㅠㅠㅠ 빈도 수,ㅠㅠㅠㅠ 빈도 수,장점 빈도 수,단점 빈도 수,비속어 빈도 수,허락 키워드,내돈내산 키워드,리얼후기 키워드,협찬 키워드,체험단 키워드,coupa.ng 키워드,< 키워드,> 키워드,♡ 키워드,♥ 키워드,구매후기 키워드,한달 키워드,두달 키워드,세달 키워드,광고 분류1,광고 분류2
https://blog.naver.com/PostView.naver?blogId=jyl3126&logNo=222084811620,카메라! 색감 천재 *인스탁스 미니11 라일락 퍼플* 후기,20200909,미니11 리뷰,인스탁스 ,"안녕하세요 :) 오늘은 생일선물로 받은 *후지 인스탁스 미니11*에 대해서 포스팅 해보려고 합니다ㅎㅎㅎ 사실 생일도 많이 지났구, 생일선물을 받은지도 꽤 지났지만! 이제서야 폴라로이드를 찍어볼 일이 있어서~ 언박싱을 해봤습니다! *인스탁스 미니11*은 제품의 크기에 딱 맞는 상자에 들어가 있어요~ 상자에 적힌 설명을 보면 온 터치 셀피 모드가 되고, 자동 노출 조절이 되어서 이미지가 더 화사하게 나온다고 합니다! 커스터마이징 할 수 있는 셔터 악세사리도 들어 있다구 해요ㅎㅎㅎ 그리고 패키지 구성품은  폴라로이드 카메라, 핸드 스트랩, 셔터 악세사리, AA 건전지, 설명서가 들어있다고 합니다! 잘 들어 있는지 언박싱을 해볼까요? :D 상자에 설명된 구성품들이 모두 잘 들어 있는 모습을 확인할 수 있습니다! 전 처음에 상자에 있는 구성품 설명을 잘 읽지 않아서ㅋㅋㅋ 저 조그맣고 동그란게 뭐지 했어요..! 저게 바로 셔터 악세사리였습니다ㅋㅋㅋㅋ 실내에서 사진을 찍으면 라일락 퍼플의 예쁨이 잘 안나와서, 굳이 미러리스 카메라를 들고 야외로 나가서 자연광 아래에서 사진을 찍었어요ㅋㅋㅋㅋ 진짜 라일락 퍼플 색감 넘 예뻐요ㅜㅜㅜㅜ 혹시나 색깔 고민하고 계신 분이 있다면 라일락 퍼플 완전 추천합니다!! 사진 안 찍고 보기만 해도 배부른 느낌~ 필름 없이 악세사리로 들고 다녀도 손색이 없을 정도로 예쁩니당!! 차례로 셔터 악세사리, AA 건전지, 핸드 스트랩입니다 부가적인 악세사리들도 라일락 퍼플에 잘 어울리는 색감으로 구성이 되어 있어요~ 어떤 셔터 악세사리를 붙일지 고민을 하며 흰색도 대보고, 보라색도 대보다가 보라색을 붙이기로 결정했어요ㅎㅎㅎ 흰색도 귀엽기는 한데, 보라보라하게 색감을 통일하니까 본체의 색감이 더 사는 것 같더라구요~ 다음에 보라색이 질리면 흰색을 붙여봐야겠어요ㅎㅎㅎ 셔터 버튼의 경사에 맞게 악세사리도 높이가 다르니, 높이를 잘 맞춰서 동봉된 양면테이프를 이용해서 떨어지지 않게 살포시 눌러서 붙여주면 됩니다! 다음에 흰색으로 바꾸고 싶을 수도 있으니까. 남은 양면테이프는 상자 안에 잘 넣어뒀어요! 소중한 폴라로이드 카메라가 이동 중에 혹은 사진 찍다가 떨어지지 않게 핸드스트랩도 야무지게 달아주었어요! 색감이 정말 예쁜데 형광등 아래에서는 그 색감이 살지 않아서 아쉽네요ㅜㅜ 모든 악세사리가 보라보라해서 좋아요>< 밖에서 *인스탁스 미니11 라일락 퍼플*을 소품 삼아서 사진을 찍어도 넘 예쁘게 나올 것 같아요ㅋㅋㅋㅋ 뒷면을 기준으로 오른쪽에 건전지를 넣는 칸이 있어요! 건전지는 AA 건전지 2개가 필요하구요, 사진기에 +, - 표시가 있어서 건전지 넣는 방향으로 고민할 필요가 없어요!!ㅎㅎㅎ  카메라 본체의 뒷면에 폴라로이드 필름을 넣는 칸이 있어요~ 윗쪽의 버튼을 아래로 눌러서 뚜껑(?)을 열면 됩니다! 필름을 패키지 구성품이 아니라서 별도로 구매했어요! 빨리 받아보고 싶은 마음에 쿠팡 로켓배송을 이용해서 구매했는데, 다른 곳이랑 비교해 봤을 때 적정한 가격에 구매한 것 같아요~ 상품평에 안 좋은 이야기도 많아서 걱정했지만, 저는 찍어보니 아주 선명하게 잘 나왔어요! 다음에 필름 구매할 때도 전 쿠팡 로켓배송 이용할 듯 합니다ㅎㅎㅎ 필름을 넣는 방향도 표시가 되어 있어서 헷갈리지 않고 잘 넣을 수 있습니다! 본체의 노란 선과 필름의 노란선이 일치하는 방향으로 넣어주세요~ 보기 전에 필름 방향은 어떻게 맞추지;; 엄청 고민했는데ㅋㅋㅋ 그런 고민을 할 필요가 없었습니당! 굉장히 편리하게 사용할 수 있도록 카메라 구성이 잘 되어 있는 것 같아요~ 2-3년 전에 폴라로이드 사진을 찍어본 적이 있는데, 그때 불편했던 점이 필름이 몇 장이 남았는지 알 수 없다는 점이었어요ㅜ 마지막에 까만 필름이 나와야 이제 끝났구나를 알게되는 문제..! 그런데 *인스탁스 미니11*은 필름이 몇 장이 남았는지 표시해주는 부분이 따로 있더라구요 그래서 신경써서 몇 장 남았는지 따로 체크하지 않아도 편하게 필름 관리를 할 수 있었어요 그리고 카메라 렌즈 부근에 거울이 있어서 셀카 촬영도 잘 할 수 있겠더라구요! 제가 찍어봤던 폴라로이드 사진기는 서로서로 찍어줘야 해서 둘이 같이 나오기는 힘들었는데,  이렇게 거울이 붙어 있으니 둘이 셀카 촬영도 자유롭게 할 수 있을 것 같아요!! *인스탁스 미니11*은 여러모로 사용자의 편의에 맞춰서 구성되어 있다는 생각을 했습니다! 벌써 여러 장의 사진을 찍어봤는데, 폴라로이드 특유의 감성이 잘 담겨있는 사진들이 탄생했어요! 폴라로이드 전용 사진첩에 넣으니 보관하기도 좋고, 추억이 쌓여가는 것도 보여서 넘 재밌어요 :D 폴라로이드 사진기 찾는 분들 *인스탁스 미니11*도 한 번 고민해보시구, 혹시 색깔 고민하고 있는 분이 계시다면 라일락 퍼플 완전 추천합니다♥",2315,17,"['라일락 퍼플에 반하다후지 인스탁스 미니11', '1. 셔텨 악세사리 붙이기', '2. 핸드스트랩 연결하기', '3. 건전지와 폴라로이드 필름 넣기', '부가적 기능 소개']",5,https://postfiles.pstatic.net/MjAyMDA5MDRfMTc3/MDAxNTk5MjA0MzU5NTY1.uk7zlu8kmE-0OqJwUahhhYCFe1DF_gU_GeaJAcoHczgg.V1ILuTlOxhPE1s-cZoTpOCESPIkrCV2W0oX6J8DbzFQg.JPEG.jyl3126/DSC00794.JPG?type=w966,https://postfiles.pstatic.net/MjAyMDA5MDRfNjQg/MDAxNTk5MjA0NTg0NzI2.SvZZg6dZb-iRpiCXpOlZeDxQI6H0WCVtoWUDFW05M2og.DXYQdojzOgnfuWjHa9b0UkDJ_-Cf5YwXa1aui1eI8_cg.JPEG.jyl3126/IMG_6297.jpg?type=w966,20,0,1,5,5,5,3,0,0,3,2,1,1,0,0,0,0,0,0,0,0,0,0,0,0,0,1,1,0,1,0,0,0,0,0,0
https://blog.naver.com/PostView.naver?blogId=tmdgp333&logNo=222482219491,인스탁스 미니 11 A/S 후기 두번째 이야기,20210824,미니11 리뷰,인스탁스 ,금요일에 센터를 방문했고 월요일에 수리완료 문자가 왔다 이전 포스팅에도 말했듯이 정품스티커가 있는 제품은 3-4만원 (VAT별도) 해외 직구상품은 4-5만원 (VAT별도) 직구상품이 정품스티커가 없어서 좀 비싸다고 하셨다 문자 보자마자 바로 입금시켰는데 당일발송을 시켜주신건지 다음 날 점심쯤 카메라가 도착했다 후지필름에서 쓰는 박스 뭔 박스까지 감성있다 카메라라 충격파손 가능성이 높으니 뽁뽁이도 가득 2중으로 뽁뽁이가 들어있었다 깨끗하게 없어진 찍힘 ! 원래는 버튼 누르면 뾱 나와야하는데 충격을 받아서 고장이 나버린 버튼 수동으로 해줘야했다 수동 그게뭔데 어떻게 하는 건데 언제 그랬냐는듯 뿅 튀어나와주는 카메라 렌즈 그리고 새 필름까지 들어있었다!!! 😇😇😇😇😇 너무나도 만족스러운 AS후기,390,11,"['고장 1', '고장2']",2,https://postfiles.pstatic.net/MjAyMTA4MjRfMTQx/MDAxNjI5Nzc5MTMyNDMx.lXqTdq9it5fdiDoiP-QSWM8PXjgN7I3SsnGYg_Hu5pkg.RRo7MCpn9c19DEEaBgN0Ld9e5LQJW9n79HuPFagjVBwg.JPEG.tmdgp333/F98C8A80-AD02-452B-BF3F-AD57A39ECDCA.jpeg?type=w773,https://postfiles.pstatic.net/MjAyMTA4MjRfNjMg/MDAxNjI5Nzc5MTMyNzU4.f8Wc10FW3b_NtcS0n4qsPNREGfCJ6y2Ka6MthTss2mMg.iXWz4mYh-vGvsMS2hSgfDU67y_H2nXOHSXwKK8is-1sg.JPEG.tmdgp333/IMG_5967.jpg?type=w773,9,0,0,0,0,0,0,0,0,0,0,0,0,0,0,0,0,0,0,0,0,0,0,0,0,0,0,0,0,0,0,0,0,0,9,9
https://blog.naver.com/PostView.naver?blogId=alsrud1528&logNo=222084969408,추억남기기  _ 인스탁스 미니11... 내돈내산 후기 /개봉후기,20200909,미니11 리뷰,인스탁스 ,"#인스탁스 #후지필름 #인스탁스미니11 #미니11 #폴라로이드 #폴라로이드추천 #개봉후기 #사용후기 #가성비카메라 #카메라추천 #필름카메라 #소통 #서로이웃 #서로이웃환영 #서이추 안녕하세요 밍굥입니다 😊 저번 친구 생일선물로 폴라로이드 사줬었는데  유용하고 추억남기기 좋은거같아서  얼마전 저도 구매했습니당  ✨ 개봉후기를 한번 남겨볼게요  !  제 친구는 화이트 컬러 사줬어용 심플 그자체 ! ! 짱이쁨~~ 저는 무슨 색 살지 고민하다 엄마가 조아하는 보라색으로 💜 글로리스에서 미니11+ 필름2 + 투명케이스 + 앨범/건전지  패키지로 12만원대에 구매했습니다 가성비가 갑이에요 ! 필름이랑 앨범!  투명케이스 낀 모습이에용 파스텔톤 연보라여서 실물 진짜 이뻐요 !! 폴라로이드나 인스탁스는 종류가 몇개 있는데  미니 11이 제일 나은거같더라구요 ! 우측 상단에  동그란 셔터버튼 , 플래시 터지는 곳 중앙쪽에 렌즈  버튼을 누르면 렌즈가 뽁 하고 튀 나와요! 뒷면에 필름 넣는곳과 몇장 남아있는지 표시가 되어있어요 ! 렌즈로 보이는 화면! 투명케이스  열면 더 매트한 연보라색인데 (조녜ㅔ) 기스나면 슬프니까  케이스 계속 끼고 있어야겠어요! 저의 첫 사진 주인공은  울집 강쥐 Happy 🐶  처음보는 물건에 당황했나봐요  표정이 영 ••• 앞으로  좋은 장소 🏡 좋은 사람 👯‍♀️ 좋은 풍경 🏞 등  📸 특별한 기억들을 많이 남길 예정  😋 이상 내돈내산 인스탁스 미니11  개봉 후기+ 사용후기 였습니다 !  그럼 다음번에도 좋은 정보 들고 찾아올게요 ! 공감과 댓글은 힘이됩니다 👍🏻 즐거운 하루 보내세요 😊",797,13,['폴라로이드카메라 / 인스탁스미니11 / Instax mini 11\u200b초점방식 = 자동초점뷰파인더종류 = 상단뷰플래시기능 = 자동무게 =293g색상 = 라일락 퍼플사이즈 (W x H x D ) =107.6x121.2x67.3mm'],1,https://postfiles.pstatic.net/MjAyMDA5MDlfMjcg/MDAxNTk5NjQ3MjY4MzA4.70my5uTTpn19iY1bdYmHtmB7P1XmlZW_AFAMIFhiXiog.1za2r3lWrvxOFh0GUbDgW9rrIc9-bOqgTZSmyHAAxOQg.JPEG.alsrud1528/output_566461247.jpg?type=w773,https://postfiles.pstatic.net/MjAyMDA5MDlfMTQ3/MDAxNTk5NjQ3MDA3NDI3.j59fdWvyX2zC-IGv2PcEOBkZ4YwkI4kDn4ft1OSIW7Ug.SfPEO61zFD3s4BvqOM6PRc4KOOtq505Obm1F0uhiJ_Qg.JPEG.alsrud1528/output_1357412782.jpg?type=w773,14,0,0,0,0,0,0,0,0,0,0,0,0,0,0,0,0,0,0,0,0,1,0,0,0,0,0,0,0,0,0,0,0,0,0,0
https://blog.naver.com/PostView.naver?blogId=janek0105&logNo=222081964903,[후기] 인스탁스 미니11(instax mini) 라일락 퍼플 사용법,20200906,미니11 리뷰,인스탁스 ,"8월 23일! 친구들에게 생일 선물 을 받았습니당 할랄랄라 ~ ( 생일이 한겨울인 것은 안 비밀,,ㅎㅎ ) 늦게 챙겨줘서 미안하다고 한 착한 친구들,,,, 이제 본격적으로 포스팅을 시작해볼까요 후후 인스탁스 미니11 본품 (라일락 퍼플) + 전용 가죽 케이스 +2단 앨범   + 나무 집게 + 추가 필름 20장 으로 알차게 구성되어 있었습니닷 아앗,,  파스텔 보라색,,  색감이 너무 예쁘죠 ヽ(＊>∇<)ﾉ 정품 등록하면 필름 10장을 무료로 보내준다고 합니다! ( 바로 해버리기 ㅎ ㅎ ) 사이드 부분을 열어 안에 들어있던 건전지를 넣어주세요!  필름을 준비해주세요! 뒷면에 필름 넣는 곳이 있습니당  방향에 맞추어 필름을 넣어줍니다! (노랑색 표시된 부분을 확인 해주세요!) 앞면 하단에 있는 버튼이 카메라 ON/OFF 버튼이에요 버튼을 누르게 되면 카메라 전원이 켜지면서 빨간 불이 들어오고 카메라 렌즈 부분이 튀어나오게 됩니다! 사용이 끝난 후에 렌즈를 그냥 눌러주면 OFF가 됩니다 정말 쉽죠? ㅎㅎ s라고 표시된 상태에서 셔터를 눌러 촬영을 하게 되면 필름 껍데기가 나옵니다 (이 다음부터가 진짜 촬영! 입니다!) 10으로 표시됐죠? 이제 필름 카운팅 시작입니다! ( 여기 표시된 숫자를 통해 필름이 몇장 남았는 지  알 수 있다는....! ! ! ) 전원이 켜져있는 상태에서 렌즈 앞부분을 당겨주면  SELFIE ON 상태가 되어 셀카 모드로 전환된다는 점 ! ( 렌즈 부분에 붙어있는 거울을 보면서 셀카를 찍으면 됩니다 )  케이스도 끼워봤어요 꺄 ㅎㅅㅎ 디자인도 너무 예쁘고, 조작법도 쉬워서  너무너무 만족하는 제품입니다 ! ( 잘 쓸게 고마워 ㅜㅜ♡ ) 이제 놀러갈 일만 남은 듯 한데.. 로나야 언제 사라지니....? 진짜 놀러가면 필수템이에요 이거슨 ..~....~.>....~~ 아 빨리 놀러가고 싶다 증말.",915,15,[],0,https://postfiles.pstatic.net/MjAyMDA5MDZfMTEy/MDAxNTk5MzgyNTc2Njgz.Xr3xlw76eBui2x_M0KPkibZVUXrx4MUg41Zz-24b0kAg.qGg1QGpRuv17chhTy6ZQN3G8MnV_QO5m6y3oNMIRNqAg.JPEG.janek0105/KakaoTalk_20200906_175343650.jpg?type=w773,https://postfiles.pstatic.net/MjAyMDA5MDZfMTIz/MDAxNTk5Mzg4MjY5ODUx.xDDJMUdt_IaVvK8n8jUIHVgi2EZcEh--uUsvAtFGNVQg.QGML_hyuFcFEneMdTSaJdeVuY1u8aBM41rqp0jHf7dIg.PNG.janek0105/image.png?type=w773,10,0,0,0,0,0,0,3,3,1,1,0,0,0,0,0,0,0,0,0,0,0,0,0,0,0,1,1,1,0,0,0,0,0,9,9
https://blog.naver.com/PostView.naver?blogId=miin2777&logNo=222236105754,인스탁스 폴라로이드 미니 11 후기 / 폴라로이드 사용법... ,20210208,미니11 리뷰,인스탁스 ,폴라로이드 카메라가 갖고 싶은 우리 아드님때문에  주말 아침 급하게 지르신 폴라로이드 카메라입니다  쿠팡와우로 구매해서 일요일이지만 바로 배송 받았네요 항상 감사합니다 🤍 쿠팡 스릉흔드.....ㅏ  오전 내내 검색해본 결과 폴라로이드는 인스탁스 제품 인지도가 높은거 같아요 후지필름에서 만들어졌더라구요 폴라로이드의 최대 단점은 필름이 비싸다 최대 장점은 세상에 한장 뿐이 사진 그리고 감성ㅋ  전 사진 프린터기 사자고 만류 했으나  저 폴라로이드 갬성에 빠지셨나봅니다 쨋든 오늘 구매해서 온 카메라 구성 알차네요  하늘색 카메라 구매했더니 다 하늘하늘한 제품으로 맞춰 보내주셨어요 센스 굿~!   오렌지컬러의 박스  뒷면 윗면   상자가 엄청 앙증맞아요 개봉해보니 이렇게 뽁뽁이에 잘 포장되어 있는 카메라가 보이네요 건전지 스트랩 촬영버튼 실리콘 그리고 설명서 이렇게 저 박스안에 들어있어요 한손에 들어오지만 투박한 카메라 하늘색이 상큼상큼합니다  마치 장난감 같아요 ㅋㅋ 옆에 까만네모가 필름이고 이 곳에 넣고 찍음 되더라구요 자그럼 찍어볼까요 첫장은 뚜껑같은거 나오구 ( 이제 암 ㅠㅠ) 두번째 장부터 사진이 나와요 작은 사이즈의 사진이 나왔어요 초상권때문에 일부로 빛 비치게 올렸으나 사진은 이상 없어요~ 근데 문제는 이 다음부터예요 그담엔 하얀 사진만 나오더라요 검색해보니 저 필름은 넣는 순간부터 열어보면 안되눈 거였는데 우리 아드님 호기심 뿜뿜 하셨는지  하나찍은뒤 슬쩍 열어봤다네요 한번 열면 그안에 남은 필름은 모두 요단강을 건넌거라며  다 버리고 새로 끼우라며.... (그래도 막판엔 약간 나오긴 하더라구요 ) 폴라린이 ㅋㅋ 아주 크나큰 교훈을 얻고  앞으로 잘하자며 파이팅 해주었어요  필름 10장에 1만원정도 하던데 ㅋㅋ 어서 용돈 모아 사렴  올만에 폴라로이드 사진 보니 추억돋고 좋긴 하네요 하하 #인스탁스 #폴라로이드 #인스탁스미니11 #즉석사진기 #폴라로이드카메라개봉기 #폴라로이드카메라 #후지필름 #감성사진찍기,973,17,[],0,https://postfiles.pstatic.net/MjAyMTAyMDdfMTQg/MDAxNjEyNzAzMTM4NTQ5.Le487KFK-1RDgenHthjbPuRRbKMM08fpqT8ruMh_5dUg.ZqY3QEbkR33SPXKrjPrB82jNTat469hiz6a4bTjKSmog.JPEG.miin2777/IMG_0294.JPG?type=w773,https://postfiles.pstatic.net/MjAyMTAyMDhfMTUw/MDAxNjEyNzQ4MzAwNTI4.Ki9VPOhp1BisSgrF167F8kK_T1u122iCyg_gFIlbge4g.yRaKvGyuGadtuAe_I_64A3ywOUMN1ktjqw_tqflxzDEg.JPEG.miin2777/IMG_0305.JPG?type=w773,10,0,0,4,3,0,0,2,2,0,0,0,0,1,1,0,0,1,1,0,0,0,0,0,0,0,0,0,0,0,0,0,0,0,9,9
https://blog.naver.com/PostView.naver?blogId=qjqtjdgod&logNo=222274000874,갬성 카메라 인스탁스 폴라로이드 미니 11 라일락퍼플 구매 후기,20210313,미니11 리뷰,인스탁스 ,"안녕하세요. 이번 4주년 기념 국내여행을 다녀왔는데, 이왕 간김에 갬성 넘치게 사진 찍고 싶어서 폴라로이드를 구매하였어요. 저는 네이버 인스탁스 공식몰?에서 구매했어요. 쿠팡 다른 네이버 사이트 등등 여러개에서 비교해봤는데 인스탁스몰이 가장 가성비가 좋더라고요. 제가 산 폴라로이드 구성품은 본체 + 케이스 + 필름 20장 + 앨범 + 나무집게 였고 저는 여기서 필름 30장을 더 추가로 구매했습니다. 총 구성품이에요. 본체랑 케이스는 색깔 선택이 가능했는데 인기있는 색들은 품절되어 있었어요. 다행히 제가 살때는 라일락퍼플색이 있어서 케이스랑 깔맞춤하여 구매했습니다. 케이스는  가방처럼 메고 다닐수 있어요. 선이 긴편이라서 여행갈때 폴라로이드 넣고 다니기 좋더라고요. 색상도 연보라라서 갬성 +1 한가지 아쉬운 점은 케이스 낀채로 사진 찍을수 있을거 같긴 한데 저는 좀 불편하더라고요. 찍을때마다 케이스에서 분리해야되는 점이 아쉬웠어요. 본체 구성품이에요. 설명서, 건전지, 꾸밀수 있다는 동그라미 캡?, 손잡이같이 줄?이 들어있는데 저는 오로지 갬성이 필요하기 때문에 건전지만 연결후 다 버렸습니다. 믿기지 않겠지만 제가 갬성 미니멀라이프를 시작했거든요. 박스부터 안쓰는거 다 쓰봉행. 인스탁스 폴라로이드 미니 11 색은 총 다섯가지인데 이 라일락퍼플이 요즘 인스타에서 핫하더라고요.  원래는 바다여행이기 때문에 스카이블루 색상을 선택하려고 했지만 봄이고 4주년이고 갬성여행이기 때문에 인스타에서 핫한 갬성 넘치는 색을 선택 했어요. 뒷면은 필름 넣는곳이 들어있어요. 그 옆은 필름 남은 수를 볼수 있어요. 필름 값이 비싸고 사는게 귀찮아서 폴라로이드 안사려고 했는데 대량구매하면 되겠지 싶어서 50장을 들고 여행을 다녀왔어요.ㅎㅎ   필름을 넣으면 이런모양. 첫장은 마개이기 때문에 날려주고 열장을 열심히 찍으면 되요. 폴라로이드 사용 이주 정도 되었는데 확실히 들고 있으면 갬성 넘치는데 은근 폴라로이드 사진 찍기가 어렵더라고요. 가끔 엄청 하얗게 나오는게 있는데 주변에 미니9? 쓰는 사람은 카메라 내에서 빛조절 가능하다는데 11은 잘 모르겠어요... 더 공부해보고 써봐야겠어요. 들고 찍으면 요런 느낌. 크기 자체도 쪼꼬미 하고 무겁지 않아서 들고다니면서 사진찍기 좋았어요. 인스타에서 핫한 이런 사진도 찍을수 있어서 더 좋아요.ㅎㅎ 사진은 요렇게 찍어서 갬성샷 찍고 집에 보관 중이에요. 화질은 구지지만 어차피 폴라로이드는 갬성 보관용이니깐 그냥 넘어가고 있어요. 개인적으로 너무 만족하고 있는 폴라로이드. 요즘 다시 유행이 시작되었다고 하는데 인스탁스 폴라로이드 미니11 전 추천합니당! #폴라로이드 #갬성 #갬성카메라 #카메라추천 #인스탁스 #폴라로이드미니11 #보라색폴라로이드 #구매후기 #내돈내산 ",1354,10,[],0,https://postfiles.pstatic.net/MjAyMTAzMTNfMTAg/MDAxNjE1NjE2MTQyMTc5.AafT1HkFaIhzCTK0bs1NqhfUyDzbuyFM8Xis9HIareMg.ZUS1GMRpEEllTvbAdYGhQ-P8lMOtxepEa15WDuB0Mk4g.JPEG.qjqtjdgod/SE-0CF5F038-B03B-4F5C-8BF4-D72905513C3E.jpg?type=w773,https://postfiles.pstatic.net/MjAyMTAzMTNfMTM0/MDAxNjE1NjE2MTI2OTgy.-LZ4V5WVy17prEtVwEwFxHKeGhNExCNFHow-rMoBcU4g.DoEp6Q1RPRABob5tpnToWE7KcGIfzzbqtci4M940xVMg.JPEG.qjqtjdgod/SE-26ED60A7-77E0-453D-8AAA-9ED4A53AC156.jpg?type=w773,10,0,1,0,0,0,0,1,0,0,0,0,0,0,0,0,0,0,0,0,0,1,0,0,0,0,0,0,0,0,1,0,0,0,0,0
https://blog.naver.com/PostView.naver?blogId=beeeeeeast1016&logNo=222037899306,인스탁스 미니 11 폴라로이드... 공구 후기 (feat. 폴라로이드... ,20200722,미니11 리뷰,인스탁스 ,"드디어 인스탁스 미니 11 공구로 구매했었던 폴라로이드 카메라가 도착했어요  (이번에 소셜클럽 사이트에서 7/26 -7/29 공구가 또 열린대뇨) 건전지와 줄고리, 카메라 셔터부분에 끼울수 있는 악세서리 동그라미들이 있구 안에 사용설명서도 들어있답니댜 화이트가 역시나 예쁘메요 영롱해🤍 투명 케이스를 얼렁 사서 보호해줘야게써요 이렇게 버튼을 누르면 카메라가 켜집니당 배터리를 안끼웠더니 불빛이 안들어오는데 이렇게 배터리를 끼우면 라이트센서에서 주황색 불빛도 나오고 필름을 끼우면 뒤에 필름이 몇장 남았는지  필름 남은 개수도 알려준답니당   ( ⁼̴̤̆◡̶͂⁼̴̤̆ )  심지어 플래시도 자동으로 작동해요 똑똑해 똑똑해!!! 저기 은색 네모난건 셀카로 찍을때  거울 역할을 하더라구요! 필름을 뜯으면 위 사진처럼 상단에 노란색 표시가 있어요  카메라의 필름 넣는 부분 상단에도 노란 부분이 있구요 그걸 끼워 맞춰 넣으면 완성 ✧˖°  폴라로이드 필름을 꺼내면 뒤에 상세설명이 있답니다 그리구 어디선가 들었는데 필름을 끼우고 나서는  카메라 뒤에 필름 뚜껑을 열어보지 않는게 좋다고 하더라구요 필름이 빛과 공기에 닿아서 구실을 못한다고 ....??? 그러니까 한번  열어보고싶＼⍩⃝／지만  참아야한다 첫 필름은 테스터입니당 이게 나오면 그 후부터 찍으면 됩니다 앗 그리구 직사광선에 많이 노출되면 사진이 안나올 수도 있대요 찍고나서도 사진을 빛에 심하게 노출시키면 사진이 바랜대요 빛에 취약한 폴라로이드 •• 모두 조심해서 사용하세용 인스탁스 미니 11 아이스 화이트  인스탁스 미니 11 폴라로이드 필름 끼우는 법  이상 별거 없는 후기 끗 그럼 여러분 안녕   ଘ꒰◍ॢ•ᴗ•◍ॢ꒱ଓ",830,10,[],0,https://postfiles.pstatic.net/MjAyMDA3MjJfMjky/MDAxNTk1MzU1MzcyOTkw.3ZZJCOZ-hGnm-BAech3n_ffGmQkpBImJKaJwgNzhaQAg.-LvOzBdwuIAu4OIrWJY9OqFvgIjnIkvJ8ui_WuPoTfcg.JPEG.beeeeeeast1016/IMG_9328.JPG?type=w580,https://postfiles.pstatic.net/MjAyMDA3MjJfMTU3/MDAxNTk1MzYxNDI4NjI1.6AhFgJq9XQQlcsEs39_R2Q4ClbJpvSt2leSyHhT24fIg.uOghOVQkZCSNvuSmmX0QQ93kCMtFXCvCSlU4raS6pLsg.JPEG.beeeeeeast1016/IMG_9195.jpg?type=w580,12,0,0,0,0,0,0,1,1,0,0,0,0,0,0,0,0,0,0,0,0,0,0,0,0,0,0,0,0,0,0,0,0,0,9,9
https://blog.naver.com/PostView.naver?blogId=ldb1491&logNo=222109790876,매우 늦은 인스탁스 미니11 후기,20201008,미니11 리뷰,인스탁스 ,공부하기 시러서 새벽에 쓰는 몇 달 만의 폴카 후기 이렇게 배달이 왔었어요  ‘여행에 미치다’ 공구로 샀었는데 거기가 망해버렸네 ㅋ 암튼  카메라는 가격이 이거였던것같고 필름 3갠가 4개까지 함께 구매했다 설레는 마음으루 개봉 내가 조아하는 하늘색 ~ 💙~💙  요렇게 줄이랑 똑딱이같이 생긴게 들어있었는데  똑딱이는 안쓰고 줄은 잃어버렸어요 하하 ㅠ 아 저렇게 영상도 찍어놨던거 발견함 전원버튼 누르면 카메라 뿌슝 나오고 불 깜빡이고 좀 기다리면 깜빡이던게 멈춤  그러면 하늘색 동그라미 누르고 찍으면 된다 뒷면은 요렇고 필름 이 방향으로 넣으세요 ! 잘못 끼면 빼기  아주 힘들어짐 첫번째 한 장은 저렇게  필름 껍데기가 나옴 ㅋㅋㅋㅋ 이제 끝 모두 뇽안 ,368,12,['Instax mini 11'],1,https://postfiles.pstatic.net/MjAyMDEwMDhfMjUz/MDAxNjAyMDg3ODgxNDkz.eI6r91lJQaPWLFQTEyYEdSHw8LpcI75_nqRAtXk09oMg.f9XTCI16oXDy81BC1e_-H1Xy5ELspOXcRcXbCX3KlxAg.JPEG.ldb1491/IMG_3829.jpg?type=w966,https://postfiles.pstatic.net/MjAyMDEwMDhfMTM5/MDAxNjAyMDg5NTI4MTM3.dur3q2CYfL1OqS5NNR4KauM2VNt4hXfHhKwum_uwTJUg.MUyCdZqSO6rO3XcFP5vvxsfJnIpX3U08MarTwyFvvJsg.JPEG.ldb1491/output_4254641839.jpg?type=w966,13,0,0,2,1,1,1,0,0,0,0,0,0,1,0,0,0,0,0,0,0,0,0,0,0,0,0,0,0,0,0,0,0,0,9,9
