url,title,post_date,검색어,브랜드 명,content,content_cnt,content_line,quote,quote_cnt,first_img,last_img,img_cnt,솔직 빈도 수,비교 빈도 수,ㅋ 빈도 수,ㅋㅋ 빈도 수,ㅋㅋㅋ 빈도 수,ㅋㅋㅋㅋ 빈도 수,... 빈도 수,.... 빈도 수,ㅜ 빈도 수,ㅜㅜ 빈도 수,ㅜㅜㅜ 빈도 수,ㅜㅜㅜㅜ 빈도 수,ㅠ 빈도 수,ㅠㅠ 빈도 수,ㅠㅠㅠ 빈도 수,ㅠㅠㅠㅠ 빈도 수,장점 빈도 수,단점 빈도 수,비속어 빈도 수,허락 키워드,내돈내산 키워드,리얼후기 키워드,협찬 키워드,체험단 키워드,coupa.ng 키워드,< 키워드,> 키워드,♡ 키워드,♥ 키워드,구매후기 키워드,한달 키워드,두달 키워드,세달 키워드,광고 분류1,광고 분류2
https://blog.naver.com/PostView.naver?blogId=alswl970921&logNo=222514247016,인스탁스 미니11 폴라로이드 라일락퍼플 후기 (당일배송 +링크),20210923,미니11 리뷰,인스탁스 ,"안녕하세여 잇님들 ㅎㅎㅎ 생일이라서 선물받은 인스탁스 미니11 즉석카메라 !!! 라일락퍼플색 예전부터 가지고 싶었는데  드디엉 ㅠㅠㅠ 내손에 들어왔다 도니가 사준 코닥 필름카메라도 곧 올꺼구 ~~!! 앗싸 나이제 카메라 부자 ㅎㅎ  디카만 있으면 너무 행복하겠다 ㅠㅠ 쿠팡에서 구매했고 로켓와우라서 다음날 바로 배송왔답니다 인스탁스 미니 11 즉석카메라 라일락퍼플 구성품이 너무 좋아요 필름 + 케이스 + 앨범​ 즉석 인화되는걸로  모든 사진 다 인화할까 하다가 그냥 폴라로이드 갬성을 느끼고 싶었어요 ㅎㅎ 사실 진짜 쓸때 없는건 사실이지만 근데 또 쓸때없는게 아닌 폴라로이드 ㅋㅋ 라일락 퍼플색 색상 선택 너무 잘했음 후후 요즘 이런 퍼플색이 넘 이쁘긴함 ㅎㅎ ㅎ  다른 색상은 화이트 핑크 하늘색 있더라구여 건전지도 같이 들어있어서 따로 준비할게 없는  인스탁스 폴라로이드 미니11 이거 셔터 부분에 양면 테이프 뜯어서  붙여가지궁 뭐 버튼 꾸밀겸 편하게 누를겸 주는것 같은데 쓸모 1도 없음 테이프 접착력 0 이고  끼우자마자 데구르를르 빠져버림 ㅎㅎ 결국 난 사용 안하기로 ,, 폴라로이드 처음인데 사용법 완전 간단 그냥 건전지 끼우고 뒷면에 필름 넣어주면 되는 인스탁스 미니11  필름 10장이니까 아껴서, 신중하게  찍는다는 장점이 있는 폴라로이드 ㅎㅎ 오른쪽 s 는 처음 찍고나면 숫자로 바뀌어서 카운팅 된다고 합니당 필름 몇개 남아있는지도 알려주니 완전 똑똑하네용 오른쪽 버튼을 누르면 렌즈가 띠용 하고 나오고 앞쪽에 보이는 작은 거울로 셀피모드 촬영 한다고 함 ㅇㅇ 렌즈 열린모습 ! 왼쪽 버튼은 셔터 버튼이니까 켜진 상태에서 누르면 필름 날아간닷 ,,!!! 인스탁스미니 11 폴라로이드 처음 사용해보지만 조작법 넘나 간단 신기한게 앞쪽에 보이는 작은 거울로 얼굴 비춰서 셀카모드도 가능하다는게 넘신기함 ㅎㅎ 원래 이런건가용 아님 미니11 모델이 이런건지 폴라로이드 입문한 전 그저 신기할뿐 놀러가서 사진 많이 찍어줄게 인스탁스 미니11 ~~!! 아직 사진을 못찍어봐서 사진은 없네여 ㅎㅎ 주말에 찍고 블로그에 다시 쓰겠습니당 ~ 구매 링크는 하단에 있어요 !! 인스탁스 미니 11 즉석카메라 폴라로이드 라일락퍼플 구성품도 많고 대만족 - #폴라로이드 #인스탁스미니11 #인스탁스 #라일락퍼플 #인스탁스라일락퍼플 #인스탁스폴라로이드 #인스탁스미니 #폴라로이드후기 #쿠팡폴라로이드  이 포스팅은 쿠팡 파트너스 활동의 일환으로, 이에 따른 일정액의 수수료를 제공받습니다",1221,12,[],0,https://postfiles.pstatic.net/MjAyMTA5MjNfMjM0/MDAxNjMyMzc4OTI5NTUw.tRcRGz8iZiIc7jib8JXGd-JTi2PYYQzIlZJiN_Mj4p8g.2fEDwWxwkaZHX9JeE401k65XhoOwfi_31KJ0W2COWHYg.JPEG.alswl970921/IMG_4378.jpg?type=w773,https://postfiles.pstatic.net/MjAyMTA5MjNfMTg4/MDAxNjMyMzc4OTMyMzU2.F-NQppibpj-nYjOO9Zmohm96Hk3zKud83PnCOxsHBOog.iDBZ3kE-SSMVtFg6C1p9c8zhjCHb_-4_3Yl2z-pMSj4g.JPEG.alswl970921/IMG_4390.jpg?type=w773,14,0,0,1,1,0,0,0,0,0,0,0,0,2,2,1,0,1,0,0,0,0,0,0,0,0,0,0,0,0,0,0,0,0,9,9
https://blog.naver.com/PostView.naver?blogId=jyrjyr1219&logNo=222536096397,인스탁스미니11 스카이블루 후기,20211013,미니11 리뷰,인스탁스 ,"#내돈내산 솔직 후기 얼마전 아마존 핫딜로  인스탁스미니11를 겟하게 됐다. 미국에서 오는거라더니 일주일도 안되어 도착! 역시 아마존 ㅎㅎㅎ 배송은 빠를지라도 포장이 엉망이라는 후기가 많아서 걱정했는데, 고장안나고 잘 오긴했다. 택배는 쿠x 로켓배송처럼 그냥 봉투에 담겨져 왔다.  쿠x는 그냥 플라스틱 봉지고 아마존은 종이봉투라는 차이만 있고 둘다 내 소중한 택배를 지켜주기엔  쏘 연약해보임 ; 암튼 잘와서 다행이고 상자안 뽁뽁이 한겹으로  먼곳을 잘 버텨주었음 방금 사진도 찍어놓고 왜 기억을 못했을까 전두엽 새끼야  밥먹었으면 일해라 (나중에 큰 참사가 벌어짐) 건전지랑 스트랩도 준다. 핸드폰 살때마다 액정 뿌시는 나로서는 참 고마운 선물  분명 건전지 왼쪽처럼 넣는거 아는데 튀어나온부분이 같은방향으로 있어서 오른쪽처럼 넣고 싶게 유혹하고있음 유혹에 넘어가지 않도록 조심하세요 동영상에 뚜껑 닫는 딸깍 소리를 못담아서 아무 생각없이 다시 찍어야지하고 열었다가 1초도 안돼서 빛의 속도로 다시 닫았음 절대 필름 넣고 난 후 열지 마세요. 필름 통째로 다 날라갑니다. 인스탁스는 준비를 끝냈지만 나는 필름을 통째로 다 날렸기 때문에 기쁘지 않았다.ㅠ 감상타임☆ 내돈내산 후기 끝냅니다. 요즘 레트로 갬성에 딱 맞는 폴카 인스탁스미니11 만족 99.999% 100% 이 아닌 이유는 짐작하시다시피 필름값 때문 ^^ 추억 한 스푼이 늠 비싸",696,18,[],0,https://search.pstatic.net/common/?src=http%3A%2F%2Fblogfiles.naver.net%2FMjAyMTA3MzFfMTg5%2FMDAxNjI3NjY5NjI0MDgy.h0KL3v3NjbsjXzNFHWS69rKA0eErko6avuTRV4tOY8og.2zliddPsgIRSDujqVS1m18qKUnEid5yTS1TMNCLWapsg.JPEG.wlalwla%2FIMG_6968.JPG&type=sc960_832,https://postfiles.pstatic.net/MjAyMTEwMTNfMTgx/MDAxNjM0MTI1NTQ4MTA4.1VsO2BbQaU1CKp0OqfKIz5loeYjvSdSUdlcbcNuwbIIg.fQUt6pM4erFstZSpMdA3cGeMW_TkeUHcYmd1TTsbrUkg.JPEG.jyrjyr1219/20211013%EF%BC%BF202032.jpg?type=w80_blur,26,1,0,0,0,0,0,0,0,0,0,0,0,1,0,0,0,0,0,0,0,1,0,0,0,0,0,0,0,0,0,0,0,0,0,0
https://blog.naver.com/PostView.naver?blogId=lhjee99&logNo=222012501532,폴라로이드 카메라 &quot;인스탁스 미니 11 라일락 퍼플&quot; 구매 후기,20200626,미니11 리뷰,인스탁스 ,"안뇽하세요~ 현자입니당! 제가 처음으로!! 하울 글을 써보려고 해요ㅎㅎ 이번에 친구들끼리 여행 가는 것을 맞이하여 폴라로이드 카메라를 구매했습니다😀 구매 이유는 기계는 1도 모르는 사람이라 폴라로이드 치면 가장 먼저 뜨는 것, 그리고 예쁜 것을 중심으로 골랐어요. 구매처 정보는 맨 아래에 기재해 놓을게요!  카메라, 카메라 케이스, 스트랩, 사진집게, 앨범, 피크닉매트, 건전지를 총 111,000원에 구매했어요. 필름은 총 20장을 주문했고 16,500원 이었어요.  사악한 필름 가격에 눈물만 줄줄,,한 장당 800원짜리,, 아무튼! 제가 산 건 카메라이고 다른 제품들은 사은품이었어요.  카메라 정가는 100,300원이랍니다. 케이스의 공홈 가격은 19900원이고 똑같은 정품이니, 타 사이트에서 사는 게 훨씬 이득이겠죠? 너무 예쁘지 않나요ㅠㅠ 정말 실물 보고 소리 질렀습니다. 사진 잘 안 나와도 들고 다니는 것만으로도 만족할 비주얼이에요,,(물론 그러면 안되지만요ㅎㅎ) 크기는 제 손바닥만해요! 딱 편하게 들고 다니기 좋은 크기예요.  왼쪽 사진의 구멍은 필름이 나오는 곳이 오른쪽 사진에 열 수 있게 되어 있는 것 보이시죠? 저기가 필름 넣는 곳이에요. 오자마자 너무 좋아서 호다닫ㄱ 넣어버려서 안 사진이 없네요,, 담 교체 때 찍어오도록 하겠습니다! 설명서에 첨부할테니 참고해주세요. 저 부분을 열면 좌측에 노란색 스티커가 붙어있어요. 필름에도 노란색 스티커가 붙어있는데 둘이 맞닿게 넣으면 된답니다. ‼️여기서 주의할 점!! 절대절대 필름을 넣으시고 촬영한 후에 다시 빼시면 안돼요. 빛이 들어가서 사진이 아예 안 나오게 된답니다. 사용하기 전에 건전지를 넣어야하는데 따로 도구가 필요없고 살짝 밀어서 빼주면 돼요. 카메라랑 함께 온 AA건전지 두 개를 꽂아주세요.  전원 키는 법은 간단해요. 카메라 밑에 튀어나온 버튼 보이시죠? 그걸 누르면 붉은 불이 들어오고 납작했던 카메라가 두 번째 사진처럼 올라와요.  이 상태에서 카메라 상단 버튼을 누르면 플래시가 터지면서 사진이 찍혀요. 그런데 셀카모드로 찍고 싶다! 하면 렌즈를 잡아당겨서 셀피 모드로 바꿀 수 있어요. 모자이크 처리한 저 곳이 거울이어서 손쉽게 셀피를 찍을 수가 있어요.ㅎㅎ  끌 때는 렌즈가 들어갈수 있도록 눌러주면 된답니다.  케이스 색상은 하양, 핑크, 하늘 등등 카메라 색상에 맞춰 모두 있어요.  화이트로 조합을 할까 하다 결국 무난하게 똑같은 보라색으루! 절대 허접하지 않고 카메라를 잘 감싸줘요. 그리고 목에 걸수 있게 끈도 있어서 들고 다니기  유용할 것 같아요.  카메라를 꽂은 모습이에요. 정말 예쁘죠? 찍기 편하게 뒤에 부분을 분리할 수가 있게 되어있어요.  카메라 버튼에 붙어있는 하얀 건 커스터마이징하라고 온 야광 스티커인데 자꾸 떨어져서 그냥 떼버렸어요,,ㅎㅎ 카메라와 필림은 정말 에쁜 상자에 담겨져 와요. 포장도 예뿐 감성,,, 왼쪽 사진은 사진을 처음 촬영했을 때 나오는 필름이에요. 테스트 필름으로 당황하지 않으셔도 된답니다.  가운데 사진은 2단 앨범이에요. 사진 보관하기 딱 좋죠? 마지막은 피크닉매트인데 두명이 앉으면 꽉 찰 정도의 크기로 크진 않지만 간편하게 돌아다니면서 들고 다니기 좋을 것 같아요.ㅎㅎ 마지막으로 처음 찍은 필름과 카메라 렌즈를 통해 본 세상이에요. 어릴 적 앨범에 꽂힌 사진 느낌이 나서 아날로그 감성 제대로 느낄 수 있을 것 같네요.ㅎㅎ  아직 제대로 사용해본 적 없지만 아주 만족한 인스탁스 미니 11 후기!  구매처 남기며 마무리 할게요. 다음 글에서는 필름을 10장 더 받을 수 있는 정품등록 방법을 알려드리도록 하겠습니다! 모두들 행복하세용~❤️",1792,13,['인스탁스 미니 11 라일락 퍼플'],1,https://postfiles.pstatic.net/MjAyMDA2MjZfMzUg/MDAxNTkzMDk4MDc2MTQ1.Gyq9MOrO2WdI-OH4WFJV92cbANdQkHXno7csJeG1tqQg.eNkQjwOhgX_Z6kXfR8VwmBJFyiLdA7Ff621dov1VkhAg.JPEG.lhjee99/IMG_1767.JPG?type=w966,https://postfiles.pstatic.net/MjAyMDA2MjZfMTk3/MDAxNTkzMTAxMTczMzYy.ChHvwM_VD2p_hfFQZamiBZMoJOW7UNyIPQIHRsvFHyMg.H6Bb5KTU6-6athLnBFRlBSiq3yxB0HA9j4_76rHMpYYg.JPEG.lhjee99/output_3892671477.jpg?type=w966,23,0,0,0,0,0,0,0,0,0,0,0,0,1,1,0,0,0,0,0,0,0,0,0,0,0,0,0,0,0,0,0,0,0,9,9
https://blog.naver.com/PostView.naver?blogId=sjrjr212&logNo=222633801486,인스탁스 미니 11 퍼플 솔직후기! / 예쁜 장난감...,20220128,미니11 리뷰,인스탁스 ,"안농하세요 장화네 입니다! 오늘은 생일선물로 받은 가방과 카메라 중 카메라 리뷰! 인스탁스 미니 11 퍼플 입니다! 필름은 20장은 따로 구매 했어요. 카메라와 배터리 2개, 제품 설명서가 기본으로 들어 있어요. 귀여운 보라색😍 한손에 들어 오는 아담한 크기! 구성에 포함 되어 있는 보라색 스트랩을 끼워 줬어여 셔터 버튼 악세사리는 보라색, 하얀색으로 두가지가 있어용 저는 보라색을 붙여 줬어여 악세사리 이쁘고 귀엽긴한데 ㅈㄴ 노쓸모 저거 붙이기 전에 같이 들어 있던 양면 테이프 먼저 붙였는데 효과 하나두 없어서 계속 떨어지고, 양면 테이프 제거 하려니 지저분하게 제거됨 ㅠㅠ 붙이는거 비추 입니당 요기에 필름을 넣으면 됩니당 10장씩 들어 있어요 손으로 푸욱 누르면 안돼요 노란 부분에 맞춰서 끼워 줬어여 배터리 두개도 넣어 줍니다아 첫장은 안 찍힘! 그리고 두번째 장부터 진짜 찐 사진!! 열어분 그거 아세요? 사진 흔들면 안된대여~~ 제주도 가서 맘껏 찍었당 그런데, 벌써 고장 난건지 원래 전원 버튼을 누르면 이렇게 탁! 하고 셔터가 열리는데 쓰다 보니 요 부분이 고장 났는지? 가끔 한번에 안 튀어 나와서 모르고 찍었다가 무려 한장을 버렸다 ....😔 안 나올때는 매번 손으로 잡아서 빼야 했당.. 그리고 진짜 손으로 잡아 빼야 하는 요 셀카 부분 아시나여? 힘줘서 빼면 나옴 셀피모드라는데 쓸모는 없었다.? -마무리- 장점) -귀여움 -작아서 들고 다니기 괜찮음 -여행 갬성 가득 단점) -고장난 듯한 수동 작동이 있음 -이쁜 카메라에 비해 화질은 너무나 안 예뻤다 특히 바다나 풍경 사진에서 하늘이 너무 하얀색이면 뭐가 바다인지 뭐가 하늘인지 구분이 잘 안됨 색이 바란 옛날 사진 처럼 나옴 총평) 재미 + 갬성으로 15만원이면 흠 으른용 장난감 정도 생각 하면 될거 같당 생일 선물 받기 전, 인스탁스와 코닥을 비교 해봤는데 코닥은 인스탁스에 비해 화질이 좋고 사진이 바로 안나와서 필름 아낄 수 있는데 사진 바로 안나오고 선택 후 프린트 형식으로 딱 깔끔하게 나오는게 갬성이 조금 부족하다 생각했다. 인스탁스로 부탁 했는데 조큼 후회된다 ㅎㅎ 찍으면 바로 나오는 갬성용 장난감으로는 완벽함. 예쁜 사진 기대는 절대 하지 마세요! 그럼 이만!",1097,18,[],0,https://postfiles.pstatic.net/MjAyMjAxMjZfMTY3/MDAxNjQzMjA0NTgzNzgx.VBc_UfY4Bq4saMnTZZqa6d_eaPXTyoTDAzG6i_Vo3MQg.d8BpAHWd48CEAxpRUA38BjLRWGegc2OkdENR8eg16Mgg.JPEG.sjrjr212/1643204438025.jpg?type=w966,https://postfiles.pstatic.net/MjAyMjAxMjhfOCAg/MDAxNjQzMzU1MTM2NTY4.Pgcqo1Lgzpq2aIED0XFJRlZdjgOkXwOPlQSPJXrdZsog.LOxIt6Qu5h2Y3mYcfABLdV_OCm8mv2BxFeb4WjiLLX4g.GIF.sjrjr212/se%EF%BC%BFone%EF%BC%BFani%EF%BC%BF20220128%EF%BC%BF163211%EF%BC%BFa.gif?type=w966,23,0,1,0,0,0,0,1,1,0,0,0,0,1,1,0,0,1,1,0,0,0,0,0,0,0,0,0,0,0,0,0,0,0,0,0
https://blog.naver.com/PostView.naver?blogId=hippo1147&logNo=222313226678,폴라로이드 인스탁스 미니11 제품소개 및 후기,20210417,미니11 리뷰,인스탁스 ,"혦, 쩡인에게 생일 선물로 받은 인스탁스 미니11!! 예전부터 폴라로이드를 갖고 싶었기 때문에  딱 받았을 때 세상 행복했더라지,,,ㅎㅎ 기념으로 후기 작성을...해보겠슴다,, 회사는 후지필름이고, 박스 디자인은 깔끔하네! 박스 뒷면에는 뭐가 써져있긴 한데 아무도 안읽쥬? #인스탁스가방케이스 뚜껑이 탈부착형이라서 렌즈를 보호하고 싶으면 뚜껑을 씌워도 되고, 불편하면 뚜껑만 빼고 다녀도 된다! 끈 길이 조절도 자유롭다 목에 걸어도 되고 어깨에 걸쳐도 좋고~ 케이스 색상은 이 외에도 4종이 더 있다 #인스탁스미니11 사이즈는 손만하고, 무게는 아이폰11의 1.5배 정도? 깔끔한 화이트 톤으로 잘 골라준 내 찡구들 심플한 디자인이 봐도봐도 질리지 않고 예쁜듯! 화이트 색상 이외에도 4종의 색상이 더 있단 점! 전원 버튼을 누르면 렌즈가 폭하고 튀어나온다 박스 구성품 오른쪽의 물건은 설명서를 참고하세요 셔터 보호 뚜껑같은 물건 필름 빼고 끼우는 방법이 적혀 있으니 잘 참고하시길~ #폴라로이드필름교체방법 남은 필름 갯수도 표시해주는 영특한 친구 전원이 켜진 상태에서  손으로 한 번 더 렌즈를 잡아당기면 selfie on이라는 글자가 나타나면서  셀카모드로 전환된다 그리고 시선은 렌즈옆에 붙어있는 미러를 바라보면 된다 #인스탁스셀카모드 ※플래시가 터지니 셀카 모드시 눈뽕주의※ 후지필름의 인스탁스 미니 필름이다 사진 화질은 이정도이다 디지털 카메라처럼 선명하진 않지만  이게 바로 아날로그 감성 아니겠습니까???? 사진이 출력되고 나서 선명해지기까지  5분도 안걸린다는 점!! / 그리고 많은 사람들이 사진을 빨리 마르게 하려고 막 흔들기도 하는데 잉크가 번져서 사진이 망가질 수도 있기 때문에 흔들면 절!대! 안된다는 점~ / 기념일, 여행, 특별한 날에 쓰기 딱 좋은 인스탁스 폴라로이드 여러분의 소중한 추억을 필름에 담아보는 건 어떠세요",922,13,[],0,https://postfiles.pstatic.net/MjAyMTA0MTdfMjAy/MDAxNjE4NjMwOTczODIw.tWzFl2GBGf-SF2x-AqVANi6bgnqC37ZVRWHxqgY4dwQg.CGiWa7FpBFbhjWu3ryLlUHwdtPnNXQP-Oc5LBgjtdbEg.JPEG.hippo1147/IMG_5565.jpg?type=w580,https://postfiles.pstatic.net/MjAyMTA0MTdfMTg1/MDAxNjE4NjMxMTIzMjc0._-0NLXFdm5iQ5zflOKBfpdECLOVXYrV0sEDFl6fvgEMg.dCVSnZnjA7Bnf_x9KWLLXjEai6aAMWBl_jdNJQicCi0g.JPEG.hippo1147/IMG_0815.jpg?type=w580,19,0,0,0,0,0,0,1,0,0,0,0,0,0,0,0,0,0,0,0,0,0,0,0,0,0,0,0,0,0,0,0,0,0,9,9
https://blog.naver.com/PostView.naver?blogId=hhhhhhs2&logNo=222475594362,/ [FUJIFILM 인스탁스 미니 11] _ REVIEW &amp; 솔직후기,20210819,미니11 리뷰,인스탁스 ,"평소에 사진 찍는 걸 좋아하는데 필름 카메라를 사기에는 아직 부담스럽고, 전부터 너-무 갖고 싶었던 폴라로이드 카메라 ! 짝꿍이랑 이야기 하다가 몇 번 갖고 싶다고 이야기 하며,  이게 과연 합리적인 소비일까 ,, 고민하다가  구매를 망설이고 있었던 찰나에 짝꿍이 갑자기 1,000일 선물이라며 주셨다 ! !  Instax mini 11 : BLUSH PINK 태생부터 핑크 덕후인 핑덕을 위해 짝꿍은 핑크로 주문했다고 했다 ! ! 역시 오에 잘알.... 오잘알💘 짝꿍은 쿠팡에서 주문했다고 했고 ! 포토 앨범, 액자, 카메라 파우치, 필름 10장 이렇게 구성되어 있는 제품으로 사줬다 +_+ 핑크색 카메라에 핑크색 파우치에 핑크 덕후는 여기 누우면 되나요? 인스탁스 미니 11 블러쉬핑크 색 진짜 잘 뽑았다 ,, 베이비 핑크 색이 넘모 이뻐 ㅠㅅㅠ #인스탁스미니11 은 셀피모드도 가능한데 뭐 거창한 건 아니고 하단의 사진을 보면 렌즈 왼쪽편에 거울? 이 있어서 거울을 보면서 셀피 모드로 찍을 수 있다 ! #인스탁스미니11셀피모드 를 사용해봤는데 거울을 보며 찍으면 되니까 편하긴 한데 인물이 접사가 되서 거리를 잘 조절해서 찍어야 할 것 같다! 그리고 좌우반전 되서 나옴 ... ;ㅁ; 동그란 저 버튼이 셔터버튼이고, 생각보다 꾸-욱 눌러줘야 찍힌다! 아차차 !  인스탁스 미니11은 AA 건전지가 들어가니까 혹시나 구성품에 건전지가 없다면 미리 구매해놓기를 추천한다. instax 라고 적혀있는 곳 뚜껑을 열면 필름을 넣을 수 있는 공간이 나온다. 여기서 꿀팁은 필름을 넣고 첫 장은 빈 필름이 나오니까 필름을 갈아 끼우고, 셔터를 한번 눌러서 빈 필름을 한 장 빼주기 ! 빈 필름을 빼고 나면 하단의 컷 수가 보이는 곳에 컷 수가 세팅되어 있는게 보인다. 짝꿍한테 선물 받자마자 뭔가 찍고 싶기는 하고 🙄 연습용으로 한 장 찍어봤는데  폴라로이드 특유의 사진 느낌이 너무 좋다 !  최근에 소중한 기록을 남겨서 선물 할 일이 있어서 유용하게 사용했는데 너-무 만족스러웠다 ! 다만 필름 가격이 .. 착하지 못하지만 :( ..... 소중하게 기록하고 싶은 순간들이 생길 때 유용하게 사용할 것 같다. 이 자리를 빌어서 짝꿍에게 한번 더 감사의 말씀을..❣️ #인스탁스미니11 #후지필름폴라로이드 #폴라로이드추천 #폴라로이드카메라추천 #폴라로이드카메라 #후지필름 #후지필름인스탁스미니11 #instaxmini11 #폴라로이드입문 #서이추환영 #서이추",1206,13,[],0,https://postfiles.pstatic.net/MjAyMTA4MTlfMjE4/MDAxNjI5MzAyOTgxNjc5.jjosV9k-zWv-3heBZoy7pnIxkXMKVFgCT_jIdSqPltwg.8IhLIJ5DsZE2ijz9IeW9QM4sWbgzbzj8dxF8tzIHjOQg.JPEG.hhhhhhs2/IMG_0755.JPG?type=w966,https://postfiles.pstatic.net/MjAyMTA4MTlfNDEg/MDAxNjI5MzAyOTg4MjMw.ZmmkBrXCOMrvJ-L-gj2EVRNC15hDbTZC8j1mLPpCWxQg.ynI4EQ_FmpKy5N_mSms2GpRTchms9zJqdJ2o5nC6kNog.JPEG.hhhhhhs2/IMG_0787.JPG?type=w966,15,0,0,0,0,0,0,3,2,0,0,0,0,1,0,0,0,0,0,0,0,0,0,0,0,0,0,0,0,0,0,0,0,0,9,9
https://blog.naver.com/PostView.naver?blogId=angel-o_f1ove&logNo=222472206005,[INSTAX] 후지필름 인스탁스 미니 11 구매후기,20210816,미니11 리뷰,인스탁스 ,"배보다 배꼽이 더 큰 친구.. 군산여행을 위해 준비했던 친구...♩｡*✡ 카메라와 다른 구성품들이 함께  (카메라가방,필름10장,파우치,앨범) 구성품들과 카메라 세트로 판매하는곳이 많았지만, 구성품들도 구성품들 나름.. 필요하지않은 쓸데없는 것들이 같이 와버리면 머리가 아파버리죵ㅠ 일단 나에게 제일 필요한것은 카메라 외에  필름+카메라가방이였당. 그래서 쿠팡에서 구매하기로 결정 땅땅땅 💨 카메라! 아이스 화이트로 선택했당. 그렇다고해서 쌩 화이트가 아니라 약간 회색빛 돈다. 그래서 더 예뻐보이는 ....... ✩⡱ 카메라 전용 가방! 사진과 다르게 노란끼가 안돈다. 이건 쌩 화이트 색?.. 깔끔하니 예쁘다(*´︶`*)ฅ♡ 카메라 색 맞춰서 사길 잘했다. (사실 카메라가방색은 랜덤인데,  대부분 카메라와 동일한 색상을 보내준다고 한다.) 필름 10장!   살려죠오 앨범안에 갖혀버렸어요ㅋㅋ. 간단한 사진들 끼워놓기 좋을 1단앨범 ~ 파우치...는 어따 써먹어야 할지 모르겠당! 흰색이 더 예쁘던데, 삐약삐약 병아리색이 왔네! ❛ ֊ ❛ 카메라와 구성품들 총 집합! 건전지(AA사이즈) 2개와 카메라에 달 수 있는 끈. 나름 알찬 구성이다. 초짜라 필름 몇장 버리기도했지만 ㅠ ㅠ .......... 구매하기까지 엄청난 고민을 했던게 무색할정도로 맘에드는  내 첫 폴라로이드 카메라 인스탁스 미니 11 . 플래시가 자동으로 터지는것도 좋고 그 플래시만의 감성도 좋고..... 여행가고싶다!!!!!!!!!!!! 코로나  껒 여!!!!!!!  폴라로이드로 찍은 몇개의 사진들. 햐......ol 감성 너무 조Er ... ⁽⁽٩(๑˃̶͈̀ ᗨ ˂̶͈́)۶⁾⁾ 그럼...안뇽. ..... 다은이가 구매한 인스탁스 미니11 정보 구매처 : 쿠팡 색상 : 아이스화이트 금액 :119,740원 구성품 : 카메라,카메라가방,필름10장,파우치,1단앨범,건전지",922,13,[],0,https://postfiles.pstatic.net/MjAyMTA4MTZfMjMy/MDAxNjI5MDkwMjgxODI0.I1EoPiBka0zSOhcHmcEdei54bqitACI2dBoJGEBYi3kg.mAcnDST3Pusjf2VYmwwt_RyCBWn1Xn1ScT0hsRgLbTQg.JPEG.angel-o_f1ove/SE-c5ee3932-3727-4682-a146-0721442413f7.jpg?type=w773,https://postfiles.pstatic.net/MjAyMTA4MTZfNTkg/MDAxNjI5MDkxOTIyNjQ3.uDTXvk2rbyGUOjotx64ymrfcnYmRCeTngtxzObTQ7ssg.05YN3CSSBcr1P1uz1q68Im0H5csDjLZrPMbQsbLMH1Ag.JPEG.angel-o_f1ove/SE-c31677f4-69cd-4fc5-8e50-1426fd1c71db.jpg?type=w773,10,0,0,1,1,0,0,9,5,0,0,0,0,3,0,0,0,0,0,0,0,0,0,0,0,0,0,0,1,0,0,0,0,0,9,9
