url,title,post_date,검색어,브랜드 명,content,content_cnt,content_line,quote,quote_cnt,first_img,last_img,img_cnt,솔직 빈도 수,비교 빈도 수,ㅋ 빈도 수,ㅋㅋ 빈도 수,ㅋㅋㅋ 빈도 수,ㅋㅋㅋㅋ 빈도 수,... 빈도 수,.... 빈도 수,ㅜ 빈도 수,ㅜㅜ 빈도 수,ㅜㅜㅜ 빈도 수,ㅜㅜㅜㅜ 빈도 수,ㅠ 빈도 수,ㅠㅠ 빈도 수,ㅠㅠㅠ 빈도 수,ㅠㅠㅠㅠ 빈도 수,장점 빈도 수,단점 빈도 수,비속어 빈도 수,허락 키워드,내돈내산 키워드,리얼후기 키워드,협찬 키워드,체험단 키워드,coupa.ng 키워드,< 키워드,> 키워드,♡ 키워드,♥ 키워드,구매후기 키워드,한달 키워드,두달 키워드,세달 키워드,광고 분류1,광고 분류2
https://blog.naver.com/PostView.naver?blogId=taiji1370&logNo=221948824878,클럭 미니 마사지기 S SP-308W 사용후기,20200506,마사지기s 리뷰,클럭,긴가민가했던 클럭 미니 마사지기 S SP-308W 아이들 키우고 살림하느라 여기저기 안아픈 곳이 없었는데  마땅한 마사지기가 없어서 고민하고 있던 찰나  핫하다는 요놈을 get 하게 되었어요.  후기를 여러군데 찾아봤는데 호불호가 분명한 제품인거 같았어요.  일단은 저주파 클럭 미니 마사지기라서  전기 통하는게 싫거나 병원에서 하는 물리치료를  별로 좋아하지 않으시는 분들은  구입하는걸 고민해보시길 바래요.  하지만 제가 이용해본 결과 그정도로 찌릿하거나 거부감 들 정도는 아니더라고요.  저는 뜨거운거 찌릿찌릿한 느낌을 극도로 싫어하는 사람으로써 그냥 두드림정도의 마사지기를 원했는데  원하는 부위 구석구석 사용할만한 기계가 마땅치 않았거든요.  제가 못 쓰게 되면 신랑이라도 사용하라고 구입을 했는데  직접 사용해보니 전~~혀 거부감드는 느낌을 받진 않았어요.  저는 클럭 미니 마사지기를 대부분 팔 뒷부분이랑 승모근  그리고 종아리 부분으로 이용하고 있는데  두드림 주무름 침 효과등으로  모드를 지정해서 이용하니 정말 시원하더라고요.  제 기준으로는 클럭 미니 마사지기 3단정도는 아무 무리 없이 이용할 수 있었고  작은 사이즈에 비해서 강도도 적당하고 마사지 시간이 25분으로  충분하여 한번 시작을 누르고 드라마 보면 그렇게 편할수 없더라고요.  특히나 허리나 등은 대형 패치를 이용해서 5단까지 이용했는데  진짜 극찬을 했어요.  저주파라서 근육을 직접 자극하기 때문에  일반적으로 강도가 높은 마사지기나 무게가 좀 있는 마사지기보다는  훨씬 좋은 효과를 봤어요.  사이즈가 작다 보니까 한번 충전해서 외출시에도 가능하고  여행을 가서도 간편하게 이용할수 있어서 너무 좋았어요.  패치를 24회 이상 사용하면 새것으로 교체해 주어야 한다는데  물론 소모품이긴 해도 10회 이상 사용하였으나  붙착성능은 아직까지 문제 없더라고요.  저는 클럭 미니 마사지기 1+1 행사 상품으로 구입했는데  저희 신랑이랑 하나씩 나눠서 사용하니 좋았어요.  금액으로도 부담이 전혀 안되는 부분이고  일단 클럭 미니 마사지기 패키지로도 충분히  원하는만큼 이용하는데는 무리가 없을듯 하네요.  쇼셜미디어 찾다 보니 여기가 가장 싸길래  링크 남겨요.  이 글은 소정의 수수료가 발생할 수 있습니다. ,1117,6,[],0,https://postfiles.pstatic.net/MjAyMDA1MDZfMjg4/MDAxNTg4NzUzNTIyNzI0.Q79QU3rDLlqPf2aHaXVHFwlRR6qJWC-crMACEJPsJHQg.XYyOxHD8Iu4kGwobBbCjzIN4ZjksHXh3KgwIZqqcXUcg.PNG.taiji1370/마사지.png?type=w773,https://postfiles.pstatic.net/MjAyMDA1MDZfMzQg/MDAxNTg4NzU0NDM1MjYx.1sUlaZhOBYDdI1rz-UQGtn_lu-sRyMle_EiOV50ZEzUg.c1tyVQKpkJ4zBkZnCJHifm1JQyQTbPPiVlmpa-2f0_0g.PNG.taiji1370/미니.png?type=w773,5,0,0,0,0,0,0,0,0,0,0,0,0,0,0,0,0,0,0,0,0,0,0,0,0,0,0,0,0,0,0,0,0,0,9,9
https://blog.naver.com/PostView.naver?blogId=miss_kyou&logNo=222011272038,클럭 미니 마사지기 S _내돈내산 후기,20200624,마사지기s 리뷰,클럭,부모님이 원래도 마사지기를 사용하고 계셨는데.. 때마침 망가졌다는 소리를 듣고 ㅋㅋㅋ 그리고 타이밍 좋게 티비에서는 클럭 광고가 흘러나오고 있었고... 저게 좋아 보인다며 눈을 반짝이던 아빠의 눈을 외면할 수가 없었기에 ㅋㅋㅋ 어떨지 몰라 일단 마사지기 S 세트를 주문했습니다 ㅎ0ㅎ 선물 포장까지! 완벽하게 선물 느낌이 나는군요 후후 구성품은 본체 + 리모컨 + 작은 패드 + 큰 패드 +USB 어댑터 + USB 케이블 근데 그냥 핸드폰 충전기만 있다면.. 어댑터랑 케이블은 큰 상관없겠더라고요 충전기 망가질까 조마조마하지 않아도 돼서 맘에 들어요 ㅋㅋ 이왕 사는 김에 패드를 넉넉히 구매해놓자! 하고 작은 패드 3개를 추가 주문했는데.. 괜히 작은 패드로 주문한 듯.. ㅠ.ㅠ 큰 패드 살 걸 ㅠ.ㅠ 오른쪽 사진처럼 저렇게 넓은 부분에 부착할 때는 아무런 상관이 없는데.. 목 부분이나.. U자로 휘어지는 부분에 부착하면 이상하게 자꾸 패드가 떨어지더라고요 ㅠ.ㅠ 물론 큰 패드를 사용해도 마찬가지 8_8 패드 너무 잘 떨어져.. 겔만 있는 게 아니라 빳빳한 비닐? 부분도 같이 있기 때문에 자꾸 떨어지고.. 좀 있으면 다시 붙이고 다시 붙이고.. 조금 불편하긴 하지만 그래도 괜찮다며 잘 사용하고 계십니다 ㅋㅋ 전에 사용했던 게 의료기기여서.. 클럭은 의료기기가 아니라서 그런지 이전에 쓰던 것이 조금 더 나은 것 같다고는 하시지만.. 일단 클럭은 저렴하잖아요 ... ㅎ 전에 쓰던 의료기기 저주파기 마사지기는 클럭 가격의 몇 배였기에.. 저렴한 맛에 쓰기에는 좋다고 생각합니다 ㅋㅋㅋ 잘 떨어지네 뭐네 하면서 가끔 투덜대셔도 저녁에 티비보려구 소파에 앉으시면 클럭 먼저 집어 드세요 ㅋㅋㅋ 쓸만하시다는 부모님의 말씀 ㅎ0ㅎ,856,3,[],0,https://postfiles.pstatic.net/MjAyMDA2MjFfMjg4/MDAxNTkyNzQ5ODk0MzM4.sad1hGbs52d53LrrQueEm8Wrl17jxNjBF-BQpOzYX1og.VWqf9PkB1NME4ZWWMPW7xDYsNs07-NQ3-o3YBO28QRQg.JPEG.miss_kyou/SE-4d8839c9-8d3e-4129-a67d-decf8cfd2ff4.jpg?type=w580,https://postfiles.pstatic.net/MjAyMDA2MjFfMTUz/MDAxNTkyNzQ5ODk4NzQ0.-Wsp-fToBRRdLzUxPoGpQOonpcPc_-3Mt0Q1Fc6DQb8g.Z3Mz6RX5sH6E_5gAWuWDDwwTsP33zo1y3qGd9JMhynQg.JPEG.miss_kyou/SE-6842b07a-cf9a-4992-8de4-f7f38124ff98.jpg?type=w580,3,0,0,6,6,4,0,2,0,0,0,0,0,3,0,0,0,0,0,0,0,0,0,0,0,0,0,0,0,0,0,0,0,0,9,9
https://blog.naver.com/PostView.naver?blogId=narae_angela&logNo=222134609101,"클럭 미니마사지기S ㅣ Klug Mini Massager 개봉기, 후기",20201103,마사지기s 리뷰,클럭,"날개입니다 ʚෆɞ 회사에서 근골격계 질환 예방을 위한,, 클럭 미니마사지기를 주더라구요 - 광고를 엄청 많이 봤어서, 궁금했는데 (왠지 내 돈 주고 사기 아까운 느낌) 이번 기회에 써보게 됐어요 !! 클럭 미니마사지기S 현재 공홈에서 49,900원에 판매 중입니다. 아이돌 앨범크기만한 상자 사이즈,, 구성품 본체 리모콘 안내서&설명서 기본패드 1, 작은패드 1 어댑터, 케이블 저주파가 근육을 자극하는 방식이라고 해요. 예전에 유선 기기를 써봤었는데, 무선이라니! 리모콘도 있고,,ㅎㅎ 세상 좋아졌네요 - 교채용패드는 전화주문도 가능하더라구요. 부모님 선물로도 괜찮을 것 같아요! 본체를 먼저 충전해주고, 리모콘에는 건전지가 이미 들어있더라구요 👍  본체가 꺼진 상태에서 m버튼을 5초 누르면, 본체 중앙이 깜빡 거려요. 이 때 리모콘의 m버튼을 누르면, 기기와 리모콘이 페어링됩니다. 이제 패드만 붙이면 끝! 패드와 본체를 착 결합시키면 됩니다. 갖다 대기만 해도 아주 강하게 붙더라구요. 패드는 소모성 제품이에요,,ㅠㅠ 20~25회 사용 후 교체해줘야한다고 합니다. 모드변경은 m버튼으로 가능한데요,   블루 / 두드림(강) 주무름 마사지 화이트 / 침 마사지 두드림(약) 취향과 용도에 맞게 모드를 변경하면 될 듯 해요. ‘AS요청 전에 확인할 사항’ 이라는 유용한 페이지 발견 본체 전원 / 작동 / 충전 / 리모컨 이상 / 패드 접착 등! 사용하다가 불편하신 점은 위 사진을 참고해서 해결해보시고, 해결이 안된다면 070-4469-0005 로 전화하시면 될 듯합니다. ** 무상 보증 기간은 구매일로부터 1년(보증서지참) ** 어깨 결리는 부분에 사용했을 때, 은근 주무르고 두드리는 힘이 있더라구요ㅋㅋ 아프지는 않았지만, 엄청 개운하거나 시원하지도 않았어요. 지속적으로 사용하다보면 효과가 있을수도..! 시간내서 한의원이나 물리치료 받으러 가기도 힘든데, 틈틈이 클럭 써주면 안쓰는 것보단 낫지 않을까,,하는 마음! 본체 2개로 해서 어깨 양쪽/다리 양쪽 이런식으로 쓰시더라구요. 클럭을 한번 체험해보시고 잘 맞으시는 분들은, 본체를 하나 더 구입하셔서 양쪽 사용하시면 좋을 듯 합니다! 전,,아직 장기적으로 쓰지 않아서, 추천이나 그런 건 시기상조인듯 합니다 🧐  그리고 패드가 20-25회마다 교체주기라는 게 조금 맘에 걸리긴 하더라구요,, 장기 사용할지 의문,, 오늘도 읽어주셔서 감사합니다 !",1182,11,[],0,https://postfiles.pstatic.net/MjAyMDExMDNfODAg/MDAxNjA0NDAyODIyMzAx.iOAjHuZOBVDNlfg9hfBgz6qHCZqjQdRhE36z2m4pEZ0g.jM6PrsHgHhI6QfvyvCiCC1whUKrSZ3mSkrbnM2nsB9Ag.JPEG.narae_angela/20201103%EF%BC%BF193857.jpg?type=w773,https://postfiles.pstatic.net/MjAyMDExMDNfMTYy/MDAxNjA0NDA0OTk4MjA5.36accCLBBzS0PW-x5UmETGk7zT2n8DEcaDfVrW6rVEUg.WPZL6EVKM0miAznnAld5JeQcvw4Vz0x8YPXR_6rF0_Mg.JPEG.narae_angela/20201103%EF%BC%BF205406.jpg?type=w773,14,0,0,1,1,0,0,0,0,0,0,0,0,1,1,0,0,0,0,0,0,0,0,0,0,0,0,0,0,0,0,0,0,0,9,9
https://blog.naver.com/PostView.naver?blogId=wltn8257&logNo=221934210663,Klug 마사지기_ 클럭 미니 마사지기 S 솔직 사용 후기,20200428,마사지기s 리뷰,클럭,"여러분 오랜만이에요~ 벌써 5월이 다가오고 있어요ㅠㅠㅠ 이번에는 5월 8일 어버이날을 기념해서 부모님께 무엇을 드릴지  언니랑 고민을 해보다가  클럭 마사기를 선물해 주기로 했어요!! Klug 마사지기에 대해서  설명 및 후기를 말씀해드릴게요~ 제가 산 제품은 'Klug 미니 마사지기 S 1+1'입니다 카카오톡 플러스친구를 맺으면  사은품 쿠폰 3종을 줍니다!! 저는 기본 패드, 큰 패드, 공기청정기 필터  중에서 큰 패트를 선택했답니당 히히 지금 가정의 달 이벤트로  1+1으로 판매하고 있답니다~ 회원가입 할 때 추천인 아이디를 적으면 모두에게 적립금 3,000원을 주는 사실! ( 추천인 아이디가 필요하신 분들은  댓글 남겨주세요! 서로 적립금 받아서 저렴하게 구입해서 사용해요~ 링크 통해서 회원가입 해도 돼요!  맨밑에 추천인 링크도 올려둘게요~ ) 저는 적립금까지 써서  원래는 75,000원 -> 72,000원에 구매했습니다! 클럭 상자를 열었을 때 리모컨, s 본체, 기본 패드, 큰 패드, 충전기 이렇게 구성이 되어 있습니다! 사은품 쿠폰으로 받은 큰 패드에요! 안에는 총 3개의 패드가 들어있고, 하나의 지퍼백이 들어있어요ㅎㅎ 기본 패드와 본체 s를 가까이서 찍어보았어요~ 기본 패드의 크기는 저의 손보다는 작았어요! 이 패드는 목 부위에 하면 딱 좋을 것 같아용 기본 패드와 큰 패드의 비교 사진입니다!! 큰 패드는 제 손에 비교했을 때  손보다 조금 더 큰 정도였어요! 패드의 밑에 부분의 패드 보호비닐?을 떼내면 젤리 같은 것이 나옵니다! 그래서 마사지 받고 싶은 부위에 붙여서 사용하면 돼용ㅎㅎ 사용하시고는 패드에 다시 보호비닐?을 붙여야 합니다!! 패드와 본체에 자석으로 되어 있는 똑딱이가 있어서 구멍에 맞게 연결해 주시면 사용할 수 있어요! 모드는 2가지 버전이 있더라구요 블루 모드, 화이트 모드 이렇게 있고, 모드마다 마시지의 동작이 달라요ㅎㅎ 한 번 마사지를 하면 25분 동안 진행이 돼요!! 또한 세기는 1~ 15단계까지 있습니다 QR코드 밑에 보면 정품 인증 번호 보이시죠? 저 부분을 긁으면 정품 인증 번호가 나오고, 홈페이지 들어가셔서 등록하시면 돼요!! 지구 - 저는 허리가 아파서 큰 패드로 사용했었는데, 병원 가서 물리치료 받을 때의 전기치료 느낌이 났어요ㅎㅎ 한 모드 당 세 가지 동작이 있다 보니 정말 물리치료 받는 느낌이었어요!! 세기는 6단계로 25분 동안 받고 나니 허리 아픔이 조금 덜 해졌었요ㅠㅠ 이제 하루에 한 번씩 사용해볼까 해요!! 단점이 있다면 패드의 젤리가 살짝씩 살에 묻어요ㅜㅜㅜ 엄마 - 기본 패드로 팔에 잠시 해봤는데, 생각했던 주물러주는 마사지기가 아니고 전기 마사지 같은 느낌이었어요! 아빠 - 큰 패드로 허리에 했었는데, 낮은 단계로 사용 할 때는 약하다고 했지만 15단계인 최대로 했더니 괜찮다고 했어요! 아빠가 덩치가 있다 보니 허리에 할 때는  대왕 패드로 해야 할 것 같아요ㅠ 언니 - 예전에 삐었던 발목에 해봤을 때 세기 1단계로 했어도 너무 아파서 바로 그만뒀어요ㅠ 다른 부분에는 해도 괜찮을것 같아요! 저는 5월 8일 어버이날을 맞이해서  미리 클럭 마사지기를 부모님께 선물을 해드렸는데요! 부모님께 유용한 선물을 해드린 것 같아 만족스러워요ㅎㅎ 혹시 어버이날 선물을 못 고르셨다면 클럭 마사지기를 선물해드리는 것도 좋은 것 같아요! ↓↓추천인 링크입니당! http://klug.kr/?reco_id=jee8250",1685,15,"['Klug 미니 마사지기  설명 ', '솔직 사용 후기', '클럭 미니 마사지기 s(리모컨 포함) 1+1150,000원 -> 75,000원']",3,https://postfiles.pstatic.net/MjAyMDA0MjhfNDkg/MDAxNTg4MDUxNzIwMTQw.UWtr5LD9d0s6qWwPgJM3GMLI81HdnQZKCIvpjvTeBYsg.CXMq3WteCTcgRHb2jgdHR7nCGtFdz9SgUmdnO-LYar4g.JPEG.wltn8257/%EB%B8%94%EB%A1%9C%EA%B7%B81.jpg?type=w773,https://postfiles.pstatic.net/MjAyMDA0MjhfMzkg/MDAxNTg4MDUxNzI1NjQ5.M1O1cS8kDY7RmH-DqER_Pu6aa006UN36UeMuHXwmdAUg.mBbuBD5RnkjBjipXfBPI3xdaYHN6aLMcQw5gzXKfXDcg.JPEG.wltn8257/%EB%B8%94%EB%A1%9C%EA%B7%B813.jpg?type=w773,13,0,2,0,0,0,0,0,0,1,1,1,0,4,2,1,0,0,1,0,0,0,0,0,0,0,0,1,0,0,0,0,0,0,0,0
https://blog.naver.com/PostView.naver?blogId=dlekdus0512&logNo=221868136276,[구매후기] 클럭 미니 마사지기S DUO,20200323,마사지기s 리뷰,클럭,"몇일전 언니가 마사지기를 주문했어요 요즘 다들 괜찮다고 여기저기 많이 올라오는  클럭 미니마사지기 #쿠팡클럭미니마사지기 #클럭미니마사지기 #클럭마사지기 #클럭미니마사지기듀오 저희가 구매한 제품은 요 제품입니당!!!! ✔️구성을 한번 볼까용 ✔️마사지기 본체 2개 -> 본체가 있어야 패드에 붙여서 사용가능 2개 제공되니까 두군데 사용가능 ✔️리모컨 -> 혼자 붙이고 사용할때는 강도 조절, 모드조절 ,ON OFF  위해서는 리모컨 사용이 유용 ✔️전용 어탭터와 USB케이블 -> 마사지기 본체 충전할때 사용, 핸드폰 충전 선이랑 같아요 ✔️기본패드 1개, 큰패드 1개 -> 패드 크기는 총 3가지인거 같아요 그중에서 제일 큰 사이즈 빼고  2가지 사이즈로 각 하나씩 ✔️파우치2개 -> 사용한 패드를 보관하는 파우치 이렇게 기본구성으로 되어있어요!! 충전어댑터는 빼고 찍어버렸어용 ㅎㅎㅎㅎㅎ 사용해보니까 시원하고 좋았어요!! 또 무선이다 보니까 부착하고 돌아다니기도 수월하구 모드도 두가지라 블루모드, 화이트모드  좋더라구요~ 25분이 지나면 자동으로 OFF 시간가는줄 몰랐어용 ㅠㅠㅠ 너무괜찮아서 패드 추가 구매해버렸지 모에용 ㅋㅋㅋㅋㅋㅋㅋㅋㅋ 세가지 사이즈 다 구매해버렸어요!! 지금 카톡플친 맺으면 사은품 주는데 3만원 이상 구매시 증정하니까! 구매하실분들은 구매전  플친 맺고 쿠폰받아서  사은품도 받으세용~~~ #미니마사지기 #저주파마사지기 #클럭저주파마사지기",710,7,[],0,https://postfiles.pstatic.net/MjAyMDAzMjNfMTIg/MDAxNTg0OTI2NTc3MjI3.f2_dN4aOxrPqwVY4MPkPeHBjkqCnjVPgyNCvPmG_bHog.jk9GW0yMzFx9LrfY0WGzsfpFNYt9ddfp4yUM_dzXdMQg.JPEG.dlekdus0512/IMG_3160.jpg?type=w773,https://postfiles.pstatic.net/MjAyMDAzMjNfMTg0/MDAxNTg0OTI3MDU2MjQw.mpZPIC2i5kki338IBEWDqU23XMpzoA6ZMxdFdQOc4JIg.NMDSWigwS72-pPYRKEXRa78jgJCHjmdeujKa98mpZQ0g.JPEG.dlekdus0512/IMG_3137.jpg?type=w773,6,0,0,1,1,1,1,0,0,0,0,0,0,1,1,1,0,0,0,0,0,0,0,0,0,0,0,1,0,0,0,0,0,0,9,9
https://blog.naver.com/PostView.naver?blogId=helly13&logNo=221963525447,클럭[Klug] 미니 마사지기S... 박민영안마기 #솔직후기 :),20200515,마사지기s 리뷰,클럭,"#박민영안마기 #클럭마사지기 #홈마사지 #솔직후기 빠니파파가 잇템, 핫템을 받아왔다아 간지나는 케이스 이게 머야머야머야 탭인가?? 아이패든가 음하하하하하 아 이 사람 그림쟁이 마누라를 위해 신제품 사온 것인가? 음하하하하 사이즈가 꼭 그런데 첨보는 브랜드일세 클럭 몰라? 클럭 박민영이 광고하는데 마사지기 요즘 되게 많이 쓰는데?? 회사에서 하나 선물받아 왔어 맨날 늦게 와서 화가난다 이노무 회사 BUT, 이럴 땐 참 멋져브러 좋은 회사! 디지털노마드 블로거 맘이라면 언박싱 포스팅은 기본인데 읭? 이거이거 언제 뜯었어? 아 빠니파파 요새 굉장히 빨라 어느새 뜯어서 이미 사용 중 안돼안돼 다시 포장해야 해!!! 그래서 리언박싱 되겄습니다 어설픈 포장은 우리 때문이라는거 넘나 깔끔한 패키지 속에 저 쪼매난 것을 이렇게 그럴싸하게 포장해뒀네요 비주얼 굿이라 선물용으로 많이 사는 #클럭 #Klug 커브가 둥글둥글해 라운드 처리가 된 본체 넘나 귀욤귀욤한 디자인이 다마고치가 생각나는건 나뿐인가? 사이즈가 작디 작아 리모컨 보다도 작고 충전기어댑터 보다도 작다아 패드는 기본패드 1개, 큰패드 1개로​ 구성되어 있으며 색상은 쏘쏘한디 모양이 리본을 연상케하는 디자인이다 앞면에 은색 자석단추 부분은 본체와 접촉하는 포인트이다아 이제 사용해 볼까요? 본체를 접촉시키고 필름제거 후 원하는 부위에 똭 붙이면 끝 매일 서로 어깨 좀, 뒷목 좀, 허리 좀​ 마사지가 필요하다며 서로를 귀찮게 했는데 클럭만 붙여주면 되니 세상 참 조용해졌으 혼자 하기 편하려고 #클럭 하는 거라면 리모컨은 필수! 만 원 밖에 차이가 안나고 리모컨 없으면 상대방이 귀찮아집니더 충전도 넘나 간단하쥬? USB 케이블선 사용하면 되니 휴대폰 충전기나 다른 전자제품들과 호환해서 사용하면 되는 #클럭 아래 이미지 CLiCk¡ 클릭! 애니웨이, Anyway!​ 클럭 마사지기 요 제품 만족도는? 빠니파파 쏘.쏘 빠니맘 강추강추추 원래 마사지 받는 스타일을 생각해보면 빠니맘은 살살만해도 아파하는 스타일 빠니파파는 팡팡 때려도 시원함을 못 느끼는 스타일 고로 만족도가 갈릴 수밖에 없다 단계를 높일 수록 세게 쳐주는 느낌이 아닌 찌릿찌릿한 전기 자극만 높여주기 때문에 무조건적인 단계 조절은 별로다아 패드는 20-25회 사용 후 교체를 해야 하는데 한 개 당 오육천원 정도로 결코 싼값은 아니라는 거 어쩌라구, 어쩌라구, 어쩌라구 물리치료, 도수치료, 마사지 받을 때의 개인의 성향을 잘 생각해보고 구입하란 이야기  지금 클럭[Klug] 홈페이지에서는 ​ ~5/26(23:59)까지 1+1 가정의 달 이벤트 행사를 하고 있어 두 개를 하나 가격에 구매 할 수 있다고 해요 BUT, 하나만 필요해 단품 구입하실 경우 혹은 소모품 패드 구입의 경우 5만원 이하 제품은 배송료가 붙어 '쿠팡'이 더 저렴해요 (본문 안 이미지에 살짝쿵 링크 남겨둘게요 :)​ 아래 이미지 CLiCk¡ 클릭! 빠니맘 저렴할 때 양가부모님 사드리려고 하니 빠니파파의 난 반댈세 5월 26일까지 부지런히 사용하면서 고민을 더, 더, 더 해봐야겠어요오 파트너스 활동을 통해 일정액의 수수료를 제공받을 수 있음 ​​ ​ ​​ ​​",1546,18,"['참 쉽죠잉?', '여기서 중요 포.인.트!!!충전기를 연결한 상태에서사용하면 절대절대 안되요 :(', '잇템, 핫템 박민영 안마기그런대로 괜춘하다는 이야기']",3,https://postfiles.pstatic.net/MjAyMDA1MTRfNDkg/MDAxNTg5NDI0Njg5MDk5.EK5NaxiXUi59FuBj5XTokKbLUAfCWdqP5J6LWPK4nOEg.I4YCkRbuAY4keVfMLqap18KlwN5nNfXxeM_YiI6LZzgg.JPEG.helly13/1589424688378.jpg?type=w966,https://postfiles.pstatic.net/MjAyMDA1MTVfMjIz/MDAxNTg5NTA2MTY5NDYy.rUtqz52Y6Dop5rcnNasrfD4gOOuops6zMj1PZgo41Iog.u0KuKPZYSD_bVZm3dR8o2gjHdyUxFSQ2r8a22S83_FEg.JPEG.helly13/1589506168851.jpg?type=w966,26,1,0,0,0,0,0,0,0,0,0,0,0,0,0,0,0,0,0,0,0,0,0,0,0,0,0,0,0,0,0,0,0,0,0,0
