url,title,post_date,검색어,브랜드 명,content,content_cnt,content_line,quote,quote_cnt,first_img,last_img,img_cnt,솔직 빈도 수,비교 빈도 수,ㅋ 빈도 수,ㅋㅋ 빈도 수,ㅋㅋㅋ 빈도 수,ㅋㅋㅋㅋ 빈도 수,... 빈도 수,.... 빈도 수,ㅜ 빈도 수,ㅜㅜ 빈도 수,ㅜㅜㅜ 빈도 수,ㅜㅜㅜㅜ 빈도 수,ㅠ 빈도 수,ㅠㅠ 빈도 수,ㅠㅠㅠ 빈도 수,ㅠㅠㅠㅠ 빈도 수,장점 빈도 수,단점 빈도 수,비속어 빈도 수,허락 키워드,내돈내산 키워드,리얼후기 키워드,협찬 키워드,체험단 키워드,coupa.ng 키워드,< 키워드,> 키워드,♡ 키워드,♥ 키워드,구매후기 키워드,한달 키워드,두달 키워드,세달 키워드,광고 분류1,광고 분류2
https://blog.naver.com/PostView.naver?blogId=rmafbf123&logNo=222206948443,클럭 미니 마사지기S 사용후기,20210114,마사지기s 리뷰,클럭,"안녕하세요! 일상의 모든것에 최선을 다하는 사람!! 이 되고 싶은 사람 ""성형미인요다"" 입니다~ 오랜시간 책상 앞 컴퓨터를 사용하는 일을 많이 하다보니 어깨는 이미 뭉칠대로 뭉쳐있고 ㅠ.ㅠ 손목도 시큰시큰 해지기 시작하더라구요~  평소에 정형외과나 한의원에 가서 침을 맡거나 물리치료를 받는데요.. 코로나로인해 병원에 잘 안가게 되더라구요.. 그래서.. 이번에 클럭 미니 마사지기S를 구입하게 되었습니다!!  설 맞이 기념으로 1+1 구매 특템까지!! 한개는 부모님께 선물로 드렸는데 역시.. 효도템이라고 불리듯이..  부모님께서 엄청 좋아하시더라구요~ [흐뭇] 제 건강도 챙기고, 부모님께도 효도하고~  일석 이조네요!!  그렇다면..  구성품을 한번 살펴볼까요??  ↑↑↑↑↑구성품↑↑↑↑↑  큰패드1개, 작은패드1개, 리모콘, 본체S, 전용어댑터 패드를 사용후 보관할수 있는 케이스도 따로 들어있습니다!  본체S를 패드에 부착하고 난 후,  리모콘을 사용하여  강도(1~5단계)를 조절하며 마사지를 할수있습니다.  뒷목, 어깨, 무릎, 허리 마사지가 안되는 곳이 없네요!!  패드를 영상으로 더 자세히 보여드릴께요~  본체는 전용 어댑터를 사용하여 충전할수있어요~ 패드는 마스크팩, 콘택트렌즈에도 사용되는 하이드로겔로 만들어져있다고 하네요. 살에 닿았을때 처음엔 차가운 느낌이 들지만 그 느낌은 아주 금방 지나갑니다! ㅋㅋ  사용방법 및 품질보증서도 들어있습니다.  박스 오른쪽 상단에 보면,  정품인증번호도 나와있어, 정품등록을 해 놓으면  1년 무상 서비스를 받을수있으니 꼭 정품 등록하세요!!  저주파 자극으로 안전하게 마사지  할 수 있으며,  휴대성도 좋아 외출시 가지고 다닐 수 있습니다.  통증이 심한곳에선 자극이 찌릿찌릿 세지만,  그렇게 심하지 않은곳이라면 시원하게 마사지를 받으실 수 있습니다.  사용부위별 하루 1~3회 사용할수있지만, 동일 부위를 연속해서 하는것 보다 시간차를 두고 사용​하는게 좋다고 하네요!!  저도 어깨에 매일 하고 있는데,  만족합니다!!  1+1으로 싸게 구매해서 더 기분이 좋네요 !!   집에서 편하게..........  클럭 마사지 어떠세요? ",1064,13,[],0,https://postfiles.pstatic.net/MjAyMTAxMTRfOTgg/MDAxNjEwNTg3MjkzNDAw.hv3CxSMZ7_yK8pFsu52uLvO0onndBd3pQVIW2YjhRs8g.ZiEzmz2rG7QqiZeMwxyzxoUWgXn-2rc4DtK9OdJ4yx8g.PNG.rmafbf123/image.png?type=w966,https://postfiles.pstatic.net/MjAyMTAxMTRfMjQw/MDAxNjEwNTkwNzg2ODMz.aq6U4nlP2Wvoz9fBtfWkJ_z9BOjrx1_g09LEletCBnYg.3U-bRjSTLfDcldncb40WZ1we3GYu4Md8Y2lrHjdHGjMg.PNG.rmafbf123/image.png?type=w966,12,0,0,1,1,0,0,1,1,0,0,0,0,1,0,0,0,0,0,0,0,0,0,0,0,0,0,0,0,0,0,0,0,0,9,9
https://blog.naver.com/PostView.naver?blogId=hasom0304&logNo=221986014496,클럭(Klug) 미니 마사지기S 후기 :D,20200601,마사지기s 리뷰,클럭,"안녕하세요! 오늘은 클럭 미니 마사지기 후기를 가져와봤어용 이 제품을 구매하게 된 배경은 손목이 아파서..ㅋㅋㅋ 뭐든지 천천히 하는게 좋은거같아요ㅜㅜ 급하게 하면 다칠 수 있습니당.. 손목 인대가 살짝 늘어나서 물리치료 받고 있었는데 빨리 나아야해서 이 제품이 도움된다는 얘기를 듣고 구매해보았어요. 구매는 쿠팡에서! 로켓배송으로 사서 바로 다음날 도착했어요. 쿠팡에 적혀 있던 제품설명은 대충 이렇게!   그럼 이제 택배를 뜯으러 가봅시당 - 블랙, 민트색 조합의 깔끔한 박스에요. 안에는 딱 설명에 써있던 그대로 들어있네요 ㅎㅎㅎ 설명서도 아주 친절하게..! 처음에 리모컨이랑 본체 연결하느라 헤맸는데 진짜 M 버튼만 꾹 누르면 되어요 ㅋㅋㅋ 근데 연결해놓고 정작 잘 안사용함 본체만으로도 조작하기 충분합니당 이렇게 품질보증서도 있고용.   손목에 붙였을 때의 모습 ! 이렇게 구매해서 일주일간 사용해봤는데요. 일단 사용하기 너무 편해요. 패드에 본체 부착해서 마사지 하고 싶은 부위에 붙이고 버튼 눌러주면 끝 ! 파랑색 모드 3가지, 하얀색 모드 3가지, 이렇게 총 6가지 모드로 조작할 수 있는데 처음에 다친지 얼마 안됐을때는  첫번째 단계로만해도 아팠어요ㅠㅠ 일주일 쯤 지나니 세번째 단계로 하고도 더 세게 좀 되서 시원했으면 하는 마음ㅋㅋㅋ 저 패드를 25회 정도 사용하면 교체해줘야한다고 하는데 사용하다보니 여러번 쓰니까 확실히 접착력이 떨어지긴  하더라고요 그래도 가벼운 마사지기로 쓰기 좋아서 유용하게 잘 쓰고 있어요! 저는 추천추천 ㅎㅎㅎㅎ 그럼 이렇게 포스팅을 마칠게요 - 6월 한달도 화이팅 !!!! >< #클럭 #클럭미니마사지기 #미니마사지기 #미니마사지기추천 #마사지기추천 #Klug #Klug미니마사지기 #쿠팡클럭 #쿠팡추천 #손목마사지 #손목마사지기 ",884,10,[],0,https://postfiles.pstatic.net/MjAyMDA2MDFfMjk3/MDAxNTkwOTc5MzcyMTY3.Wx64XutwLD1dUujhIGjvRgj5rhYep-wJg91rlGC7bDQg.R2gB96F85JjCrevGRXIzNrrfNKAGyPAmcp9oWZxZ3Yog.PNG.hasom0304/image.png?type=w580,https://postfiles.pstatic.net/MjAyMDA2MDFfNjMg/MDAxNTkwOTc5ODg1MjQ5.CI6ogSJW1QexAyBCInuYZ-SJZY5fn79zC0Ziiv1ujH8g.ZRVl2RJ5jPlV2E_aGYa_iBwH9SRefrpVyFLwjzWPeVQg.PNG.hasom0304/image.png?type=w580,13,0,0,3,3,3,0,0,0,1,1,0,0,1,1,0,0,0,0,0,0,0,0,0,0,0,1,1,0,0,0,1,0,0,9,9
https://blog.naver.com/PostView.naver?blogId=sakurasake2&logNo=222102747914,클럭 미니 마사지기S 사용해본 후기 (SP-308W),20200929,마사지기s 리뷰,클럭,"클럭 미니 마사지기S 사용 후기를 모아보았습니다. 클럭 마사지기를 구매하려고 하셨다면 쿠팡에서 구매하셔서 로켓배송으로 하루만에 빠르게 받아보세요! 클럭 미니 마사지기S 사러가기▶▶ 아래 후기 모음은 쿠팡에서 직접 구매하고 작성해주신 상품평들로 솔직한 후기들만 모아두었습니다. 일**님 후기 ★★★★★ 사용하기 편리한 휴대용 안마기입니다. 평소에 어깨, 발목, 허리가 안좋았는데 직장동료가 추천해주어서 구매하게 되었습니다. 포장상태도 고객을 위해 신경을 많이 쓴 흔적들이 보였으며 매우 깔끔하고 고급스러운 느낌이었습니다. 오늘 받자마자 충전하여 사용해보니 작지만 강하고 사용하기 편리한 기기입니다. blue/white 두가지 모드가 있어서 취향대로 선택 가능하며 각각 15개의 단계로 구성되어 있었습니다. 사용하기 편리한 가정용 안마기 찾고있다면 고민하지 말고 클럭을 구매해보세요 이**님 후기 ★★★★☆ 허리랑 다리랑 너무 저려서 고민하다 주문했어요. 받고 2시간정도 사용했어요. 하다보니까 여기저기 하고싶어지네요. 근데 부위마다 느껴지는게 다른듯. 허리는 쎄게해도 그렇게 쎼게 느껴지지 않고 목이나 팔은 쎄게 느껴집니다. 일단 강도가 느끼는 사람마다 다를것 같긴한데 그래도 가성비 5만원 안마기니까 이정도면 만족합니다. 휴대용으로도 좋은듯해요! 크***님 후기 ★★★★☆ 손목과 발목에 반복되는 통증이 있는 동생에게 선물하기 위해서 구매하였습니다. 동생은 어린이집에 근무하다보니 아기들을 안았다 내려놓기를 계속 반복해야해서 손목과 발목에 통증을 몇달째 지속되고 있는 상태입니다. 그런데도 병원에 안가고 파스로 버티는것이 안쓰러워서 구매해서 선물했습니다. 일단 2주정도 사용해본 동생은 효과는 아주 좋다고 합니다. 어린이집에서 퇴근하고 나면 청소기 들기도 힘들다고 하던 동생은 손목 통증이 확실히 줄어들었다고합니다. 그래서 요즘은 퇴근 후 꼭 단 몇분이라도 손목에 사용하고 있으며 자기전에는 발목에도 사용하기 시작했다고합니다. 그래서 한세트 정도 더 구매해서 손목과 발목 등에 동시에 사용했으면 하기에 추가구매하려고합니다. 신**님 후기 ★★★★★ 저희회사 과장님께서 인터넷도 잘 못하시고 해서 제가 가끔 주문해드리는데요 이번에 과장님께서 어버이날 선물로 뭘해드려야하냐고 물어보시더라구요. 과장님도 이번 코로나로 여유가 없으시다고 저렴하면서 있어보이는 선물을 추천해달라고 하시기에 평소에 제가 좋아하는 클럭마사지기를 추천해드렸어요. 예전에 한번 구매하고 너무 좋아서 언니한테 추천하고 회사언니, 회사 대표님께도 추천해서 다들 잘 쓰고 계시거든요. 과장님께서 제품 보시더니 마음에 드신다고 주문해달라고 하시더라구요. 다음날이 어버이날이었는데 당일에 딱 맞춰 받으셨고 맏으시고 사용해보셨는데 너무 좋으시다고 잘샀다고 하셨데요. 저도 써봐서 아는데 컴퓨터로 업무를 많이 보는 저는 항상 손목이 아프거든요. 그래서 파스를 붙이고 다해도 소용없었어요. 근데 혹시나해서 손목에 클럭으로 마사지 했는데 별 소용없더라구요. 그런데 예전 회사 언니가 목이 안좋으면 목 밑으로 다 망가지는거야 했던 말이 생각나서 몽게다 해줬는데 손목이 많이 좋아졌어요. 지금은 어딘가 아프면 일단 목부터 풀어주고 차츰차츰 내려와요. 저희집은 클럭을 거실이나 침대에 둬서 시간날때마다 사용하고 있어요. - 이 글은 쿠팡 파트너스 활동으로 쿠팡에서 소정의 수수료를 받아 작성한 글입니다 - 후기 사진 및 내용을 원치 않으시면 댓글 남겨주세요. 바로 삭제하도록 하겠습니다.",1698,7,['클럭 미니 마사지기S SP-308W실제 구매 후기 모음'],1,https://postfiles.pstatic.net/MjAyMDA5MjlfMTA4/MDAxNjAxMzQ1ODc1MzE2.QMCAdDrgaRyrOhalQBQws8uvQ07vyF0Yu5r4Cs-BrpAg.-2oiOFoCtBZ02MQshYwfFk51auhayy1PnYXn65mAhGgg.JPEG.sakurasake2/1.jpg?type=w966,https://postfiles.pstatic.net/MjAyMDA5MjlfNyAg/MDAxNjAxMzQ1ODc5Mjg2.GAX9DLEAWFjkjE_u-Ysfy-1Vi-9hVK7aYBhWnQ5idiwg.msiiyHYl9T3mS_R_FXbxSbPRULmmQwrCB7dX5nxy_Y0g.JPEG.sakurasake2/4.jpg?type=w966,4,1,0,0,0,0,0,0,0,0,0,0,0,0,0,0,0,0,0,0,0,0,0,0,0,0,0,0,0,0,0,0,0,0,0,0
https://blog.naver.com/PostView.naver?blogId=fisoe&logNo=222215560859,"클럭 미니 마사지기S, 리모컨까지 산 후기!",20210121,마사지기s 리뷰,클럭,"클럭 미니 마사지기S, 리모컨까지 산 후기! 안녕하세요 ㅎㅎ 오늘은 오후부터 갑자기 비가 오더라고요 아직까지도 오고 있는데 일기예보를 보니 새벽까지는 계속 비가 이어진다고 하네요 눈 때문에 더러워졌던 차가 비로 깨끗해지고 있어요 ㅋㅋ 세차 언제 하지 고민 중이었는데 다행이네요 이렇게 꼼수로 차가 깨끗해집니다 어제는 몸이 안 좋아 글을 못 적었어요ㅠㅠ  엊그제는 집에서 하기 좋은  게임에 대해서 말씀드렸었는데요 오늘은 바쁜 직장인 분들이나 오랜 시간 책상 앞에 앉아있고, 또는 오랜 시간 서있는 분들을 위한 작지만 강한 힘을 갖고 있는 물건을 소개해 드릴 텐데요! 대충 어느 것을 말씀하시는지 눈치채셨을 거예요 ㅎ 물론 제목에도 쓰여있긴 하지만요 오늘도 제 돈 주고 산 제품이고, 솔직하게 후기를 적겠습니다 요즘 한 창 핫하더라고요 사실 SNS에서 한창 떴던 건 좀 지난 것 같긴 해요 저도 9월쯤 산 것 같아요! 벌써 4개월이 지났네요 잘 사용하고 있답니다 ㅎㅎ 클럭 미니 마사지기S 이고요! 아마 제일 유명한 것 같아요 다들 보시면 아..! 이거구나 하실지도 모르겠습니다 스쳐 지나가듯 보시기라도 하셨을 것 같아요 저도 처음에 이름 듣고는 몰랐는데 직접 보니 떠오르더라고요 짠! 전 리모컨까지 있는 것으로 구입했습니다. 이 글을 작성하면서 검색해보니 지금 설 선물 세트로 1+1 구입 혜택 이벤트를 하고 있네요! 그러고 보니 설도 이제 곧이네요 3주 뒤..? 아마 코로나19때문에 거리가 먼 분들은 안 가시는 분들도 계실 것 같아요! 지난 연휴처럼요 아무래도 서로 조심해야 하는 시기이니까요ㅜㅜ 구성품이 풍성해 보이네요 ㅋㅋ 홈페이지를 보니 1+1뿐만이 아니라 2+2 그리고 무릎 밴드까지 주는 이벤트도 진행 중이네요 구매하실 분들은 지금이 찬스 같습니다.. 제가 살 땐 그냥 한 개만 구입했거든요 구성품을 말씀드리자면 클럭 미니 마사지기S 본체와 리모컨 1개, 기본 패드 1장, 큰 패드 1장, 전용 어댑터 이렇게 들어있습니다. 가격은 75,000원입니다. EMS 저주파가 속 근육까지 싹~ 풀어준다고 합니다. 그래서 효과가 극대화된다고 하는데요 오 정말, 작은데 속까지 아파요! 손으로 주물러서 풀기 힘든 피하 지방 아래 속 근육까지 저주파가 깊숙하게 침투한다고 하는데요 확실히 겉만 되는 게 아닌 것 같은 느낌은 있어요! 다만, 익숙해지다 보면 아무래도 더 강해지길 원하게 되더라고요 무선이라 휴대가 간편합니다! 충전만 미리미리 해두면 걱정할 것이 없어요~ 붙이기만 하면 되니까 어른도, 아이도 손쉽게 사용할 수 있을 것 같아요 클럭 미니 마사지기S는 조작법도 어렵지 않아요! 어깨나 허리, 종아리 등 굴곡이 있는 신체에 촥 밀착되어 잘 붙습니다! 주의 사항이라 하면, 1회 사용시간이 25분이고, 동일한 부위에 연속 사용은 금지한다고 해요 동일한 부위에 사용하실 거라면 일정한 시간이 지난 뒤 사용하라고 되어 있는데요! 음,, 이유는 모르겠어요 ㅜ 뭔가 좋지 않으니까 주의 사항인 거겠죠..? 안 들어서 좋을 건 없으니 전 지키고 있답니다.. ㅎ 리모컨이 있어서 더 좋은 게 손이 닿지 않는 부위, 보이지 않는 곳에 붙여놨을 때도 조작이 가능하다는 거예요! 이게 은근 편하더라고요 사실 별거 아닌데 말이죠 두 가지 모드로 사용할 수 있고 모드별 3가지 동작이 있습니다. 15단계로 강도 조절이 가능하고요! 블루 모드는 두드림(강), 주무름 등이고 화이트 모드는 두드림(약), 침 등입니다! 소리도 나지 않으니 일하면서도 붙이고 있기 좋고 운동 후 근육 뭉친 곳에 사용하기도 좋아요 클럭 미니 마사지기S의 충전은 휴대폰 충전기로도 가능하답니다! 팔목, 목, 어깨, 등, 허리, 팔, 무릎, 허벅지, 종아리, 발전체, 발바닥에도 사용할 수 있다고 나와있는데 사실 팔목같이 얇은 부분은 잘되지 않더라고요ㅜ 되긴 되는데 다른 부위보다는 상대적으로 잘되지 않아요! 패드는 평균적으로 20~25회 사용하면 교체를 권장한다고 합니다. 아무래도 자주 사용하다 보면  접착력이 떨어져서 바꿀 수밖에 없더라고요 ㅎ 보관 방법이나 피부 상태에 따라서 사용할 수 있는 횟수가 달라질 수 있다고 해요! 마스크팩과 콘택트렌즈에도 사용되는  하이드로겔이라 안심하고 사용할 수 있고 피부 저자극 테스트도 통과했다고 합니다. 다만, 개인의 피부 타입에 따라 차이는 발생할 수 있으니 혹시, 자극이 된다면 사용을 중단해 주세요! 또 클럭 미니 마사지기S가 좋은 점은 정품 등록을 하면 사용 중에 기기 이상으로 문제가 발생하면 1년 이내에 무상 교환이 가능하다고 해요! 그만큼 자신 있다는 소리이기도 하겠죠? 지금 원 플러스 원 행사 중이니 사는 것도  좋을 것 같아요 리모컨도 있어서 편하고요 다만, 하나에 7만 원 대라면 구입하기에 조금 아까운 느낌도 있는 것 같아요 아무래도 한번 사고 끝이 아니라 패치를 교체해야 하기 때문이에요! 오늘은 여기서 마치도록 하겠습니다. 오늘도 굿빠~!",2389,10,[],0,https://postfiles.pstatic.net/MjAyMTAxMjFfMTk0/MDAxNjExMjM2NjM0ODMx.QhbjYQyuBLvYsaN4As9ZgmtQb-H-UAHoarmWyURWH-sg.IGtxmtv_bwUUlgqnVVKktGPam11YLX5pC_eQqx3vS8Yg.JPEG.fisoe/SE-1c9025f9-1cdf-4803-8630-9aecf873b69a.jpg?type=w966,https://postfiles.pstatic.net/MjAyMTAxMjFfNjQg/MDAxNjExMjM2NjQzODgw.-IfD_rh6FsJBuyRiG0r6Bvhe5yYz2fDeaowEHyqBUgcg.7MNOLA8xQeTbz4t_Hg865Wo7zulJ5MofdBnpemzmkxEg.JPEG.fisoe/SE-5c423670-c84e-4f21-9b1b-0115f9d13984.jpg?type=w966,8,1,0,2,2,0,0,0,0,3,1,0,0,1,1,0,0,0,0,0,0,0,0,0,0,0,0,0,0,0,0,0,0,0,0,0
https://blog.naver.com/PostView.naver?blogId=hnone1&logNo=222321986228,내가 사용하게 된 클럭사용후기 &quot;클럭 미니 마사지기S Duo&quot;,20210425,마사지기s 리뷰,클럭,"안녕하세요!! 하나언니에요~ 봄의 싱그러움을 알리는 4월의 마지막을 향해 다가가고 있어요~~ 다가오는 5월은 가정의달로 많~~은 행사가 끝이 없는데요!! 5월2일 미뤄뒀던 우리 아이 돌촬영을 시작으로 5월5일 어린이날  5월8일 어버이날 5월15일 스승의 날 까지.. 여기저기 챙겨야 할게 엄청 많은 달이기도 해요~ 어린이날 선물, 어버이날 선물, 스승의날 선물.... 챙길게 한두개가 아니네요 그와 동시에..  저는 돌준맘이 되었다는 TMI 소식을 남기고ㅋㅋ 제가 어버이가 되어서 그런지, 이번 어버이날은 조금 더 신경이 쓰이더라구요!! 어버이날 선물로 정말 많은 고민을 하다가 클럭 마사지기를 미리 선물로 드렸는데.. 와... 제가 못끊은 ""클럭 미니 마사지기S Duo"" 클럭사용후기를 남겨볼까해요~ㅋㅋㅋ 선물로 줬다뺐기라고나 할까요?? 부모님께서도 일을 하고 계셔서 항상 어깨뭉침과 뻐근한 허리때문에 힘들어 하셨는데요~ 어른들께서는 TV에 나오는 건.. 좋은거라고 다들 알고 계시잖아요?! 그래서 요즘 광고 많이 나오는 클럭 미니 마사지기S Duo로 클럭 마사지기 어버이날 선물을 드렸어요~ 저도 평소에 집안일과 육아로 어깨가 너무 아프고 뭉쳐서 매번 남편의 손을 빌려 마사지를해서 풀곤 했는데요~ 사실 매일 부탁하는 것도 미안... 얼마전 친정에 갔을 때.. 잠깐! 사용해 보고서는..... 아.... ""엄마, 나 이거 좀 빌려주면 안될까?"" 그렇게 줬다 뺐기 해왔어요ㅋㅋㅋㅋ 클럭 마사지기를 오픈 해봤어요~ 콤팩트한 사이즈로 여행이나 캠핑, 외출시에 가져가면 좋을 것 같더라구요! 구성은 마사지기 본체 2개, 기본 패드 1개, 큰 패드 1개,  보관용 파우치 2개  충전 케이블, 충전 어댑터, 리모컨!! 이렇게 들어 있답니다~ 사진으로는 클럭 마사지기의 컴팩트함이 잘 안느껴지시죠? 아래에 가면 느낄 수 있답니다~ 하나언니는 항상 설명서 정독하는거 아시죠?! 설명서 안읽으면 잘 이해가 안되는 타입...(나이먹은거 티내기..) 본체와 리모콘 연결하는 방법이에요~ 직접 실물을 한번 보고! 설명서를 보면 정말 잘 이해가 되잖아요?! 사용하기 전 설명서 정독은 필수라는거 ㅋㅋㅋ 임산부 및 수유부, 12세 이하의 영,유아, 어린이 체온이 38도 이상이거나, 심장질환 및 의료용 전자기기 사용자 신체 부위의 저림, 통증을 수반한 신경질환자는 사용을 금하는게 좋아요! 그 외에도 해당되는 사항 잘 읽어보고 건강하게 사용하세요~ 안전을 위해 동일 부위에 연속 사용을 금하고, 충전기를 연결한 상태에서 사용하면 안되요~ 목걸이나 벨트 등 급속 제품 주변에 부착하면 안된답니다!! 이래서 설명서를 잘 봐야 한다니까요~ 본체 크기 보이시나요? 손바닥 안에서도 남을만큼 아주 미니미니한 사이즈에요~ 본체와 리모콘 연결을 했어요!! 팔, 다리에 할때는 본체를 직접 만질 수 있지만  허리나 어깨 같은 부위는 만질 수가 없으니까 리모콘으로 하면  엄청 편할 것 같아요!! 본체의 M 버튼을 5초이상 누르고 있으면 불이 깜빡거려요! 그때!  리모콘의 M버튼을 눌러주면 리모콘에 초록 불빛이 들어오면서 연결이 된답니다! 본체와 패드를 연결했어요!! 접합부위에 본체를 놓으면 저절로 탁~ 하고 끼워지더라구요! 패드의 필름을 떼어내고 어깨에 붙이기!! 잔뜩 뭉친 승모근과 날개뼈 아래의 근육들.. 찌릿찌릿한 EMS 저주파가 속 근육까지 싹~ 풀어주는 느낌이에요! 저는 종아리가 근육이 아플때도 있는데, 정강이 옆쪽으로 난 근육이 자주 아프더라구요! 그래서 앞쪽에다 붙이고 마사지를 하는데,  수축과 이완을 반복하면서 제대로 마사지 되더라구요! 자세히 보시면, 근육이 수축되고 이완되는 모습이 보일거에요~ 제가 자주 이곳을 마사지해줘서 그런지 시원~~~한게 아프지도 않고 너무 만족! 작동하면서 파란불, 하얀불이 깜빡이는데, 블루모드와 화이트모드가 있어서 선택할 수 있어서 좋답니다! 어버이날 선물로 클럭 미니 마사지기S Duo! 광고에 나오는 클럭 마사지기 선물 어떨까요?!  ",1938,20,[],0,https://postfiles.pstatic.net/MjAyMTA0MjRfMTQ4/MDAxNjE5Mjc1NjQyNzQ4.s1d-gLKe5UEZfsfzD06sPH_plwPZ9GwM5oT-MWypSjkg.mL9D1_UiHgrJnz31QQdOcXLWog7T9RCY42pnq4IVQ_Eg.JPEG.hnone1/IMG_5426.JPG?type=w80_blur,https://www.revu.net/campaign/img.php?p=04937326da674589ca986fd3e42cb9d28384478784018391caafab414045d06c&v=4,33,0,0,4,4,3,1,6,3,0,0,0,0,0,0,0,0,0,0,0,0,0,0,0,0,0,0,0,0,0,0,0,0,0,9,9
