url,title,post_date,검색어,브랜드 명,content,content_cnt,content_line,quote,quote_cnt,first_img,last_img,img_cnt,솔직 빈도 수,비교 빈도 수,ㅋ 빈도 수,ㅋㅋ 빈도 수,ㅋㅋㅋ 빈도 수,ㅋㅋㅋㅋ 빈도 수,... 빈도 수,.... 빈도 수,ㅜ 빈도 수,ㅜㅜ 빈도 수,ㅜㅜㅜ 빈도 수,ㅜㅜㅜㅜ 빈도 수,ㅠ 빈도 수,ㅠㅠ 빈도 수,ㅠㅠㅠ 빈도 수,ㅠㅠㅠㅠ 빈도 수,장점 빈도 수,단점 빈도 수,비속어 빈도 수,허락 키워드,내돈내산 키워드,리얼후기 키워드,협찬 키워드,체험단 키워드,coupa.ng 키워드,< 키워드,> 키워드,♡ 키워드,♥ 키워드,구매후기 키워드,한달 키워드,두달 키워드,세달 키워드,광고 분류1,광고 분류2
https://blog.naver.com/PostView.naver?blogId=hahoitar&logNo=222321915756,어버이날 선물 클럭 미니 마사지기S Duo 사용후기,20210425,마사지기s 리뷰,클럭,"매일 허리어깨 아프다고  퇴근하고 오시면 엄마한테 여기주물러라 저기주물러라하는 아버지 귀찮다고 본인도 힘들다고 중얼중얼하는  어머니 ㅠㅠㅠ 이번 어버이날 이벤트로 용돈 드리는것도 좋디만  몸에 붙이고 무선으로 마사지해서 서로 귀찮게 할일없는 EMS 저주파 마사지기가 저희 부모님에게는 최고의 선물이겠다 싶어요. 그래! 결정했어~ 5월 가정의달이라고 클럭 미니 마사지기S는 1+1행사까지 하는데 서로 내가 하겠다며 부모님 싸울일 없이 2개 들이면 딱이다 싶어요. 가격도 10만원 미만이라 이정도면 어버이날 선물로 저렴하게 했다 할 수 있거든요.  우선 육아와 집안일로 신체적 급노화를 경험한 제가 효과가 있나 클럭 미니 마사지기S DUO 단품을 써봤어요. 인터넷으로 주문해도 선물하기 좋게 종이가방이 같이 배송되어와서 추가로 포장할 필요없이 깔끔하게 준비해서 드릴 수 있어요. 구성 본체 2개, 리모컨1개, 기본패드 1개, 큰 패드 1개, 충전기 설명서와 나중에 추가로 패드 구입시 연락할 수 있는 구성과 연락처 정보 등이 기입된 안내지도 들어있어요. 본체 충전 케이블선은 5핀인데요. 꼭 이 케이블 없어서 집에 5핀 핸드폰 충전기 있으면 연결해도 충전이 가능해서 편해요.  기본으로 리모컨에 건전지가 들어있고요.  리모컨이 배송 중 손상되는걸 방지하기 위해 건전지가 닿는 부분에 비닐이 끼어져 있었는데 사용전 비닐은 빼서 제거했어요.   건전지는 CR2025 만 사용이 가능하다고 해요.  마사지기 패드 크기  기본 사이즈는 성인 손 보다 조금 작고  큰 패드는 성인손과 비슷한사이즈인데요.  추가로 구입할 수 있는 마사지패드로 더 튼 사이즈도 있더라고요.  판매중인 나비모양의 마사지패드 사이즈는 크게 3가지가 있는데  제가 사용한 마사지기 클럭S DUO 단품 세트 구성에는  저렇게 두가지의 패드가 들어있었어요.   EMS 저주파마사지기 사용방법  우선 본체 2개를 충전해서 준비했는데요.  충전시 빨간불이 들어와서 충전중임을 확인할 수 있어요.  본체와 패드 연결  본체 뒤에 패드와 연결부위 위치를 맞춰서 가져다 되면 자석처럼 찰싹하고 붙어요.  붙일 때 찰칵 소리가 났다면 제대로 연결된 거예요.  패드에 붙어 있는 보호필름을 제거하고 마사지 하고 싶은 부위에 붙여서 기기를 작동시키면 되는데요.  작동  기기를 직접 작동시에는 바로 +/- 눌러서 강도조절해서 사용할 수 있고  리모컨을 연결해서 사용하려는 경우에는  본체에 있는 m 버튼을 5초이상 길게 누른 후  불이 번쩍번쩍 할 때 리모컨에 있는 M버튼을 누르면 연결 완료! 클럭S 듀오의 경우에는 본체 기기가 2개 들어있는데요.  1개 연결 한 뒤 작동시키고  다른 1개 연결해서 작동시켜서 동시에 두개를 사용할 수 있어요.    부모님 어버이날 선물로 생각중인 아이템인데  부모님이 사용하기 어려우시면 어떡하나 했는데  사용법이 간단해서 드려도 괜찮겠다 싶었어요.    m모드의 역할이 2가지 인데요.  한가지는 리모컨과 연결하기  다른 한가지는 마사지 모드 변경하기예요.  마사지 모드는 총 2가지로  두드림(강), 주무름, 마사지의 블루모드  침, 마사지, 두드림(약) 화이트 모드예요.  마사지 모드는 본체에 있는 LED컬러로 구분이 가능해요.  1회 사용시, 작동시간은 25분이고 중간에 중단하고 싶으면 - 버튼을 3초간 꾸욱-- 리모컨 조작시에는 off 버튼을 누르면 돼요.  강도조절은 1~15단계가 가능한데 보통 3단계만 되도 강력해서 그 위로는 잘 안올려봤어요.  사용해보기 전까지는 살짝 두두두 자극만 오는 정도이지 않을까 생각했는데 생각보다 강도가 높아서 놀랬어요.   얇고 가벼워서 휴대하기가 좋아서  사무실에서 어깨등 근육이 뭉쳐서 피로도가 더 쌓이는 직장인들은 휴대해서 중간에 쉬는시간에 사용해도 괜찬겠다 싶어요.  버튼 누를 때 삐삐하고 소리 나기는 하는데  소리는 리모컨에 있는 음소거 버튼을 누르면  나오지 않게 할 수 있어요.  패드 피부에 닿는면이 하이드로겔로 되어 있어서 몸에 사용하고 싶은 부위에 척척 잘 붙는데요.  이 하이드로겔은 마스크팩이나 콘택트렌즈 등에 사용되는 재료라 안심해도 된다고 해요.  물론, 피부 저자극 테스트도 완료됐다고 해요.  각자 일하는라 어디 한군데 성한데 없다고 다들 말하는데요.  하루종일 사무실 책상에 앉아있느라 제일 많이 뭉치는 승모근 근처 및 어깨는 물론 목 뒤 등 패드를 가져다 대기만 하면 철썩 잘 붙어서  근육이 뭉쳐 쑤시는 다양한 부위에 사용하기 편리하더라고요.  서서 집안일 하느라 뭉친 다리 근육 완화에 도움을 주는건 물론 EMS자극으로 근지구력 강화 효과도 있다고 해요.  저는 아이 안다가 이번 겨울에 한번은 눈길에서  한번은 욕실에서 넘어졌는데요.  흑흑흑  무릎이 한번씩 시큰거리는데  육아하느라 치료받으러 병원을 자유롭게 가기도 쉽지 않은데 마사지해서 그 때 그때 아픈거 풀어주니까 도움이 되더라고요.  이제품 너도나도 다 사용해서 온가족이 사용하기 좋은 5월 가정의달 어버이날 선물인것 같아요.  클럭은 EMS 방식으로 겉에뿐 아니라 안쪽 근육까지 저주파가 전달되어 근육 뭉침 등으로 쑤시는거 완화에 도움을 줘요. 제품 박스에 있는 정품 인증 스티커의 정품 인증 번호를 등록해두면 1년 이내 사용 중 문제 발생 시 무상교환도 해준다고 해요.  서방도 써보더니 이거 장인어른에게 어버이날 선물로 진짜 괜찮다며 작은데 강도도 있고 생각보다 괜찮다고 했어요.  저도 기대했던 것보다 괜찮아서 시부모님도 이번에 선물로 고를까 싶더라고요. 체험단으로 받았는데 괜찮은 제품이라 오히려 더 여러개 구입할 것 같은 클럭 미니 마사지기S Duo 사용 후기였어요.    제가 사용한 제품의 좀 더 상세한 정보가 궁금하신 분은 상기 링크를 참고하세요.  [본 포스팅은 업체로부터 제품만 제공받은 후  솔직한 사용후기를 작성했습니다.]",2842,32,[],0,https://postfiles.pstatic.net/MjAyMTA0MjNfNjAg/MDAxNjE5MTY5OTUyNTAw.5XiJE70Yo-OPQHBG0D8utpBr_RVnm69BnI7XR5o0RIYg.r2fq7dZdMIZt95cFp35HQfy4tfUB0gOxY0_SDf8Wxjcg.JPEG.hahoitar/%EB%B6%80%EB%AA%A8%EB%8B%98_%EC%84%A0%EB%AC%BC_%EB%A7%88%EC%82%AC%EC%A7%80%EA%B8%B0_04.JPG?type=w966,https://postfiles.pstatic.net/MjAyMTA0MjVfMTMx/MDAxNjE5Mjc3NTY3NTk0.R8QImd4X1OXRLrN0LVpZ5GZCU_w2c3_URJsIUqqe1EMg.VEyY1Q6L50DOqhRZ9k-IT9JHRDo0kdpJih0I7YH-lJQg.JPEG.hahoitar/%EB%B6%80%EB%AA%A8%EB%8B%98_%EC%84%A0%EB%AC%BC_%EB%A7%88%EC%82%AC%EC%A7%80%EA%B8%B0_24.JPG?type=w966,32,1,0,0,0,0,0,0,0,0,0,0,0,1,1,1,0,0,0,0,0,0,0,0,1,0,0,0,0,0,0,0,0,0,1,2
https://blog.naver.com/PostView.naver?blogId=wj_2169&logNo=221879137990,클럭 미니 마사지기 S 사용 후기에요,20200329,마사지기s 리뷰,클럭,"요즘 핫한 미니마사지기 클럭마사지기 선물 받아서 사용 중이에요 나이가 들면 안 아픈 곳이 없다고 하지만 요즘은 10대나 20대들도 스트레스 등으로 안마나 마사지, 체형교정 등을 많이 받더라고요 아플 때마다 안마 받으러 가기는 힘드니까 이런저런 안마기나 마사지기들을 사용하게 되는데 저 같은 경우는 손으로 받는 수기 마사지가 가장 좋았고 효과도 좋았는데 미니 마사지기인 클럭 마사지기는 사이즈가 상당히 작은데 왜 그렇게 인기인가 싶었거든요 그런 차에 딸에게 선물을 받아서 사용해보니 일반 마사지기와는 다른 방식의 #미니마사지기 더라고요 장점도 있지만 사용하면서 불편한 점도 있어서 오늘은 #클럭마사지기 후기를 보여드릴게요 도대체 뭘 술술 풀어 준다는 것인지 궁금하면 따라오세요 클럭 마사지기는 두드리고 때리고 꼭꼭 눌러주는  안마기가 아니라 저주파를 사용하는 마사지기에요 병원이나 한의원에 가면 물리치료라고 해서  전기 같은 것 연결해서 자극이 오게 하잖아요? 그런 비슷한 원리라고 생각했는데요 먼저 언박싱부터 해볼게요 먼저 박스 상단에 푸른빛의 네모에 정품 등록을 하는 번호가 있어요 그러니까 무조건 박스 버리지 마시고 살살 긁어 보면 그 안에 정품 등록 번호가 있어서 홈페이지에 등록을 해야 하더라고요 정품 등록을 해야 1년 안에 구입을 한 제품일 경우 무상 서비스를 받거나 교환을 해준다고 해요 정품 등록 시에 구입처가 보이던가 그랬던 것 같아요 짝퉁들도 있으니까 꼭 정품 등록을 하시고요 패키지로 판매도 많이 하는데 저는 하나씩만 들어 있는 단품이에요 스티커가 얼마나 단단하게 붙어 있던지 ~~ 구성품들이에요 클럭 마사지기가 생각보다 작고 리모컨도 앙증맞은 사이즈더라고요 저렇게 작은데 과연 효과가 있나 궁금하죠? 저도 그랬어요. 물론 광고에서 보기는 했지만 본체가 이렇게 작다고 생각 못 했거든요 작지만 효과는 괜찮은 편인 클럭 마사지기 오늘부터 클럭 합니다 오른쪽이 클럭 마사지기 본체 왼쪽은 리모컨입니다 손이 안 닿는 부분에 마사지를 할 때는 리모컨을 꼭 사용해야 해요 아니면 다른 식구가 눌러 줘야 하더라고요 저는 패드가 큰 것 하나와 작은 것 하나 들어 있는 구성품입니다  주문하면서 패드를 추가해서 많이 구입을 하시는데 저는 일단 들어 있는 패드부터 사용 중이에요 필요한 시기가 되면 그때 구입하는 것으로~~ 패드는 붙였다 떼었다 하면서 사용해서 시간이 지나면 접착력이 떨어질 수도 있어서 정상적으로 사용하기 위해서는 추가 패드가 필요해 보입니다 홈페이지에서는 20~25회 정도 사용하면 패드를 교체하라고 나옵니다만 패드를 교체하는 비용도 만만치 않아 보이는데 홈페이지에서는 월 1만 원대라고 하는 것을 보면 처음에 구입 후 나중에 패드를 교체하는 비용을 생각하면 월 1만 원대면 충분히 사용할 수 있을 것이라 생각합니다 전용 어댑터가 따로 들어 있습니다 USB 케이블도 전용으로 들어 있어요 우선 사용하기에 앞서서 먼저 할 것이 있는데 그것은 바로 본체와 리모컨을 연결해 주는 것이더라고요 따로 방법이 있어서 그대로 따라 하면 되는데 저는 안돼서 고객센터로 전화해서 문의를 하고 연결할 수 있었어요 요 부분은 조금 복잡하게 만든 것 같은데 그럴만한 이유가 있겠지요 부모님 선물해드릴 것이면 자녀분이 필히 리모컨을 연결을 해주시기 바랍니다 한번 연결하면 다음부터는 별도로  연결 안 해도 되거든요 처음에 본체와 리모컨을 연결하는 방법은 m 버튼을 눌러 주시면 되는데 m 버튼을 눌러도 아무런 반응이 리모컨에서 없을 때는 이렇게 해주시면 되네요 저도 처음에 연결이 안 돼서 고객센터로 문의를 하니 알려 주더라고요 건전지가 있는 부분이 방진 필름이 붙어 있는데 그것을 떼어 주세요 이렇게 했는데도 안된다면  건전지를 열어서 확인을 해보세요 건전지는 화살표로 표시한 곳을 옆으로 밀고 나서 빼내면 되네요 건전지를 빼는 방법이에요 라모건에도 표시가 되어 있기는 해요 지금 보는 대로 건전지가 들어 있는지 확인을 해보세요 저는 반대로 들어 있던 것 같아요 이 상태에서도 리모컨과 연결이 안 된다면 고객센터로 연락해 보시고요 리모컨하고 연결이 되면 리모컨 상단에서 초록빛이 나오게 됩니다 버튼을 눌러서 초록빛이 나온다면 연결이 본체와 잘 되어 있는 거예요  클럭 미니 마사지기는 두 가지 모드가 있어요 푸른빛 들어오는 블루 모드는 강하게 두드리고 주무르고 마사지를 해주고 하얀 빛이 들어오는 화이트 모드는 약하게  두드리고 침과 마사지 기능이 있어요 모드 설명은 따로 다시 하고요 본체 뒷면과 패드를 붙여 주면 됩니다 붙이면 딱 소리가 나는데요 정상적으로 패드와 잘 붙여 주고  사용을 하게 돼요 클럭 미니 마사지기는 저주파 진동으로 안전한 마사지가 가능하다고 하는데요 한의원에서 저주파로 물리치료하는 것보다 모드가 다양해서 좋더라고요 각각의 패드에는 접착이 가능한 두툼한 하이드로겔 타입의 겔 패드를 사용한다고 해요 뒷면의 스티커를 떼어내고 이 상태에서 마사지를 원하는 부위에 붙여 주면 됩니다 패드의 경우는 총 4가지가 나온다고 해요 저는 작은 것과 큰 것 하나만 구성품으로 들어 있었는데 추가 패드는 따로 구입을 하는데 가장 작은 기본 패드는 목덜미와 어깨 큰 패드는 굴곡진 곳에 사용하는데  팔뚝이나 종아리에 사용하면 좋다고 해요 대왕 패드는 넓은 부위를 한 번에 마사지를 하는데 허벅지나 등에 사용하라고 해요 발 패드는 발을 올려놓고 사용하면 발부터 발목까지 시원하다고 하네요 기본 패드 사이즈는 128*54mm 큰 패드는 175*68mm입니다 우선은 리모컨으로 작동 시에는 버튼을 누르면 소리가 나야 정상적으로 연결이 된 것이더라고요 소리를 없앨 수도 있지만 저는 소리가 나게 해서 사용 중인데요 블루 모드에서 두드리고 주무르고 마사지 기능이 느낌이 일정하지는 않더라고요 주무르는 것인지 잘 못 느끼고 대신에 톡톡 치는 것도 같고 떨리기도 하고 하더라고요 너무 강도를 높이면 몸이 부르르 떨 정도가 되어서 저는 거의 1~2단계 정도로만 마사지를 해요 두드리는 것은 두드리고 있구나 알겠는데 주무름과 마사지는 제가 느낀 것은 모호하네요 그렇지만 작아도 신기하게 성능은 강하네요 화이트 모드에서는 약한 두드림과 침, 마사지 기능이 있다고 하는데  특별히 차이점은 저는 잘 못 느끼겠어요 사용하면서 시원하다 느끼지는 않았는데 아마 병원에서 물리치료 받은 분들은 어떤 느낌일지 아실 것 같은데요 기본적으로 수기로 주무르는 안마와는 다른 방식의 미니 안마기 더라고요 대신에 패드는 굴곡이 있는 부위다 보니 자꾸 떨어지고 벌어지더라고요 완전 밀착을 안 해도 정상적으로 안마 느낌은 받는데 벌어지니까 처음에는 신경이 쓰이네요 지금 사진에서는 더 벌어졌지만 실제로 사용 시에 손목에 저런 상태로 붙이는 것보다 옆으로 붙이는 방식으로 변형해서 사용하면 좋겠더라고요 하지만 본인이 아프고 필요한 부위가 사람마다 다 다르므로 어떻게 패드를 붙이냐는 본인 몫이 아닌가 싶습니다 클럭마사지기는 저주파로 근육이  뭉친 곳을 수축하고 이완을 하면서 풀어주는 미니 마사지기에요 장시간 손목을 사용하는 분들에게는 꽤 효과가 있어 보이는데 실제로 사용해 본 딸도 어느 정도 시린 팔목이 덜 아프다고 하더라고요 저 같은 경우는 어깨가 많이 뭉쳐 있어서 사용을 해보려고 했는데 저주파 미니 마사지기는 한 번에 뭉친 근육을 다 풀어 주기는 저에게는 무리였어요 워낙 많이 뭉친 근육이라 두통까지 있는 정도라서 그렇다고 느꼈지만 일부분은 효과가 있기는 하네요 쇄골 부위에 패드를 붙이면 느낌은 안 좋았고 살짝 아픈 느낌이 들더라고요 그리고 타이머 기능은 없는 것 같은데 하루 1~3회라고 하고 한번 사용 후 동일 부위에는 충분한 시간차를 두라고 하지만 1회 어느 정도 사용하라는 말은 없네요 보통 병원에서 10분 정도 하나요? 그 정도 시간으로 저는 사용을 해봤는데 강도에 따라서 움찔거림이 기분 좋게 느껴지는 정도였어요 가로로 사용할 것인지 세로로 사용할 것인지 본인의 선택이나 접착력이 떨어지는 부위도 있답니다 몇 번을 여미고 사용한 경우도 생겼어요 특히 골곡이 있는 부이만 잘 접착해 주면 되겠어요 대형 패드는 허리나 다리에 사용하면 좋더라고요 전체적으로 고르게 자극이 오더라고요 사용 중에 삑삑 거림은 패드와 신체가 완전히 밀착하지 않을 때 울린다고 해요 이때는 다시 한번 전극 패드를 잘 접착을 해주고 사용하면 되겠어요 기존의 집에서 사용하는 안마기는 대부분 두드리는 방식이었다면 클락 미니 마사지기는 저주파로 근육이 뭉친 곳을 풀어 주는 방식이라고 해요 그래서 한번 사용한 것보다는 오래 사용하는 분들이 효과를 더 잘 느낄 것 같습니다",4155,28,"['본체와 리모컨을 연결하는 방법연결이 잘 안될 때 따라 해 보세요', '본체에 패드를 연결해 주세요', '이제 작동을 해볼까요']",3,https://postfiles.pstatic.net/MjAyMDAzMjlfMTMz/MDAxNTg1NDUwODQwNjE5.-mlXfkA7rQu-Dy7DjTHrnI8Jn0A2EDDewnGRshv0lQQg.L0FjddI_SnlyAOfH5kclb193-9zSNMrgwkXIyoKmqYEg.JPEG.wj_2169/SE-5917daf5-5964-4a53-a42f-22cb60d323b3.jpg?type=w966,https://postfiles.pstatic.net/MjAyMDAzMjlfNzUg/MDAxNTg1NDUwNTM3NjI0.TKc-2ZUSUplhZoqIRFZQErL9-oan7z1oRlpgEe2g8y8g.Dtl7jSC1kzpmTvRu4Wt9PIvM0XPYGXlN8XjFKX8A33sg.JPEG.wj_2169/SE-cde208e6-decc-44b7-81cd-70d7dcc80cbc.jpg?type=w966,36,0,0,0,0,0,0,0,0,0,0,0,0,0,0,0,0,1,0,0,0,0,0,0,0,0,0,0,0,0,0,0,0,0,9,9
https://blog.naver.com/PostView.naver?blogId=mmmmm46&logNo=222636637324,"클럭 마사지기S Duo, 내돈내산 후기",20220201,마사지기s 리뷰,클럭,"안녕하세요 ? 콩입니다 : D 저는 늘 어깨 뭉침에 시달리고 있는데요 피곤한 날이면 뭉침을 넘어 바늘로 콕콕 찌르는 듯한 심각한 고통을 느끼기도 한답니다ㅠㅠㅠ 그러다 보니 다양한 어깨마사지기를 보유 중인데 대부분 부피가 크다 보니 휴대용을 찾게 됐어요 이번 기회에 휴대도 가능한 클럭 마사지기를 정말 몇 달 내내 고민하다가 이제서야 구매했네요 요상하게도 마사지기를 모으는 취미가 있는지라 남편님 눈치를 보며 구매한 클럭 마사지기 처음 구매해보는 저주파 마사지기라 신나네요😊 클럭 미니 마사지기S Duo, 목어깨 집중 패키지로 S 본체 2개, 리모컨, 기본 패드, 큰 패드 구성이에요 겔 패드는 기본 패드, 큰 패드, 대왕 패드가 있는데 뒷목과 양쪽 어깨를 주로 사용할꺼라 가장 작은 기본 패드만 한 팩 더 추가해서 구매했어요😊 클럭 마사지는 정품 등록을 하면 등록 기간부터 1년 이내 무상 교환을 해주고 있으니 등록 필수 ! 제품 박스에 있는 정품 인증 스티커를 확인 후 클럭 온라인 스토어에 등록하면 되니 편리하네요 클럭은 저주파 방식으로 두 가지 모드가 작동되는데 블루 모드는 두드림(강), 주무름, 마사지가 있고 화이트 모드는 침, 마사지, 두드림(약)이 있어요 개인적으로 블루 모드를 좋아하는 편이랍니다 화이트 모드의 침이 약간 따끔거리는 것 같더라구요 제품 박스를 열어보면 품질보증서와 기본적으로 내장되어 있는 패드와 본체, 리모컨이 있어요 사이즈가 참 아담하고 귀여워요 마사지기가 이렇게 귀여워도 되는 건가요 ㅋㅋㅋ 리모컨이 있으니 본체가 보이지 않는 곳에 부착해도 쉽고 편하게 작동할 수 있으니 너무 좋아요~ 덤벙거리는 성격이라 부디 잊어버리지 않기를...😂 하이드로겔 패드 - 기본 패드 2개, 큰 패드 1개 한 박스당 3장의 패드와 보관 파우치가 들어있어요 겔 패드의 경우 주기적인 교체가 필요한데 평균 20-25회 사용 후 교체 권장이라고 되어있지만 보관 상태와 피부 상태에 따라 달라진다고 하네요 제가 사용해 본 결과 겔 패드 교체를 많이 했어요 주로 씻고 잠들기 전 클럭 마사지를 했었는데 무심코 바디로션 바르고 마사지를 하는 바람에 겔 접착력이 금방 떨어지더라구요😥 저는 저주파 마사지를 너무너무 좋아하지만 남편님은 느낌이 싫다며 아주 기겁을 해요😂 진짜 한 번만 해보라며 권유하고 사진을 찍었는데 약한 단계에도 불구하고 도망갔네요 ㅋㅋㅋ 허리 마사지에 가장 큰 대왕 패드를 사용하라고 권유하지만 생각보다 큰 패드로도 충분한 것 같아요 클럭 마사지기S 본체 부착 전/후 부착부분이 똑딱이처럼 생겼지만 자석으로 되어있어 쉽게 톡 부착이 되며 단단하게 고정된답니다 민감성 피부나 피부병 또는 알레르기가 있다면 먼저 테스트해보고 사용하시는 게 좋을 것 같아요 가끔 피부에 살짝 상처 나거나 하면 따끔하더라구요 또한 동일 부위에 연속 사용 금지 ! 저주파 마사지는 25분간 진행되는데 시원해서 실험적으로 연속 사용했다가 따가웠어요😥 그래서 어깨 사용 시 본체 두 개를 사용하기보다 한쪽씩 번갈아 사용하고 있네요 ㅋㅋㅋ 각 보관 파우치가 있어서 깔끔하게 보관이 가능하고 미니미한 사이즈로 휴대성까지 좋아 여행 갈 때도 가방에 필수품으로 챙겨갈 것 같네요👍 작지만 저주파 자극은 확실한 클럭 마사지기 패드 크기에 따라 뒷목부터 발바닥까지 마사지가 가능하니 매일 애용하고 있답니다 ㅎㅎㅎ 패드는 주기적으로 구매해야 할 것 같지만 하나쯤 있으면 참 좋은 것 같아 추천해요 ! #클럭 #클럭마사지 #클럭마사지기 #저주파마사지 #저주파안마기 ",1706,13,"['클럭 마사지기S Duo, 내돈내산 후기']",1,https://postfiles.pstatic.net/MjAyMjAyMDFfMTkw/MDAxNjQzNzI1ODkzODgx.tvGxR9liw1Mnkz2kaNkgoPEESXerfs_BEc_oNwetnMwg.wR5l7dH4N15lQl5k9emwzyDcavIZ0cGANcI8rbX_-lkg.JPEG.mmmmm46/SE-9104c43c-21da-45eb-bb41-68097f23400a.jpg?type=w966,https://postfiles.pstatic.net/MjAyMjAxMjhfMTAz/MDAxNjQzMzQ2ODk2ODg5.GuDCAlqOsLE1FhFnt8tzeF8IJfGHlYKXXjsP3IytqbMg.AHKpl8BWrdjoZC_1WUSNd7KU-1dfxsbgTAkHlfxq5BQg.JPEG.mmmmm46/%ED%81%B4%EB%9F%AD_(18).jpg?type=w966,21,0,0,3,3,3,0,1,0,0,0,0,0,1,1,1,0,0,0,0,0,0,0,0,0,0,0,0,0,0,0,0,0,0,9,9
