url,title,post_date,검색어,브랜드 명,content,content_cnt,content_line,quote,quote_cnt,first_img,last_img,img_cnt,솔직 빈도 수,비교 빈도 수,ㅋ 빈도 수,ㅋㅋ 빈도 수,ㅋㅋㅋ 빈도 수,ㅋㅋㅋㅋ 빈도 수,... 빈도 수,.... 빈도 수,ㅜ 빈도 수,ㅜㅜ 빈도 수,ㅜㅜㅜ 빈도 수,ㅜㅜㅜㅜ 빈도 수,ㅠ 빈도 수,ㅠㅠ 빈도 수,ㅠㅠㅠ 빈도 수,ㅠㅠㅠㅠ 빈도 수,장점 빈도 수,단점 빈도 수,비속어 빈도 수,허락 키워드,내돈내산 키워드,리얼후기 키워드,협찬 키워드,체험단 키워드,coupa.ng 키워드,< 키워드,> 키워드,♡ 키워드,♥ 키워드,구매후기 키워드,한달 키워드,두달 키워드,세달 키워드,광고 분류1,광고 분류2
https://blog.naver.com/PostView.naver?blogId=lights0401&logNo=222097939599,클럭 미니 마사지S 아픈 팔꿈치 를 위해서 사용 후기,20200923,마사지기s 리뷰,클럭,"몇 년 전에 실내스포츠를 하다가 팔꿈치를 크게 다치고 나서, 수술을 하게 되었다. 그 후부터 운동을 하게되면 왼쪽 팔꿈치만 많이 근육이 땡기게 되었다. 그러다 보니 운동을 이전처럼 많이는 하지 못할때가 많았다. 병원에서도 마시지를 받아보기도 했지만, 뭐 특별하게 시원하거나 완벽하게 해결되기는 어렵다는거 알았다. 운동을 그만두면 해결이 되겠지만, 그렇다고 운동을 그만둘수 없다보니, 최근에 클럭 마니 마사지를 구매 했다. 처음에는 별로 효과 없을 것 같아서 방송에서 광고를 하고 있어도 전혀 생각이 없었는데, 아버지 사용을 하고 있는데, 나름 괜찮다고 이야기를 하다보니 나도 구매를 하게되었다.  본체 1개. 리모콘, 충전케이블, 어뎁터, 기본패드 1개 큰패드1개 ,설명서 이렇게 구성이 되어 있다. 특별히 자주 사용하지 않을 듯 하다보니, 나는 이정도면 충분하다고 생각이 들었다, 그리고 아무래 사람들에게 인기가 높도  판매량이 높았다고 해도, 얼마나 효과가 있을까 하는 생각에 우선은 기본으로 이정도로 써보고 나서 생각을 해보기 했다. 클럭 미니 마시지는 사용은 매우 간단하다. 그러다보니 누구나 쉽게 사용을 할수 있겠다는 장점을 보이고 있다. 부착형 패드에는 겔타입으로 피부를 부착하는 효과와 함께 저주파가 보다 효율적이 될수 있도록 하고 있다고 설명을 했다. 사용하게 될 부위에 패드를 붙이고 나서 본체를 장착하거나, 또는 미리 본체를 패드에 장착을 하여서 사용할 부위에 사용해도 상관은 없다. 주로, 목, 팔목, 등, 허리, 종아리 등등 관절 부위를 피하고 사용하면 좋다고 한다. 패드는 총 25회 정도 사용을 할 수 있다고 한다. 아무래도 피부에 붙는 것이다보니, 그 정도 사용을 하게 되면 접착력이 떨어지기 때문에  그 후에는 교환을 해줘야 하는 것 같다. 아버지가 사용하고 있는 클럭 미니 마사지도 대략 20회 정도 사용 했다고 하는데, 접착력이 많이 떨어진걸 알 수 있었다. 사용전에 본체와 리모컨을 연결을 하여야 무선으로 조작을 할 수가 있다. 물론 리모콘이 없이도 충분히 클럭 미니 마사지를 사용을 할 수가 있다. 하지만, 리모콘이 있으면 등이나 허리등에 부착을 하고 나서 조작을 하기가 매우 편하긴 하다.  본체와 리모콘의 연결법은 설명서에 자세히 나와 있다보니, 설명서를 따라서 하면 된다. 홈페이지에서 설명하고 있는 내용이다. 안심 하이드로겔을 사용하였다고 한다. 클럭 미니 마사지에 사용이 되는 하이드로겔은 뭔지 궁금하다보니 인터넷에 알아보니. 하이드로(hydro-) 물을 뜻한다고 하며, 겔(gel)의 경우는 농도가 높은 유동성 물질이라고 한다. 수분이 많이 들어 있는 물질이며, 주로 피부나 상처의 보습을 하는데 사용을 하기도 한다고 한다. 또한 특수한 약물의 성분을 전달하는 용도로도 많이 쓰인다고 한다. 점성이 뛰어나다보니, 피부에 부착하는데 용이 하나보다. 그렇다고 해서, 팔에 찰짝 붙는것도 아닌듯하다. 내자 주로 사용하는 부위는 팔꿈치와 목 뒤쪽 부위다., 컴퓨터를 많이 하다보니, 거북목 증상을 자주 느껴지다보니, 그 부위와 골절 수술을 한 부위 주변에 사용을 하고 있는데, 클럭 미니 마사지 패드가 점성은 있지만, 뛰어난것이 아니라서 움직이게되면 떨어지는 경우가 발생하더라구요. 그렇다고 너무 잘떨어지는것도 아니고, 가만히 마사지 받고 있는다고 생각을 하면, 그래도 잘 붙어 주는 편이라고 본다. 혹시나 패드를 때거나 할 때 통증이 있지 않을까 했는데, 그런 느낌은 전혀 없다. 클럭 미니 마사지는 2가지의 저주파 모드를 가지고 있는데요. 이 저주파 가 손이 닫지 않는 근육들까지 EMS 저주파로 뭉친곳을 시원하게 수축과 이완을 시켜준다고 한다. 두가지 모드는 블루 모드와 화이트 모드가 있는데요. 블루 모드: 두드림(강)/ 주무름/ 마사지 화이트 모드 : 두르림(약) 침 / 마사지 이렇게 구분을 할 수가 있다고 한다. 2가지 모드와 3가지의 동작을 하게 되는데, 15가지 단계로 강도를 직접 조절을 할 수가 있는데, 강도의 표시는 나타나지 않아, 아쉬움이 있다. 만약 다음 세대 제품이 나오게된다면, 아마도 작은 화면이 추가 되어, 단계가 표시 되고, 마사지 시간이 나타나지 않을까 생각이 든다. 그렇게 되면 아무래도 가격도 상승하지 않을가 싶다. 부모님이 사용을 하고 있어서, 쓸만 하다는 말과 여분의 패드가 필요하다는 말을 듣고 패드를 살겸 내것도 구매를 해봤다. 그리고 추가로 무릎이 평소 좋지 못하는 아버지를 위해서 무릎 패드도 같이 구매를 했는데, 그건 아무래도 아버지 사용을 하고 나서, 후기를 써야 할 듯 하네요. 클럭 미니 마사지 를 처음 부착을 하고 강도를 올려볼때는 너무 약하다 싶어서 이게 무슨 효과가 있을까 싶을 정도 였는데, 단계를 점점 강하게 올리다 보니, 세삼 놀라울 정도 강도가 쎈것도 있다. 너무 아프다 싶어서 다시 강도를 낮추기도 했다. 이 마사지기는 정말 확실히 장점은 뚜렸하다.. 아무래도 집에서 사용할수 있는 마사지기는 솔직히 별로 없다고 볼수가 있다. 더구나 이런 저주파 마사지기는 병원에서 받거나 또는 너무 고가의 가격의 안마기 등이 있다보니, 쉽게 구매를 하지 못하게 될수가 있는데 말이다. 하지만, 지금 이정도의 가격은 큰 부담은 없다. 그렇다보니 사람들이 덜 부담스러워 하면서 구매를 하게되고, 생각보다 괜찮은 능력 때문에 놀라워서 사용을 꾸준히 하게 되는 것 같다. 그리고 기본패드부터, 패드의 크기 등등 무릎/ 발 등 다양한 종류등으로 있었다. 그렇다고 단점이 없는건 아니다. 가장 아쉬운 부분은 바로 패드의 접착력이라고 본다. 새 패드를 사용해서 팔꿈치 위쪽에 붙이고 컴퓨터를 조금 하였는데 끝에서부터 조금씩 떨어짐이 보였다. 마사지 시간 약(25분) 동안 완전하게 떨어진 것은 아니지만, 신경이 쓰이는 정도이긴 했다. 그리고 마사지 시간이나 강도가 표시 될수 있는 화면이 있었으면 하는 아쉬움이 크다. 추석에 아버지 드리려고 산, 무릎 밴드는 추석 끝나고 후기를 써볼생각이다. 아 구매를 하면서 알게 되었는데, 구매를 할 때 카톡추가를 하게되니까 기본패드3장을 무료로 받을 수가 있었다.",2960,9,"['클럭 미니 마사지S 아픈 팔꿈치 를 위해서 사용 후기', '1. 클럭 미니 마사지S : 구성품', '2. 사용법', '3. 안심 하이드로겔 ?', '4. 저주파 2가지 모드', '5. 클럭 미니 마사지 실제 사용한 후기']",6,https://postfiles.pstatic.net/MjAyMDA5MjNfNSAg/MDAxNjAwODY4Mjc2MzMz.fE-3mW2WiVTZAend-BFvk6wwWma8oqtsS5lMspQsM2og.14YUGphNWrCKgPjalWBBqGHEFnRAeJ4PH-394ev8sCEg.JPEG.lights0401/IMG_5905.jpeg?type=w773,https://postfiles.pstatic.net/MjAyMDA5MjNfNzIg/MDAxNjAwODY4NDg3OTg2.Xj9_N5f5TLgvX78X-jpAa_K1rc81qHe8y_mmndQ_qwkg.HjomV9Bl3wtEs4lTPji4SBPtkuROMEfJASWIlj5-oywg.JPEG.lights0401/IMG_5988.jpeg?type=w773,10,1,0,0,0,0,0,0,0,0,0,0,0,0,0,0,0,2,1,0,0,0,0,0,0,0,0,0,0,0,0,0,0,0,0,0
https://blog.naver.com/PostView.naver?blogId=kjs682121&logNo=222168613443,클럭 미니 마사지 SE 실사용후기,20201210,마사지기s 리뷰,클럭,"안녕하세요~ 리뷰 요정이예요 오늘은 제가 친구로 부터 선물받은 클럭 미니 마사지 SE의 실 사용후기에  대해서 말해보겠습니다. 클럭 미니마사지기  외관은 이렇게 검정색으로 고오급스럽게 되어 있어요, 선물하기 넘 좋은거 같아요, 저도 선물로 받았지만요, 헤헷 처음에 비싼제품 아닌가(?)하고 부담이 됐지만, 생각했던 것 보다 가격도 괜찮더라구요 바로 위 사진은 정품 스티커 내의  인증번호를 클럭 온라인 스토어에  등록하면 무상 a/s를 받으실수 있어요 그리고!!!! 구매일로부터 1년 이내 , 제품 사용 중 기기 이상으로 문제 발생시 무상으로 교환도  가능하다고 하니 반드시 인증번호를 등록해 두세요~ 요렇게 본체가 정갈하게 들어가 있네요 왼쪽 끈을 살짝 잡아 당기면   쏙! 나와요 구성품은 본체 1개 usb 케이블, 어댑터 기본패드1개, 큰패드 1개 보관용 파우치 2개 설명서 요렇게 있어용 패드와 본체에 똑딱이에 딱! 붙이면 되요 자석으로 되어 있기 때문에 소리 '딸깍' 날때까지 맞춰주시면 되용 한쪽 면의 필름을 뗀 뒷면이예요 겔타입이구요,  한 4~6번 썼더니 살짝  끈적이는게 덜한거 같애요, 겔타입인 하이드로겔 패드는 주기적으로 교체가 필요하대요 평균 (20~25회 사용후 교체 권장) 소모품 입니다. 하이드로겔은 마스크팩 콘택트 렌즈에도 사용되는 안심 하이드로겔이라고 해요 눈에도 사용한다고 하니 안심하셔도 되겠죠?!! 위에 사용설명서예요  참고하세요~~ [마사지 조작 방법] ● 사용시작은 +버튼을 2회 누르기 ● 사용중단은 -버튼을 3초간 누르기 ● 모드 변경은 M  (블루/화이트) ○ 블루모드: 두드림(강)주무름, 마사지/ 동작 반복 ○ 화이트 모드: 침, 마사지, 두드림(약)/ 동작 반복 클럭 미니마사지 SE는 저주파가 근육을 자극하는 방식의 마사지기예요 물리치료 받을때와 같은 느낌이 나요 저는 컴퓨터 앞에   주로 많이 앉아 있는데, 어깨가 많이 아프거든요, 잠깐 해 줬더니 어깨가 좀 풀리는거 같더라구요. 본체예요~ 화이트 모드 입니다~~ 동영상에 반응이 없어보여도  자극이 많이 왔어요,  팔에 하니까 아프더라구요 어깨에 했을때는 시원했답니다. 그런데!!  클럭 미니 마사지 SE는  구성에 리모콘이 없더라구요 저는 주로 등 이나 어깨에 해야하는데 그때 등이나 어깨에 부착하고 작동 시작하려하면 누르기 어려워요  작동 할때마다  가족의 도움이 필요합니다.   혹시 이걸 보시는 분중에  등과 어깨에 하신다면 리모콘이 있는걸 추천드려요~ #클럭미니마사지기SE #클럭미니마사지S #클럭 #마사지 #안마기 ",1250,14,[],0,https://postfiles.pstatic.net/MjAyMDEyMDlfMjAy/MDAxNjA3NTE5NTM2ODA5.uZ16iY4f7XeyPGMZRRFY51B7nk7c4tLWEuVDiYLzOxEg.b9mgAkGdomv43h2RRu_0FsLLEARRlZh5bObRtsU7LRQg.JPEG.kjs682121/1.jpg?type=w966,https://postfiles.pstatic.net/MjAyMDEyMDlfMTM4/MDAxNjA3NTE5NTg4MDg2.ZPzIrRXDXk_CtEEbS8L6eoq6iVY_cO2T-sdrfekzJJ4g.X3UMUOGRCScuG0Z1EG8bZkZgXnO5U2vjLFK0ItSs6JYg.JPEG.kjs682121/14.jpg?type=w966,17,0,0,0,0,0,0,0,0,0,0,0,0,0,0,0,0,0,0,0,0,0,0,0,0,0,0,0,0,0,0,0,0,0,9,9
https://blog.naver.com/PostView.naver?blogId=gsi38425&logNo=222357407997,클럭 미니 마사지기S SP-308W 후기,20210519,마사지기s 리뷰,클럭,"클럭 미니 마사지기S SP-308W ★★★★☆ 리뷰 4,626 현재 75,000원에서 33% 할인하여 49,810원에 판매되고 있습니다. 로켓배송 제품은 배송비 무료에요 감사합니다. [상품페이지 / 리뷰보기]",116,3,[],0,https://postfiles.pstatic.net/MjAyMTA1MTlfMTEw/MDAxNjIxNDEzNTY3OTg1.k7MnPLRObGaZx0sKRAPMttxzxTAzW94Vbh7kX5oTdRgg.wfEeeZl59ATC-EI3EGVcOSbxJs8_ZLp1ho4oXl5g9ekg.JPEG.gsi38425/8d91aed0cfe45c0.jpg?type=w80_blur,https://sjsew.uisashop.com/image,2,0,0,0,0,0,0,0,0,0,0,0,0,0,0,0,0,0,0,0,0,0,0,0,0,0,0,0,0,0,0,0,0,0,9,9
https://blog.naver.com/PostView.naver?blogId=yeonrokgol315&logNo=222186789203,"클럭  미니 마사지기S SP-308W, 탁상용가전 펙트후기",20201227,마사지기s 리뷰,클럭,"아름다운 가격은 49,900원 으로 구성되어 있습니다. 정말 최고에요. 이유는 지금부터 알려드릴게요. 구체적으로 상품을 소개해드리려면 사진과 실제 구매자 후기가 있어야겠죠. 마사지 기 쓰기 좋아요 편하고 성능 도 좋고 맘에 들어요 가벼워서 더 좋아요 편리해요  여러분들께 소개해드리는 상품은 강조하는 이유를 혼자만 쓰기엔 아까운 상품이에요. 모든 성별의 사람들이 사용해보고 품질에 대한 우수함을 느꼈습니다. 오늘의 픽 게시글을 확인하셨다면 상품에 대한 상세정보를 클릭하여 확인해보세요. 리뷰는 만족스러우셨나요? 위에 있는 버튼을 클릭하신다면 더 많은 후기 사진을 확인할 수 있어요. 이 글을 보고 있는 유저분들께서 더 많은 정보를 습득해보세요! 육감적인 디자인 편안한 사용감 원하던 모든 기능을 갖추고 있네요. 꾸준히 활동하는 블로그입니다. 여러분과 소통하면서 좋은 상품만 소개해드리고 싶어요. 오늘의 픽! 오늘 선택받은 상품 잘보셨나요. 알뜰한 정보 알아올게요. 다음 포스팅에서 만나요. 해당 포스팅을 통해 수수료를 제공받을 수 있습니다.",526,9,['오늘 지금 뜨는 상품 클럭 미니 마사지기S SP-308W 같이 보실까요'],1,https://postfiles.pstatic.net/MjAyMDEyMjdfMzYg/MDAxNjA5MDM1NzI2NzQ1.LEFBIayyEZccCFX387OEp_ChnBSzVIZwfu5qnRnyaHsg.N164hnmKn8lHp6fPa2Y4KyGOCC1bXCAmdOirSrnudF4g.PNG.yeonrokgol315/SE-72224f4d-7794-43f4-9f6d-99721aec5359.png?type=w966,https://postfiles.pstatic.net/MjAyMDEyMjdfMTY4/MDAxNjA5MDM1ODM2MDY0.q1Jy1aHsO9WL1kh9wD3S7cBzT6-h6B4QTCYa38d-lB8g.rdgUV4FrgJoJo7tDHWYzsI6_4yLp_WuLiW-4ZO51pmkg.PNG.yeonrokgol315/button_4.png?type=w966,17,0,0,0,0,0,0,0,0,0,0,0,0,0,0,0,0,0,0,0,0,0,0,0,0,0,0,0,0,0,0,0,0,0,9,9
https://blog.naver.com/PostView.naver?blogId=yoongeezzang&logNo=222085736934,"클럭 미니 마사지기S SP-308W 추천 (+구매처,후기,정보 등)",20200910,마사지기s 리뷰,클럭,"#클럭 #클럭마사지기 #클럭미니마사지기 (구매페이지는 포스팅 맨 하단에 있어요~ and,, 협찬 아니에요 ㅠ.ㅠ 안들어와요ㅋㅋㅋ) 요즘 집에서 컴퓨터를 하도 많이 하다보니 어깨결림이 심하더라구요.. (만성질환인 것 같기도하고..ㅠㅠ매일아파요) 그래서 알아본 클럭마사지기! 구매하려다가 보니까 쿠팡에서 저렴하게 판매하길래  혹시 구매 하실 분들 계시면  참고하시는 것도 좋을 것같아 정보 공유합니당! 사진부터 보여드릴게요^^ 콤팩트한 크기로 들고다니기에 휴대성도 좋고 간편한 작동방법으로 남녀노소 쓰기에 무리가 없을 것 같아요! 선물세트 같은 구성박스도 맘에 들어요 ㅎㅎ! 실제 사용하신 분들의 후기도 한번 보여드릴게요! (구매페이지는 포스팅 맨 하단에 있어요~) <클럭 미니마사지기S SP-308W 구매후기> 1. 광고를 우연히 보다가 기존의 안마기보다 작은 미니사이즈라 구매했어요~ 전원 키고 안마할 부위에 붙여놓기만 하면 마사지가 되니까! 그리고 충전식이라 오래 사용도 가능하구요 역시 배송도 빠르니 좋더라구요 ㅋㅋ <클럭 미니마사지기S SP-308W 구매후기> 2. 부피가 작아서 휴대나 보관이 용이해요 시부모님이 어깨가 아프다는 말씀을 자주하셔서 선물로 드렸는데 따로 포장하지 않아도 고급스러운 선물 같아서 좋구요 주위에서 평이 좋아서 구매했는데 카카오플러스친구로 가격 디씨 받고 추가상품으로 패드도 더 받았습니다~ 합리적인 가격으로 구매한 것 같아 기분이 좋아요 <클럭 미니마사지기S SP-308W 구매후기> 3. 보통 선물용으로도 많이 구매하시는 것 같네요 저는 저를 위한 선물로 사야겠어요ㅋㅋ 곧 추석인데 클럭마사지기 드리는 것도 괜찮네요~ 가격도 저렴하고 구성도 좋으니까요! 혹시 구매하실 분들은 참고하셔서 구매하시면 될 것 같아서 밑에 정보 써놨어요~~ 들어가셔서 자세한 정보 보시고 구매하시면 됩니당 쿠팡에서 클럭마사지기 구매하기 ▼ 위 사진 클릭하시면 구매페이지로 연결돼요! 좋은 제품 정보 찾아서 소개해드리려고 노력합니다:) 읽어주셔서 감사드립니당~~~ 좋은 하루 되세요 ㅎㅎ!",1007,10,"['클럭 미니마사지기S SP-308W', '클럭 미니마사지기S SP-308W 구매후기']",2,https://postfiles.pstatic.net/MjAyMDA5MTBfMjI4/MDAxNTk5NzEyNzEzMDIy.KortgXfJ3TLbMthjIB1Hjgfrm03xK-McagKKuUYj-AAg.yc894tFl8fImiMiI5kTdDpF_HWtY6M2dCA5wKJBAcqcg.PNG.yoongeezzang/1.png?type=w966,https://postfiles.pstatic.net/MjAyMDA5MTBfMTc5/MDAxNTk5NzE1ODg1Nzkz.amjrxn16nP1wFNWxVuqxYmlOxp1p6ZQ0k_3L5LhpBCQg.JBUF0c_4z1pPDrwxOXjxXEr8NgSnHGX3h0QRFV-mj6sg.JPEG.yoongeezzang/DFDF.jpg?type=w966,6,0,0,3,3,1,0,0,0,0,0,0,0,2,1,0,0,0,0,0,0,0,0,1,0,0,1,1,0,0,1,0,0,0,1,2
https://blog.naver.com/PostView.naver?blogId=sinbi1975&logNo=222103199214,클럭 미니 마사지기S SP-308W 홈마사지 후기,20200929,마사지기s 리뷰,클럭,"안녕하세요.!! 구대청산마루입니다. 금일 포스팅은 클럭 마사지기에 대하여 알아볼려고 합니다. 평상시 사무실에서 매일 앉아서 컴퓨터로 일을 하는터라 어깨며, 목이며 팔, 다리가 계속 많이 아파오더라구요.  그래서 이것저것 찾아보다 클럭 마사지기를 알게되어 구입하게 되었네요.  마사지기 패드가 특별하다.!! 마스크팩, 콘택트 렌즈에도 사용되는 안심 하이드로겔을 사용함으로 마사지 효과를 극대화하고, 두툼한 겔 패드가 시중 제품과는  확연히 비교될 만큼 두툼한 하이드로 겔 성분의 겔패드를 사용하여, 더욱 시원한 마사지를 받으실 수 있습니다. (※단, 개인의 피부 타입에 따른 차이는 발생할 수 있다고 합니다.^^) (※발 패드에는 하이드로겔이 사용되지도 않는다고 하네요.^^) 마사지에 적합한 저주파!!  사람몸의 마사지에 가장 적합한 저주파 자극으로 안전하면서도 온몸의 속 근육들에게 고루 잘 전달이 될수 있도록 설계되어져 있다고 합니다.  손이 닿지 않는 속 근육까지 EMS저주파가 깊숙하게 내려가 뭉친 곳을 시원하게 이완하고 수축을 시켜 근육을 풀어준다고 하네요. 무선과 세분화되어져 있는 맞춤형 모드 장착!!  언제 어디서나 무선이기에 간편하게 부착하여 사용이 가능하다. 실내에서든, 야외에서든, 사무실과 같은 공간에서도  아주 간편하게 부착하여 사용 가능하며, 무선 리모콘으로 눈에 보이지 않는 곳과 여러 곳을 동시에 작동이 가능하다고 하네요.  그리고 세분화 되어져 있는 모드 기능으로 모드별로 3가지 동작이 가능하며 강도조절이 15까지 가능하게 되어져 있어 맞춤형으로 사용이 가능하다고 하네요.^^ 온몸의 여러 곳과 아무곳이라도 부착이 가능하고, 1년동안 무상보증 서비스도 있다고 하네요. 사용을 해보니, 상당히 편하면서도 그날그날 뭉쳐있던 근육들이 좀 풀리는 듯합니다.(개인적 생각임.) 좀 더 사용해 보고 부모님께 하나 선물할려고 생각중이네요. 단점이 있다면, 일정 사용을 하고나면 겔패드를 바꾸어 주어야 한다는 겁니다. 검색해보시면 패드만 따로 구입을 할 수 있게 해놓았네요.^^ TV에서 광도도 많이하고, 인지도가 있는 상품이라 필요하신 분들은 구입을 하셔도 후회는 없을거라 생각이 듭니다. 이 포스팅이 상품 고르시는데 조금이나마 도움이 되었으면 합니다. !!",1107,8,"['클럭 마사지기를 사용시 꼭 알아야할 것들.첫번째!', '클럭 마사지기를 사용시 꼭 알아야할 것들.두번째!', '클럭 마사지기를 사용시 꼭 알아야할 것들.세번째!']",3,https://blogfiles.pstatic.net/MjAyMDA5MjlfMTY2/MDAxNjAxMzc0ODEyMTk2.rNGOfvYLdne-_n0PsUX5U1hU0tPAXKudg43LxRDQbLAg._T8d5iRVOA6kj0P-kYNOXojd_OhXqxqUzTqAdE1-BH4g.PNG.sinbi1975/image.png?type=w1,https://blogfiles.pstatic.net/MjAyMDA5MTJfMjgx/MDAxNTk5OTEyOTEzNTY1.p2CKbr0nFxHPuYOfFvI20gsykMHqWUlBP_ZhAy7_eRAg.U6aohZNEm06DrnT_ITRi35YIwWV3R-KUf3au06c-xBcg.PNG.sinbi1975/image.png?type=w1,14,0,1,0,0,0,0,0,0,0,0,0,0,0,0,0,0,0,1,0,0,0,0,0,0,0,0,0,0,0,0,0,0,0,0,0
https://blog.naver.com/PostView.naver?blogId=gunchocho9654&logNo=222622785985,나를 챙기는 첫 걸음 :: 클럭(Klug) 미니 마사지기 S(E) 리뷰... ,20220118,마사지기s 리뷰,클럭,"안녕하세요 잇님들! 오늘은 집안의 잇템인 저주파 마사지기, 클럭 미니 마사지기 S(E) 리뷰를 해보려해요. 책상에 장시간 앉아있거나 몸이 쑤실 때 하나쯤은 있으면 좋다는 저주파 마사지기죠~ 저는 클럭 마사지기의 S(E) 라인 제품을 사용했어요. 그냥 S와는 리모컨 구성만 차이가 있는 제품이죠. 지난 생일, 친구가 선물해줬던 제품인데 일을 하던 도중 쑤시는 곳이 많아 개봉했습니다. (친구야 고마워 ㅠㅠ~!) 본체, USB 케이블, USB 어댑터, 기본패드, 큰 패드, 보관용 파우치 설명서에 적혀있는 구성과는 조금 다르게 친구가 여분 패드를 넣어준 모양이에요. 저는 피부 테스트기와 여분 패드가 더 들어있었습니다 (센스만점 내친구 ㅠㅠ~! 고마워! H야!) 본품 박스에는 마사지기가 깔꼼하게 들어있었습니다. 전체 구성품 샷입니다. 풍족해 보여서 보기 좋군요. 후후. 마사지기 본체 마감도 나쁘지 않았습니다. 본체의 충전 단자를 보니 C타입 충전은 아니었어요. 약간 아쉽군요. 충전기에 연결하니 빨간 불이 들어왔어요. 설명서를 보니 충전이 완료되면 빨간 불이 꺼진다고 써져있네요. 일단 충전을 시키고~ 우선은 피부 안심 테스터를 먼저 사용해봤습니다. 저주파 마사지기라 패드를 피부에 부착해서 사용해야하니까요. 이런 부분까지 세심하게 챙기는 브랜드는 처음이라 감동 했습니다. 테스터기 설명대로 팔 안쪽에 붙여서 1시간 정도 지난 후 떼어냈습니다. 72시간 정도 지나야 제대로된 반응을 볼 수 있지만 성격 급한 저는 그냥 이대로 제품을 사용했어요. 일반 패드입니다. 작은 사이즈의 패드죠. 패드에는 자석이 있어 딱 달라붙더라구요. 본품을 사진처럼 부착하고 사용하면 됐어요. 본품을 부착하고 패드 비닐을 떼어냈습니다. 패드 비닐은 버리지 마세요! 사용한 후에 다시 부착해서 보관해야합니다. 이렇게요! 팔에 부착해서 [+] 버튼을 누르니 저주파 기운이 팔을 타고 올라왔어요. (원래 파란색 불빛인데 GIF로 만드니 흰색으로 보이네요 ㅠㅠ) 뭔가 느낌이 드드득~? 하며 근육이 조였다 풀어지더라구요. 런닝맨에서 저주파 마사지기 하고 젠가 할 때, 왜 손을 그렇게 떨었는지 알 것 같은 ㅋㅋ 1단계로만 했는데도 시원했어요. [+], [-] 버튼으로 세기 조절이 가능했고 설명서를 보니 1단계 ~ 15단계 까지 있네요. 모드 변경도 해봤습니다. 원래 팔목같은 관절에는 사용하면 안된다네요. 그걸 몰랐습니다 ㅠ 모드 변경 모습만 살짝 보여드릴게요. [M]버튼을 누르면 흰색 LED가 나오며 모드가 변경됩니다. 모드 변경 후 [+] 버튼을 눌러주세요. 그 외에 사용법은 설명서를 참고하면 돼요. 아주 자세히 그림/사진과 함께 설명되어 있어서 이해하기 쉬웠어요. 설명서도 세심해서 사용자를 얼마나 배려하고 있는지 알 수 있었네요 ㅎ 일상에 지친 하루.. 피로를 마사지기로 풀 수 있어 좋았어요. 앞으로의 제품도 기대가 되네요~",1404,19,['클럭 미니 마사지기 S(E) 구성품'],1,https://postfiles.pstatic.net/MjAyMjAxMTVfMjY0/MDAxNjQyMjU3MzUwNDUx.7Y_EIrrXb-K69X33UmG65dCG0K7wttKkG1mGNQY2I6Ug.6cfypuvyM5t3lgGgsXoCf6jn7kshk9gUfg7lWw3DPCIg.JPEG.gunchocho9654/20220115_182507.jpg?type=w773,https://postfiles.pstatic.net/MjAyMjAxMTVfMTI1/MDAxNjQyMjU4NzYwNTk1.fFBaqyJX333_L1Z2y5-Ert6_Oq-kV6rfiBp1ic9sye4g.I_RpLzuC_Nq3B_b0HSKPXduPzpcsn_-YxbNhDS6tD9Eg.JPEG.gunchocho9654/20220115_182851.jpg?type=w773,23,0,0,1,1,0,0,0,0,0,0,0,0,4,3,0,0,0,0,0,0,0,0,0,0,0,0,0,0,0,0,0,0,0,9,9
